No.,Time,Source,Destination,Protocol,Length,Info
1,0.000000,10.113.171.201,10.113.112.211,DNS,68,Standard query 0x557b A mqtt-mini.facebook.com
2,0.015826,10.113.171.201,10.63.57.221,TCP,60,33412  >  443 [SYN] Seq=0 Win=65535 Len=0 MSS=9960 SACK_PERM TSval=30980541 TSecr=0 WS=256
3,0.022208,10.113.171.201,10.113.112.211,DNS,62,Standard query 0xab77 A mtalk.google.com
4,0.027662,10.113.171.201,10.113.112.211,DNS,60,Standard query 0x2525 A g.whatsapp.net
5,0.030699,10.113.112.211,10.113.171.201,DNS,113,Standard query response 0x557b A mqtt-mini.facebook.com CNAME mqtt-mini.c10r.facebook.com A 157.240.3.34
6,0.031606,10.63.57.221,10.113.171.201,TCP,48,"443  >  33412 [SYN, ACK] Seq=0 Ack=1 Win=4096 Len=0 MSS=9960 WS=256"
7,0.032104,10.113.171.201,10.63.57.221,TCP,40,33412  >  443 [ACK] Seq=1 Ack=1 Win=79872 Len=0
8,0.045037,10.113.171.201,10.63.57.221,TLSv1.3,446,Client Hello (SNI=mqtt-mini.facebook.com)
9,0.045695,10.63.57.221,10.113.171.201,TCP,40,443  >  33412 [ACK] Seq=1 Ack=407 Win=1048064 Len=0
10,0.049542,10.113.112.211,10.113.171.201,DNS,107,Standard query response 0xab77 A mtalk.google.com CNAME mobile-gtalk.l.google.com A 74.125.135.188
11,0.050242,10.113.112.211,10.113.171.201,DNS,99,Standard query response 0x2525 A g.whatsapp.net CNAME chat.cdn.whatsapp.net A 157.240.3.55
12,0.063061,10.113.171.201,10.2.188.222,TCP,60,51994  >  5222 [SYN] Seq=0 Win=65535 Len=0 MSS=9960 SACK_PERM TSval=30980669 TSecr=0 WS=256
13,0.070569,10.113.171.201,10.38.181.139,TCP,60,48816  >  5228 [SYN] Seq=0 Win=65535 Len=0 MSS=9960 SACK_PERM TSval=30980671 TSecr=0 WS=256
14,0.072404,10.63.57.221,10.113.171.201,TLSv1.3,276,"Server Hello, Change Cipher Spec, Application Data"
15,0.072862,10.113.171.201,10.63.57.221,TCP,40,33412  >  443 [ACK] Seq=407 Ack=237 Win=80896 Len=0
16,0.078043,10.113.171.201,10.63.57.221,TLSv1.3,46,Change Cipher Spec
17,0.078236,10.63.57.221,10.113.171.201,TCP,40,443  >  33412 [ACK] Seq=237 Ack=413 Win=1048320 Len=0
18,0.078681,10.113.171.201,10.63.57.221,TLSv1.3,98,Application Data
19,0.078826,10.63.57.221,10.113.171.201,TCP,40,443  >  33412 [ACK] Seq=237 Ack=471 Win=1048320 Len=0
20,0.090002,10.2.188.222,10.113.171.201,TCP,48,"5222  >  51994 [SYN, ACK] Seq=0 Ack=1 Win=4096 Len=0 MSS=9960 WS=256"
21,0.090276,10.113.171.201,10.2.188.222,TCP,40,51994  >  5222 [ACK] Seq=1 Ack=1 Win=79872 Len=0
22,0.090337,10.63.57.221,10.113.171.201,TLSv1.3,217,Application Data
23,0.090446,10.38.181.139,10.113.171.201,TCP,48,"5228  >  48816 [SYN, ACK] Seq=0 Ack=1 Win=4096 Len=0 MSS=9960 WS=256"
24,0.090741,10.113.171.201,10.38.181.139,TCP,40,48816  >  5228 [ACK] Seq=1 Ack=1 Win=79872 Len=0
25,0.094993,10.113.171.201,10.38.181.139,TLSv1.3,576,Client Hello (SNI=mtalk.google.com)
26,0.095516,10.38.181.139,10.113.171.201,TCP,40,5228  >  48816 [ACK] Seq=1 Ack=537 Win=1047808 Len=0
27,0.099495,10.113.171.201,10.2.188.222,TCP,44,"51994  >  5222 [PSH, ACK] Seq=1 Ack=1 Win=79872 Len=4 [TCP PDU reassembled in 138]"
28,0.100156,10.2.188.222,10.113.171.201,TCP,40,5222  >  51994 [ACK] Seq=1 Ack=5 Win=1048320 Len=0
29,0.100595,10.113.171.201,10.2.188.222,TCP,51,"51994  >  5222 [PSH, ACK] Seq=5 Ack=1 Win=79872 Len=11 [TCP PDU reassembled in 138]"
30,0.100938,10.2.188.222,10.113.171.201,TCP,40,5222  >  51994 [ACK] Seq=1 Ack=16 Win=1048320 Len=0
31,0.105196,10.113.171.201,10.2.188.222,TCP,43,"51994  >  5222 [PSH, ACK] Seq=16 Ack=1 Win=79872 Len=3 [TCP PDU reassembled in 138]"
32,0.105582,10.2.188.222,10.113.171.201,TCP,40,5222  >  51994 [ACK] Seq=1 Ack=19 Win=1048320 Len=0
33,0.105908,10.113.171.201,10.2.188.222,TCP,360,"51994  >  5222 [PSH, ACK] Seq=19 Ack=1 Win=79872 Len=320 [TCP PDU reassembled in 138]"
34,0.106158,10.2.188.222,10.113.171.201,TCP,40,5222  >  51994 [ACK] Seq=1 Ack=339 Win=1048064 Len=0
35,0.112609,10.113.171.201,10.63.57.221,TLSv1.3,552,Application Data
36,0.112809,10.63.57.221,10.113.171.201,TCP,40,443  >  33412 [ACK] Seq=414 Ack=983 Win=1048064 Len=0
37,0.121517,10.38.181.139,10.113.171.201,TLSv1.3,243,"Server Hello, Change Cipher Spec, Application Data"
38,0.122000,10.113.171.201,10.38.181.139,TCP,40,48816  >  5228 [ACK] Seq=537 Ack=204 Win=80896 Len=0
39,0.123134,10.113.171.201,10.38.181.139,TLSv1.3,104,"Change Cipher Spec, Application Data"
40,0.123387,10.38.181.139,10.113.171.201,TCP,40,5228  >  48816 [ACK] Seq=204 Ack=601 Win=1048320 Len=0
41,0.137344,10.2.188.222,10.113.171.201,TCP,193,"5222  >  51994 [PSH, ACK] Seq=1 Ack=339 Win=1048576 Len=153 [TCP PDU reassembled in 140]"
42,0.137901,10.113.171.201,10.2.188.222,TCP,40,51994  >  5222 [ACK] Seq=339 Ack=154 Win=80896 Len=0
43,0.138892,10.113.171.201,10.38.181.139,TLSv1.3,409,Application Data
44,0.139155,10.38.181.139,10.113.171.201,TCP,40,5228  >  48816 [ACK] Seq=204 Ack=970 Win=1048064 Len=0
45,0.145868,10.113.171.201,10.2.188.222,TCP,43,"51994  >  5222 [PSH, ACK] Seq=339 Ack=154 Win=80896 Len=3 [TCP PDU reassembled in 138]"
46,0.146143,10.2.188.222,10.113.171.201,TCP,40,5222  >  51994 [ACK] Seq=154 Ack=342 Win=1048320 Len=0
47,0.146418,10.113.171.201,10.2.188.222,TCP,237,"51994  >  5222 [PSH, ACK] Seq=342 Ack=154 Win=80896 Len=197 [TCP PDU reassembled in 138]"
48,0.146474,10.2.188.222,10.113.171.201,TCP,40,5222  >  51994 [ACK] Seq=154 Ack=539 Win=1048320 Len=0
49,0.147383,10.113.171.201,10.2.188.222,TCP,43,"51994  >  5222 [PSH, ACK] Seq=539 Ack=154 Win=80896 Len=3 [TCP PDU reassembled in 138]"
50,0.147625,10.2.188.222,10.113.171.201,TCP,40,5222  >  51994 [ACK] Seq=154 Ack=542 Win=1048320 Len=0
51,0.147858,10.113.171.201,10.2.188.222,TCP,77,"51994  >  5222 [PSH, ACK] Seq=542 Ack=154 Win=80896 Len=37 [TCP PDU reassembled in 138]"
52,0.148089,10.2.188.222,10.113.171.201,TCP,40,5222  >  51994 [ACK] Seq=154 Ack=579 Win=1048320 Len=0
53,0.148284,10.113.171.201,10.2.188.222,TCP,95,"51994  >  5222 [PSH, ACK] Seq=579 Ack=154 Win=80896 Len=55 [TCP PDU reassembled in 138]"
54,0.148327,10.2.188.222,10.113.171.201,TCP,40,5222  >  51994 [ACK] Seq=154 Ack=634 Win=1048064 Len=0
55,0.155679,10.38.181.139,10.113.171.201,TLSv1.3,575,"Application Data, Application Data"
56,0.169654,10.38.181.139,10.113.171.201,TLSv1.3,158,"Application Data, Application Data"
57,0.169834,10.113.171.201,10.38.181.139,TCP,40,48816  >  5228 [ACK] Seq=970 Ack=857 Win=81920 Len=0
58,0.199026,10.63.57.221,10.113.171.201,TLSv1.3,66,Application Data
59,0.207185,10.113.171.201,10.2.188.222,TCP,43,"51994  >  5222 [PSH, ACK] Seq=634 Ack=154 Win=80896 Len=3 [TCP PDU reassembled in 138]"
60,0.207396,10.2.188.222,10.113.171.201,TCP,40,5222  >  51994 [ACK] Seq=154 Ack=637 Win=1048320 Len=0
61,0.207784,10.113.171.201,10.2.188.222,TCP,444,"51994  >  5222 [PSH, ACK] Seq=637 Ack=154 Win=80896 Len=404 [TCP PDU reassembled in 138]"
62,0.207985,10.2.188.222,10.113.171.201,TCP,40,5222  >  51994 [ACK] Seq=154 Ack=1041 Win=1048064 Len=0
63,0.242972,10.113.171.201,10.63.57.221,TCP,40,33412  >  443 [ACK] Seq=983 Ack=440 Win=81920 Len=0
64,0.362975,10.2.188.222,10.113.171.201,TCP,829,"5222  >  51994 [PSH, ACK] Seq=154 Ack=1041 Win=1048576 Len=789 [TCP PDU reassembled in 140]"
65,0.407168,10.113.171.201,10.2.188.222,TCP,40,51994  >  5222 [ACK] Seq=1041 Ack=943 Win=82432 Len=0
66,0.468354,10.2.188.222,10.113.171.201,TCP,77,"5222  >  51994 [PSH, ACK] Seq=943 Ack=1041 Win=1048576 Len=37 [TCP PDU reassembled in 140]"
67,0.469514,10.113.171.201,10.2.188.222,TCP,40,51994  >  5222 [ACK] Seq=1041 Ack=980 Win=82432 Len=0
68,2.197661,10.113.171.201,10.113.112.211,DNS,66,Standard query 0xa41b A icosa-sg.coloros.com
69,2.235879,10.113.112.211,10.113.171.201,DNS,82,Standard query response 0xa41b A icosa-sg.coloros.com A 127.0.0.1
70,15.443172,10.113.171.201,10.2.188.222,TCP,43,"51994  >  5222 [PSH, ACK] Seq=1041 Ack=980 Win=82432 Len=3 [TCP PDU reassembled in 138]"
71,15.444188,10.2.188.222,10.113.171.201,TCP,40,5222  >  51994 [ACK] Seq=980 Ack=1044 Win=1048320 Len=0
72,15.444462,10.113.171.201,10.2.188.222,TCP,70,"51994  >  5222 [PSH, ACK] Seq=1044 Ack=980 Win=82432 Len=30 [TCP PDU reassembled in 138]"
73,15.444510,10.2.188.222,10.113.171.201,TCP,40,5222  >  51994 [ACK] Seq=980 Ack=1074 Win=1048320 Len=0
74,15.496268,10.2.188.222,10.113.171.201,TCP,81,"5222  >  51994 [PSH, ACK] Seq=980 Ack=1074 Win=1048576 Len=41 [TCP PDU reassembled in 140]"
75,15.496547,10.113.171.201,10.2.188.222,TCP,40,51994  >  5222 [ACK] Seq=1074 Ack=1021 Win=82432 Len=0
76,61.671242,10.38.181.139,10.113.171.201,TLSv1.3,1674,"Application Data, Application Data"
77,61.714167,10.113.171.201,10.38.181.139,TCP,40,48816  >  5228 [ACK] Seq=970 Ack=2491 Win=85248 Len=0
78,61.857939,10.113.171.201,10.38.181.139,TLSv1.3,78,Application Data
79,61.858481,10.38.181.139,10.113.171.201,TCP,40,5228  >  48816 [ACK] Seq=2491 Ack=1008 Win=1048320 Len=0
80,62.953804,10.113.171.201,10.113.112.211,DNS,60,Standard query 0x91f4 A www.google.com
81,62.992582,10.113.112.211,10.113.171.201,DNS,76,Standard query response 0x91f4 A www.google.com A 142.251.33.68
82,63.019481,10.113.171.201,10.245.60.36,QUIC,1278,"Initial, DCID=dd2559ea7417d43f, PKN: 1, PING, CRYPTO, CRYPTO, CRYPTO, PING, CRYPTO, PING"
83,63.025959,10.113.171.201,10.245.60.36,QUIC,1278,"Initial, DCID=dd2559ea7417d43f, PKN: 2, PING, CRYPTO, CRYPTO, CRYPTO"
84,63.030487,10.113.171.201,10.245.60.36,TCP,60,59524  >  443 [SYN] Seq=0 Win=65535 Len=0 MSS=9960 SACK_PERM TSval=30987497 TSecr=0 WS=256
85,63.052244,10.113.171.201,10.245.60.36,QUIC,110,"0-RTT, DCID=dd2559ea7417d43f"
86,63.054888,10.245.60.36,10.113.171.201,QUIC,68,"Initial, SCID=fd2559ea7417d43f, PKN: 1, ACK"
87,63.055274,10.245.60.36,10.113.171.201,QUIC,1278,"Initial, SCID=fd2559ea7417d43f, PKN: 2, ACK, PADDING"
88,63.055420,10.245.60.36,10.113.171.201,TCP,48,"443  >  59524 [SYN, ACK] Seq=0 Ack=1 Win=4096 Len=0 MSS=9960 WS=256"
89,63.055803,10.113.171.201,10.245.60.36,TCP,40,59524  >  443 [ACK] Seq=1 Ack=1 Win=79872 Len=0
90,63.055866,10.245.60.36,10.113.171.201,QUIC,1278,"Initial, SCID=fd2559ea7417d43f, PKN: 3, CRYPTO, PADDING"
91,63.055977,10.245.60.36,10.113.171.201,QUIC,325,Protected Payload (KP0)
92,63.056069,10.245.60.36,10.113.171.201,QUIC,970,Protected Payload (KP0)
93,63.059362,10.113.171.201,10.245.60.36,QUIC,1278,"Initial, DCID=fd2559ea7417d43f, PKN: 4, ACK, PADDING"
94,63.063118,10.113.171.201,10.245.60.36,QUIC,68,"Handshake, DCID=fd2559ea7417d43f"
95,63.063331,10.113.171.201,10.245.60.36,QUIC,101,"Handshake, DCID=fd2559ea7417d43f"
96,63.063926,10.113.171.201,10.245.60.36,QUIC,59,"Protected Payload (KP0), DCID=fd2559ea7417d43f"
97,63.066899,10.113.171.201,10.245.60.36,TLSv1.3,1860,Client Hello (SNI=www.google.com)
98,63.067819,10.245.60.36,10.113.171.201,TCP,40,443  >  59524 [ACK] Seq=1 Ack=1821 Win=1046528 Len=0
99,63.076076,10.113.171.201,10.245.60.36,QUIC,1274,"Protected Payload (KP0), DCID=fd2559ea7417d43f"
100,63.076480,10.113.171.201,10.245.60.36,QUIC,1278,"Protected Payload (KP0), DCID=fd2559ea7417d43f"
101,63.076723,10.113.171.201,10.245.60.36,QUIC,1278,"Protected Payload (KP0), DCID=fd2559ea7417d43f"
102,63.076861,10.113.171.201,10.245.60.36,QUIC,1278,"Protected Payload (KP0), DCID=fd2559ea7417d43f"
103,63.076966,10.113.171.201,10.245.60.36,QUIC,513,"Protected Payload (KP0), DCID=fd2559ea7417d43f"
104,63.077121,10.113.171.201,10.245.60.36,QUIC,81,"Protected Payload (KP0), DCID=fd2559ea7417d43f"
105,63.082949,10.245.60.36,10.113.171.201,QUIC,155,Protected Payload (KP0)
106,63.083201,10.245.60.36,10.113.171.201,QUIC,53,Protected Payload (KP0)
107,63.083297,10.245.60.36,10.113.171.201,QUIC,53,Protected Payload (KP0)
108,63.083368,10.245.60.36,10.113.171.201,QUIC,53,Protected Payload (KP0)
109,63.083441,10.245.60.36,10.113.171.201,QUIC,53,Protected Payload (KP0)
110,63.099154,10.245.60.36,10.113.171.201,TLSv1.3,2840,"Server Hello, Change Cipher Spec"
111,63.100128,10.113.171.201,10.245.60.36,TCP,40,59524  >  443 [ACK] Seq=1821 Ack=2801 Win=99840 Len=0
112,63.100214,10.245.60.36,10.113.171.201,TLSv1.3,2590,Application Data
113,63.100500,10.113.171.201,10.245.60.36,TCP,40,59524  >  443 [ACK] Seq=1821 Ack=5351 Win=119552 Len=0
114,63.114819,10.113.171.201,10.245.60.36,QUIC,60,"Protected Payload (KP0), DCID=fd2559ea7417d43f"
115,63.122694,10.245.60.36,10.113.171.201,QUIC,58,Protected Payload (KP0)
116,63.123885,10.113.171.201,10.245.60.36,TLSv1.3,114,"Change Cipher Spec, Application Data"
117,63.124067,10.245.60.36,10.113.171.201,TCP,40,443  >  59524 [ACK] Seq=5351 Ack=1895 Win=1048320 Len=0
118,63.139289,10.245.60.36,10.113.171.201,QUIC,680,Protected Payload (KP0)
119,63.139485,10.245.60.36,10.113.171.201,QUIC,53,Protected Payload (KP0)
120,63.139567,10.245.60.36,10.113.171.201,QUIC,299,Protected Payload (KP0)
121,63.140952,10.113.171.201,10.245.60.36,QUIC,64,"Protected Payload (KP0), DCID=fd2559ea7417d43f"
122,63.142074,10.113.171.201,10.245.60.36,QUIC,59,"Protected Payload (KP0), DCID=fd2559ea7417d43f"
123,63.186747,10.245.60.36,10.113.171.201,QUIC,52,Protected Payload (KP0)
124,73.546891,10.245.60.36,10.113.171.201,TCP,40,"443  >  59524 [FIN, ACK] Seq=5351 Ack=1895 Win=1048576 Len=0"
125,73.590081,10.113.171.201,10.245.60.36,TCP,40,59524  >  443 [ACK] Seq=1895 Ack=5352 Win=119552 Len=0
126,75.950017,10.113.171.201,10.63.57.221,TLSv1.3,77,Application Data
127,75.951049,10.63.57.221,10.113.171.201,TCP,40,443  >  33412 [ACK] Seq=440 Ack=1020 Win=1048320 Len=0
128,76.172840,10.63.57.221,10.113.171.201,TLSv1.3,66,Application Data
129,76.173528,10.113.171.201,10.63.57.221,TCP,40,33412  >  443 [ACK] Seq=1020 Ack=466 Win=81920 Len=0
130,165.753229,10.2.188.222,10.113.171.201,TCP,79,"5222  >  51994 [PSH, ACK] Seq=1021 Ack=1074 Win=1048576 Len=39 [TCP PDU reassembled in 140]"
131,165.754570,10.113.171.201,10.2.188.222,TCP,40,51994  >  5222 [ACK] Seq=1074 Ack=1060 Win=82432 Len=0
132,165.762860,10.113.171.201,10.2.188.222,TCP,43,"51994  >  5222 [PSH, ACK] Seq=1074 Ack=1060 Win=82432 Len=3 [TCP PDU reassembled in 138]"
133,165.763412,10.2.188.222,10.113.171.201,TCP,40,5222  >  51994 [ACK] Seq=1060 Ack=1077 Win=1048320 Len=0
134,165.763955,10.113.171.201,10.2.188.222,TCP,66,"51994  >  5222 [PSH, ACK] Seq=1077 Ack=1060 Win=82432 Len=26 [TCP PDU reassembled in 138]"
135,165.764322,10.2.188.222,10.113.171.201,TCP,40,5222  >  51994 [ACK] Seq=1060 Ack=1103 Win=1048320 Len=0
136,316.054432,10.113.171.201,10.2.188.222,TCP,43,"51994  >  5222 [PSH, ACK] Seq=1103 Ack=1060 Win=82432 Len=3 [TCP PDU reassembled in 138]"
137,316.055689,10.2.188.222,10.113.171.201,TCP,40,5222  >  51994 [ACK] Seq=1060 Ack=1106 Win=1048320 Len=0
138,316.056132,10.113.171.201,10.2.188.222,TCP,85,"51994  >  5222 [PSH, ACK] Seq=1106 Ack=1060 Win=82432 Len=45 [TCP PDU reassembled in 138]"
139,316.056223,10.2.188.222,10.113.171.201,TCP,40,5222  >  51994 [ACK] Seq=1060 Ack=1151 Win=1048320 Len=0
140,316.150143,10.2.188.222,10.113.171.201,TCP,79,"5222  >  51994 [PSH, ACK] Seq=1060 Ack=1151 Win=1048576 Len=39 [TCP PDU reassembled in 140]"
141,316.172225,10.113.171.201,10.56.253.8,TCP,60,50250  >  443 [SYN] Seq=0 Win=65535 Len=0 MSS=9960 SACK_PERM TSval=30991772 TSecr=0 WS=256
142,316.191776,10.113.171.201,10.2.188.222,TCP,40,51994  >  5222 [ACK] Seq=1151 Ack=1099 Win=82432 Len=0
143,316.251027,10.2.188.222,10.113.171.201,TCP,40,"5222  >  51994 [FIN, ACK] Seq=1099 Ack=1151 Win=1048576 Len=0"
144,316.258815,10.113.171.201,10.2.188.222,TCP,40,"51994  >  5222 [FIN, ACK] Seq=1151 Ack=1100 Win=82432 Len=0"
145,316.258843,10.2.188.222,10.113.171.201,TCP,40,5222  >  51994 [ACK] Seq=1100 Ack=1152 Win=65280 Len=0
146,316.281879,10.113.171.201,10.2.188.222,TCP,60,52018  >  5222 [SYN] Seq=0 Win=65535 Len=0 MSS=9960 SACK_PERM TSval=30991800 TSecr=0 WS=256
147,316.318497,10.2.188.222,10.113.171.201,TCP,48,"5222  >  52018 [SYN, ACK] Seq=0 Ack=1 Win=4096 Len=0 MSS=9960 WS=256"
148,316.319006,10.113.171.201,10.2.188.222,TCP,40,52018  >  5222 [ACK] Seq=1 Ack=1 Win=79872 Len=0
149,316.328897,10.113.171.201,10.2.188.222,TCP,44,"52018  >  5222 [PSH, ACK] Seq=1 Ack=1 Win=79872 Len=4 [TCP PDU reassembled in 299]"
150,316.329602,10.2.188.222,10.113.171.201,TCP,40,5222  >  52018 [ACK] Seq=1 Ack=5 Win=1048320 Len=0
151,316.329959,10.113.171.201,10.2.188.222,TCP,51,"52018  >  5222 [PSH, ACK] Seq=5 Ack=1 Win=79872 Len=11 [TCP PDU reassembled in 299]"
152,316.330304,10.2.188.222,10.113.171.201,TCP,40,5222  >  52018 [ACK] Seq=1 Ack=16 Win=1048320 Len=0
153,316.335605,10.113.171.201,10.2.188.222,TCP,43,"52018  >  5222 [PSH, ACK] Seq=16 Ack=1 Win=79872 Len=3 [TCP PDU reassembled in 299]"
154,316.336034,10.2.188.222,10.113.171.201,TCP,40,5222  >  52018 [ACK] Seq=1 Ack=19 Win=1048320 Len=0
155,316.336422,10.113.171.201,10.2.188.222,TCP,360,"52018  >  5222 [PSH, ACK] Seq=19 Ack=1 Win=79872 Len=320 [TCP PDU reassembled in 299]"
156,316.336864,10.2.188.222,10.113.171.201,TCP,40,5222  >  52018 [ACK] Seq=1 Ack=339 Win=1048064 Len=0
157,316.368152,10.2.188.222,10.113.171.201,TCP,193,"5222  >  52018 [PSH, ACK] Seq=1 Ack=339 Win=1048576 Len=153 [TCP PDU reassembled in 301]"
158,316.369119,10.113.171.201,10.2.188.222,TCP,40,52018  >  5222 [ACK] Seq=339 Ack=154 Win=80896 Len=0
159,316.376822,10.113.171.201,10.2.188.222,TCP,43,"52018  >  5222 [PSH, ACK] Seq=339 Ack=154 Win=80896 Len=3 [TCP PDU reassembled in 299]"
160,316.377154,10.2.188.222,10.113.171.201,TCP,40,5222  >  52018 [ACK] Seq=154 Ack=342 Win=1048320 Len=0
161,316.377466,10.113.171.201,10.2.188.222,TCP,237,"52018  >  5222 [PSH, ACK] Seq=342 Ack=154 Win=80896 Len=197 [TCP PDU reassembled in 299]"
162,316.377671,10.2.188.222,10.113.171.201,TCP,40,5222  >  52018 [ACK] Seq=154 Ack=539 Win=1048320 Len=0
163,316.378793,10.113.171.201,10.2.188.222,TCP,43,"52018  >  5222 [PSH, ACK] Seq=539 Ack=154 Win=80896 Len=3 [TCP PDU reassembled in 299]"
164,316.379011,10.2.188.222,10.113.171.201,TCP,40,5222  >  52018 [ACK] Seq=154 Ack=542 Win=1048320 Len=0
165,316.379500,10.113.171.201,10.2.188.222,TCP,77,"52018  >  5222 [PSH, ACK] Seq=542 Ack=154 Win=80896 Len=37 [TCP PDU reassembled in 299]"
166,316.379713,10.2.188.222,10.113.171.201,TCP,40,5222  >  52018 [ACK] Seq=154 Ack=579 Win=1048320 Len=0
167,316.380994,10.113.171.201,10.2.188.222,TCP,43,"52018  >  5222 [PSH, ACK] Seq=579 Ack=154 Win=80896 Len=3 [TCP PDU reassembled in 299]"
168,316.381215,10.2.188.222,10.113.171.201,TCP,40,5222  >  52018 [ACK] Seq=154 Ack=582 Win=1048320 Len=0
169,316.381454,10.113.171.201,10.2.188.222,TCP,92,"52018  >  5222 [PSH, ACK] Seq=582 Ack=154 Win=80896 Len=52 [TCP PDU reassembled in 299]"
170,316.381605,10.2.188.222,10.113.171.201,TCP,40,5222  >  52018 [ACK] Seq=154 Ack=634 Win=1048064 Len=0
171,316.442804,10.56.253.8,10.113.171.201,TCP,48,"443  >  50250 [SYN, ACK] Seq=0 Ack=1 Win=4096 Len=0 MSS=9960 WS=256"
172,316.443415,10.113.171.201,10.56.253.8,TCP,40,50250  >  443 [ACK] Seq=1 Ack=1 Win=79872 Len=0
173,316.478543,10.113.171.201,10.56.253.8,SSL,931,Continuation Data
174,316.479836,10.56.253.8,10.113.171.201,TCP,40,443  >  50250 [ACK] Seq=1 Ack=892 Win=1047552 Len=0
175,316.587005,10.2.188.222,10.113.171.201,TCP,796,"5222  >  52018 [PSH, ACK] Seq=154 Ack=634 Win=1048576 Len=756 [TCP PDU reassembled in 301]"
176,316.604211,10.2.188.222,10.113.171.201,TCP,77,"5222  >  52018 [PSH, ACK] Seq=910 Ack=634 Win=1048576 Len=37 [TCP PDU reassembled in 301]"
177,316.604593,10.113.171.201,10.2.188.222,TCP,40,52018  >  5222 [ACK] Seq=634 Ack=947 Win=82432 Len=0
178,316.930675,10.56.253.8,10.113.171.201,TCP,44,"443  >  50250 [PSH, ACK] Seq=1 Ack=892 Win=1048576 Len=4"
179,316.931229,10.113.171.201,10.56.253.8,TCP,40,50250  >  443 [ACK] Seq=892 Ack=5 Win=79872 Len=0
180,318.945923,10.113.171.201,10.113.112.211,DNS,70,Standard query 0x58eb A geller-pa.googleapis.com
181,318.955967,10.113.171.201,10.234.177.153,QUIC,1278,"Initial, DCID=7905b0ff77fa4f40, PKN: 1, CRYPTO"
182,318.960042,10.113.171.201,10.234.177.153,QUIC,1278,"Initial, DCID=7905b0ff77fa4f40, PKN: 2, PADDING, PING, CRYPTO, CRYPTO, CRYPTO, PADDING, PING, CRYPTO, PADDING, PING, CRYPTO, PING, CRYPTO, PING, PADDING"
183,318.963778,10.113.171.201,10.234.177.153,TCP,60,40780  >  443 [SYN] Seq=0 Win=65535 Len=0 MSS=9960 SACK_PERM TSval=30992470 TSecr=0 WS=256
184,318.981538,10.113.112.211,10.113.171.201,DNS,214,Standard query response 0x58eb A geller-pa.googleapis.com A 142.251.33.74 A 142.250.217.74 A 142.250.217.106 A 142.251.215.234 A 172.217.14.202 A 172.217.14.234 A 142.250.69.202 A 142.251.33.106 A 142.251.211.234
185,318.982416,10.234.177.153,10.113.171.201,QUIC,68,"Initial, SCID=f905b0ff77fa4f40, PKN: 1, ACK"
186,318.982832,10.234.177.153,10.113.171.201,TCP,48,"443  >  40780 [SYN, ACK] Seq=0 Ack=1 Win=4096 Len=0 MSS=9960 WS=256"
187,318.983297,10.113.171.201,10.234.177.153,TCP,40,40780  >  443 [ACK] Seq=1 Ack=1 Win=79872 Len=0
188,318.983362,10.234.177.153,10.113.171.201,QUIC,1278,"Initial, SCID=f905b0ff77fa4f40, PKN: 2, ACK, PADDING"
189,318.983483,10.234.177.153,10.113.171.201,QUIC,1278,"Initial, SCID=f905b0ff77fa4f40, PKN: 3, CRYPTO, PADDING"
190,318.983526,10.234.177.153,10.113.171.201,QUIC,1278,"Initial, SCID=f905b0ff77fa4f40, PKN: 4, CRYPTO, PADDING"
191,318.983565,10.234.177.153,10.113.171.201,QUIC,1278,"Handshake, SCID=f905b0ff77fa4f40"
192,318.983602,10.234.177.153,10.113.171.201,QUIC,1278,"Handshake, SCID=f905b0ff77fa4f40"
193,318.983640,10.234.177.153,10.113.171.201,QUIC,1278,"Handshake, SCID=f905b0ff77fa4f40"
194,318.985990,10.113.171.201,10.234.177.153,QUIC,1278,"Initial, DCID=f905b0ff77fa4f40, PKN: 3, ACK, PADDING"
195,318.995797,10.113.171.201,10.234.177.153,TLSv1.3,1870,Client Hello (SNI=geller-pa.googleapis.com)
196,318.996549,10.234.177.153,10.113.171.201,TCP,40,443  >  40780 [ACK] Seq=1 Ack=1831 Win=1046528 Len=0
197,318.998685,10.113.171.201,10.234.177.153,QUIC,68,"Handshake, DCID=f905b0ff77fa4f40"
198,319.002328,10.113.171.201,10.234.177.153,QUIC,68,"Handshake, DCID=f905b0ff77fa4f40"
199,319.006561,10.234.177.153,10.113.171.201,QUIC,209,Protected Payload (KP0)
200,319.008409,10.113.171.201,10.234.177.153,QUIC,68,"Handshake, DCID=f905b0ff77fa4f40"
201,319.017262,10.113.171.201,10.167.130.79,TCP,60,36742  >  443 [SYN] Seq=0 Win=65535 Len=0 MSS=9960 SACK_PERM TSval=30992484 TSecr=0 WS=256
202,319.024547,10.113.171.201,10.113.112.211,DNS,77,Standard query 0xb5d8 A mobilemaps-pa-gz.googleapis.com
203,319.026293,10.113.171.201,10.234.177.153,QUIC,65,"Handshake, DCID=f905b0ff77fa4f40"
204,319.026489,10.234.177.153,10.113.171.201,TLSv1.3,4240,"Server Hello, Change Cipher Spec"
205,319.027557,10.113.171.201,10.234.177.153,TCP,40,40780  >  443 [ACK] Seq=1831 Ack=4201 Win=88320 Len=0
206,319.027626,10.234.177.153,10.113.171.201,TLSv1.3,1595,Application Data
207,319.027987,10.113.171.201,10.234.177.153,TCP,40,40780  >  443 [ACK] Seq=1831 Ack=5756 Win=108032 Len=0
208,319.044358,10.167.130.79,10.113.171.201,TCP,48,"443  >  36742 [SYN, ACK] Seq=0 Ack=1 Win=4096 Len=0 MSS=9960 WS=256"
209,319.044716,10.113.171.201,10.167.130.79,TCP,40,36742  >  443 [ACK] Seq=1 Ack=1 Win=79872 Len=0
210,319.044764,10.234.177.153,10.113.171.201,QUIC,69,"Handshake, SCID=f905b0ff77fa4f40"
211,319.044812,10.113.112.211,10.113.171.201,DNS,93,Standard query response 0xb5d8 A mobilemaps-pa-gz.googleapis.com A 216.239.38.135
212,319.046597,10.113.171.201,10.167.130.79,TLSv1.3,1813,Client Hello (SNI=mobilemaps-pa-gz.googleapis.com)
213,319.047534,10.167.130.79,10.113.171.201,TCP,40,443  >  36742 [ACK] Seq=1 Ack=1774 Win=1046784 Len=0
214,319.070862,10.167.130.79,10.113.171.201,TLSv1.3,2840,"Server Hello, Change Cipher Spec"
215,319.071782,10.113.171.201,10.167.130.79,TCP,40,36742  >  443 [ACK] Seq=1774 Ack=2801 Win=99840 Len=0
216,319.071859,10.167.130.79,10.113.171.201,TLSv1.3,3002,Application Data
217,319.072105,10.113.171.201,10.167.130.79,TCP,40,36742  >  443 [ACK] Seq=1774 Ack=5763 Win=119552 Len=0
218,319.125639,10.113.171.201,10.234.177.153,QUIC,111,"Handshake, DCID=f905b0ff77fa4f40"
219,319.127865,10.113.171.201,10.234.177.153,QUIC,102,"Protected Payload (KP0), DCID=f905b0ff77fa4f40"
220,319.129224,10.113.171.201,10.234.177.153,TLSv1.3,114,"Change Cipher Spec, Application Data"
221,319.129577,10.234.177.153,10.113.171.201,TCP,40,443  >  40780 [ACK] Seq=5756 Ack=1905 Win=1048320 Len=0
222,319.130942,10.113.171.201,10.234.177.153,QUIC,60,"Protected Payload (KP0), DCID=f905b0ff77fa4f40"
223,319.136361,10.113.171.201,10.234.177.153,QUIC,826,"Protected Payload (KP0), DCID=f905b0ff77fa4f40"
224,319.138390,10.113.171.201,10.234.177.153,QUIC,59,"Protected Payload (KP0), DCID=f905b0ff77fa4f40"
225,319.149474,10.234.177.153,10.113.171.201,QUIC,990,Protected Payload (KP0)
226,319.149690,10.234.177.153,10.113.171.201,TLSv1.3,1018,"Application Data, Application Data"
227,319.149892,10.113.171.201,10.234.177.153,TCP,40,40780  >  443 [ACK] Seq=1905 Ack=6734 Win=116480 Len=0
228,319.149912,10.234.177.153,10.113.171.201,QUIC,149,Protected Payload (KP0)
229,319.149949,10.234.177.153,10.113.171.201,QUIC,55,Protected Payload (KP0)
230,319.150533,10.113.171.201,10.234.177.153,QUIC,61,"Protected Payload (KP0), DCID=f905b0ff77fa4f40"
231,319.151362,10.113.171.201,10.234.177.153,QUIC,61,"Protected Payload (KP0), DCID=f905b0ff77fa4f40"
232,319.152405,10.113.171.201,10.234.177.153,QUIC,61,"Protected Payload (KP0), DCID=f905b0ff77fa4f40"
233,319.164078,10.113.171.201,10.167.130.79,TLSv1.3,114,"Change Cipher Spec, Application Data"
234,319.164470,10.167.130.79,10.113.171.201,TCP,40,443  >  36742 [ACK] Seq=5763 Ack=1848 Win=1048320 Len=0
235,319.165537,10.113.171.201,10.167.130.79,TLSv1.3,132,Application Data
236,319.165846,10.167.130.79,10.113.171.201,TCP,40,443  >  36742 [ACK] Seq=5763 Ack=1940 Win=1048320 Len=0
237,319.166593,10.113.171.201,10.167.130.79,TLSv1.3,1595,Application Data
238,319.166818,10.167.130.79,10.113.171.201,TCP,40,443  >  36742 [ACK] Seq=5763 Ack=3495 Win=1046784 Len=0
239,319.168026,10.113.171.201,10.167.130.79,TLSv1.3,3559,Application Data
240,319.168402,10.167.130.79,10.113.171.201,TCP,40,443  >  36742 [ACK] Seq=5763 Ack=7014 Win=1043200 Len=0
241,319.168790,10.113.171.201,10.167.130.79,TLSv1.3,71,Application Data
242,319.168953,10.167.130.79,10.113.171.201,TCP,40,443  >  36742 [ACK] Seq=5763 Ack=7045 Win=1043200 Len=0
243,319.185395,10.234.177.153,10.113.171.201,QUIC,52,Protected Payload (KP0)
244,319.185676,10.167.130.79,10.113.171.201,TLSv1.3,1063,"Application Data, Application Data, Application Data"
245,319.185889,10.113.171.201,10.167.130.79,TCP,40,36742  >  443 [ACK] Seq=7045 Ack=6786 Win=125696 Len=0
246,319.187254,10.113.171.201,10.167.130.79,TLSv1.3,71,Application Data
247,319.187514,10.167.130.79,10.113.171.201,TCP,40,443  >  36742 [ACK] Seq=6786 Ack=7076 Win=1048320 Len=0
248,319.261160,10.234.177.153,10.113.171.201,QUIC,781,Protected Payload (KP0)
249,319.261706,10.234.177.153,10.113.171.201,QUIC,173,Protected Payload (KP0)
250,319.263602,10.113.171.201,10.234.177.153,QUIC,64,"Protected Payload (KP0), DCID=f905b0ff77fa4f40"
251,319.310255,10.234.177.153,10.113.171.201,QUIC,52,Protected Payload (KP0)
252,319.388620,10.167.130.79,10.113.171.201,TLSv1.3,1827,"Application Data, Application Data"
253,319.390117,10.167.130.79,10.113.171.201,TLSv1.3,10000,"Application Data, Application Data, Application Data, Application Data, Application Data, Application Data, Application Data"
254,319.390947,10.113.171.201,10.167.130.79,TCP,40,36742  >  443 [ACK] Seq=7076 Ack=18533 Win=151296 Len=0
255,319.391059,10.167.130.79,10.113.171.201,TLSv1.3,4937,"Application Data, Application Data, Application Data, Application Data, Application Data, Application Data"
256,319.395512,10.113.171.201,10.167.130.79,TLSv1.3,79,Application Data
257,319.396135,10.167.130.79,10.113.171.201,TCP,40,443  >  36742 [ACK] Seq=23430 Ack=7115 Win=1048320 Len=0
258,326.830361,10.113.171.201,10.113.112.211,DNS,64,Standard query 0xaf4f A graph.facebook.com
259,327.068417,10.113.112.211,10.113.171.201,DNS,104,Standard query response 0xaf4f A graph.facebook.com CNAME star.c10r.facebook.com A 157.240.3.20
260,327.089519,10.113.171.201,10.225.29.94,TCP,60,35576  >  443 [SYN] Seq=0 Win=65535 Len=0 MSS=9960 SACK_PERM TSval=30994502 TSecr=0 WS=256
261,327.127387,10.225.29.94,10.113.171.201,TCP,48,"443  >  35576 [SYN, ACK] Seq=0 Ack=1 Win=4096 Len=0 MSS=9960 WS=256"
262,327.128598,10.113.171.201,10.225.29.94,TCP,40,35576  >  443 [ACK] Seq=1 Ack=1 Win=79872 Len=0
263,327.137626,10.113.171.201,10.225.29.94,TLSv1.3,557,Client Hello (SNI=graph.facebook.com)
264,327.138786,10.225.29.94,10.113.171.201,TCP,40,443  >  35576 [ACK] Seq=1 Ack=518 Win=1047808 Len=0
265,327.161920,10.225.29.94,10.113.171.201,TLSv1.3,265,"Server Hello, Change Cipher Spec, Application Data"
266,327.163085,10.113.171.201,10.225.29.94,TCP,40,35576  >  443 [ACK] Seq=518 Ack=226 Win=80896 Len=0
267,327.166220,10.113.171.201,10.225.29.94,TLSv1.3,104,"Change Cipher Spec, Application Data"
268,327.166674,10.225.29.94,10.113.171.201,TCP,40,443  >  35576 [ACK] Seq=226 Ack=582 Win=1048320 Len=0
269,327.177298,10.113.171.201,10.225.29.94,TLSv1.3,1084,Application Data
270,327.177837,10.225.29.94,10.113.171.201,TCP,40,443  >  35576 [ACK] Seq=226 Ack=1626 Win=1047296 Len=0
271,327.188930,10.225.29.94,10.113.171.201,TLSv1.3,222,Application Data
272,327.231724,10.113.171.201,10.225.29.94,TCP,40,35576  >  443 [ACK] Seq=1626 Ack=408 Win=81920 Len=0
273,327.254748,10.225.29.94,10.113.171.201,TLSv1.3,990,Application Data
274,327.255294,10.113.171.201,10.225.29.94,TCP,40,35576  >  443 [ACK] Seq=1626 Ack=1358 Win=83968 Len=0
275,327.263328,10.113.171.201,10.225.29.94,TCP,40,"35576  >  443 [FIN, ACK] Seq=1626 Ack=1358 Win=83968 Len=0"
276,327.263633,10.225.29.94,10.113.171.201,TCP,40,443  >  35576 [ACK] Seq=1358 Ack=1627 Win=1048320 Len=0
277,327.284995,10.225.29.94,10.113.171.201,TCP,40,"443  >  35576 [FIN, ACK] Seq=1358 Ack=1627 Win=1048576 Len=0"
278,466.892728,10.2.188.222,10.113.171.201,TCP,79,"5222  >  52018 [PSH, ACK] Seq=947 Ack=634 Win=1048576 Len=39 [TCP PDU reassembled in 301]"
279,466.908078,10.113.171.201,10.2.188.222,TCP,43,"52018  >  5222 [PSH, ACK] Seq=634 Ack=986 Win=82432 Len=3 [TCP PDU reassembled in 299]"
280,466.908592,10.2.188.222,10.113.171.201,TCP,40,5222  >  52018 [ACK] Seq=986 Ack=637 Win=1048320 Len=0
281,466.909138,10.113.171.201,10.2.188.222,TCP,66,"52018  >  5222 [PSH, ACK] Seq=637 Ack=986 Win=82432 Len=26 [TCP PDU reassembled in 299]"
282,466.909264,10.2.188.222,10.113.171.201,TCP,40,5222  >  52018 [ACK] Seq=986 Ack=663 Win=1048320 Len=0
283,502.329968,10.38.181.139,10.113.171.201,TLSv1.3,64,Application Data
284,502.331405,10.113.171.201,10.38.181.139,TCP,40,48816  >  5228 [ACK] Seq=1008 Ack=2515 Win=85248 Len=0
285,502.395517,10.113.171.201,10.38.181.139,TLSv1.3,66,Application Data
286,502.395927,10.38.181.139,10.113.171.201,TCP,40,5228  >  48816 [ACK] Seq=2515 Ack=1034 Win=1048320 Len=0
287,559.466347,10.234.177.153,10.113.171.201,TLSv1.3,113,Application Data
288,559.467617,10.113.171.201,10.234.177.153,TCP,40,40780  >  443 [ACK] Seq=1905 Ack=6807 Win=116480 Len=0
289,559.467779,10.167.130.79,10.113.171.201,TLSv1.3,113,Application Data
290,559.474546,10.113.171.201,10.167.130.79,TCP,40,"36742  >  443 [FIN, ACK] Seq=7115 Ack=23503 Win=171264 Len=0"
291,559.475055,10.167.130.79,10.113.171.201,TCP,40,443  >  36742 [ACK] Seq=23503 Ack=7116 Win=1048320 Len=0
292,559.498819,10.167.130.79,10.113.171.201,TCP,40,"443  >  36742 [FIN, ACK] Seq=23503 Ack=7116 Win=1048576 Len=0"
293,564.587088,10.234.177.153,10.113.171.201,TLSv1.3,96,Application Data
294,564.588495,10.113.171.201,10.234.177.153,TCP,40,40780  >  443 [ACK] Seq=1905 Ack=6863 Win=116480 Len=0
295,564.588640,10.234.177.153,10.113.171.201,TCP,40,"443  >  40780 [FIN, ACK] Seq=6863 Ack=1905 Win=1048576 Len=0"
296,564.630052,10.113.171.201,10.234.177.153,TCP,40,40780  >  443 [ACK] Seq=1905 Ack=6864 Win=116480 Len=0
297,616.962408,10.113.171.201,10.2.188.222,TCP,43,"52018  >  5222 [PSH, ACK] Seq=663 Ack=986 Win=82432 Len=3 [TCP PDU reassembled in 299]"
298,616.963207,10.2.188.222,10.113.171.201,TCP,40,5222  >  52018 [ACK] Seq=986 Ack=666 Win=1048320 Len=0
299,616.963841,10.113.171.201,10.2.188.222,TCP,85,"52018  >  5222 [PSH, ACK] Seq=666 Ack=986 Win=82432 Len=45 [TCP PDU reassembled in 299]"
300,616.963941,10.2.188.222,10.113.171.201,TCP,40,5222  >  52018 [ACK] Seq=986 Ack=711 Win=1048320 Len=0
301,617.183924,10.2.188.222,10.113.171.201,TCP,79,"5222  >  52018 [PSH, ACK] Seq=986 Ack=711 Win=1048576 Len=39 [TCP PDU reassembled in 301]"
302,617.187023,10.2.188.222,10.113.171.201,TCP,40,"5222  >  52018 [FIN, ACK] Seq=1025 Ack=711 Win=1048576 Len=0"
303,617.193851,10.113.171.201,10.2.188.222,TCP,40,"52018  >  5222 [FIN, ACK] Seq=711 Ack=1026 Win=82432 Len=0"
304,617.193880,10.2.188.222,10.113.171.201,TCP,40,5222  >  52018 [ACK] Seq=1026 Ack=712 Win=65280 Len=0
305,617.229950,10.113.171.201,10.2.188.222,TCP,60,52034  >  5222 [SYN] Seq=0 Win=65535 Len=0 MSS=9960 SACK_PERM TSval=30998510 TSecr=0 WS=256
306,617.286999,10.2.188.222,10.113.171.201,TCP,48,"5222  >  52034 [SYN, ACK] Seq=0 Ack=1 Win=4096 Len=0 MSS=9960 WS=256"
307,617.287684,10.113.171.201,10.2.188.222,TCP,40,52034  >  5222 [ACK] Seq=1 Ack=1 Win=79872 Len=0
308,617.304480,10.113.171.201,10.2.188.222,TCP,44,"52034  >  5222 [PSH, ACK] Seq=1 Ack=1 Win=79872 Len=4 [TCP PDU reassembled in 618]"
309,617.305175,10.2.188.222,10.113.171.201,TCP,40,5222  >  52034 [ACK] Seq=1 Ack=5 Win=1048320 Len=0
310,617.305497,10.113.171.201,10.2.188.222,TCP,51,"52034  >  5222 [PSH, ACK] Seq=5 Ack=1 Win=79872 Len=11 [TCP PDU reassembled in 618]"
311,617.305749,10.2.188.222,10.113.171.201,TCP,40,5222  >  52034 [ACK] Seq=1 Ack=16 Win=1048320 Len=0
312,617.309978,10.113.171.201,10.2.188.222,TCP,43,"52034  >  5222 [PSH, ACK] Seq=16 Ack=1 Win=79872 Len=3 [TCP PDU reassembled in 618]"
313,617.310257,10.2.188.222,10.113.171.201,TCP,40,5222  >  52034 [ACK] Seq=1 Ack=19 Win=1048320 Len=0
314,617.310482,10.113.171.201,10.2.188.222,TCP,360,"52034  >  5222 [PSH, ACK] Seq=19 Ack=1 Win=79872 Len=320 [TCP PDU reassembled in 618]"
315,617.310789,10.2.188.222,10.113.171.201,TCP,40,5222  >  52034 [ACK] Seq=1 Ack=339 Win=1048064 Len=0
316,617.342537,10.2.188.222,10.113.171.201,TCP,193,"5222  >  52034 [PSH, ACK] Seq=1 Ack=339 Win=1048576 Len=153 [TCP PDU reassembled in 596]"
317,617.343301,10.113.171.201,10.2.188.222,TCP,40,52034  >  5222 [ACK] Seq=339 Ack=154 Win=80896 Len=0
318,617.351596,10.113.171.201,10.2.188.222,TCP,43,"52034  >  5222 [PSH, ACK] Seq=339 Ack=154 Win=80896 Len=3 [TCP PDU reassembled in 618]"
319,617.351822,10.2.188.222,10.113.171.201,TCP,40,5222  >  52034 [ACK] Seq=154 Ack=342 Win=1048320 Len=0
320,617.352227,10.113.171.201,10.2.188.222,TCP,237,"52034  >  5222 [PSH, ACK] Seq=342 Ack=154 Win=80896 Len=197 [TCP PDU reassembled in 618]"
321,617.352415,10.2.188.222,10.113.171.201,TCP,40,5222  >  52034 [ACK] Seq=154 Ack=539 Win=1048320 Len=0
322,617.352880,10.113.171.201,10.2.188.222,TCP,80,"52034  >  5222 [PSH, ACK] Seq=539 Ack=154 Win=80896 Len=40 [TCP PDU reassembled in 618]"
323,617.353041,10.2.188.222,10.113.171.201,TCP,40,5222  >  52034 [ACK] Seq=154 Ack=579 Win=1048320 Len=0
324,617.353487,10.113.171.201,10.2.188.222,TCP,95,"52034  >  5222 [PSH, ACK] Seq=579 Ack=154 Win=80896 Len=55 [TCP PDU reassembled in 618]"
325,617.353668,10.2.188.222,10.113.171.201,TCP,40,5222  >  52034 [ACK] Seq=154 Ack=634 Win=1048064 Len=0
326,617.596939,10.2.188.222,10.113.171.201,TCP,337,5222  >  52034 [ACK] Seq=154 Ack=634 Win=1048576 Len=297 [TCP PDU reassembled in 596]
327,617.597814,10.2.188.222,10.113.171.201,TCP,499,"5222  >  52034 [PSH, ACK] Seq=451 Ack=634 Win=1048576 Len=459 [TCP PDU reassembled in 596]"
328,617.598305,10.113.171.201,10.2.188.222,TCP,40,52034  >  5222 [ACK] Seq=634 Ack=910 Win=82944 Len=0
329,617.616400,10.2.188.222,10.113.171.201,TCP,77,"5222  >  52034 [PSH, ACK] Seq=910 Ack=634 Win=1048576 Len=37 [TCP PDU reassembled in 596]"
330,617.659385,10.113.171.201,10.2.188.222,TCP,40,52034  >  5222 [ACK] Seq=634 Ack=947 Win=82944 Len=0
331,701.046937,10.113.171.201,10.113.112.211,DNS,62,Standard query 0xd72e A time.android.com
332,701.089965,10.113.112.211,10.113.171.201,DNS,126,Standard query response 0xd72e A time.android.com A 216.239.35.8 A 216.239.35.0 A 216.239.35.12 A 216.239.35.4
333,701.103662,10.113.171.201,10.249.106.38,NTP,76,"NTP Version 3, client"
334,701.365069,10.249.106.38,10.113.171.201,NTP,76,"NTP Version 3, server"
335,701.923681,10.113.171.201,10.113.112.211,DNS,76,Standard query 0xa75c A slb-apisnd-in.heytapmobile.com
336,701.988563,10.113.112.211,10.113.171.201,DNS,316,Standard query response 0xa75c A slb-apisnd-in.heytapmobile.com A 3.0.42.35 A 13.215.167.229 A 18.139.134.86 A 52.76.89.191 A 52.77.19.175 A 18.139.73.196 A 18.139.20.98 A 18.136.229.215 A 52.220.58.145 A 18.136.169.194 A 3.0.111.212 A 13.213.207.40 A 13.215.134.112 A 18.142.196.104 A 52.76.54.46
337,702.048792,10.113.171.201,10.113.112.211,DNS,73,Standard query 0x6866 A mdp-appconf-in.heytapdl.com
338,702.099324,10.113.112.211,10.113.171.201,DNS,189,Standard query response 0x6866 A mdp-appconf-in.heytapdl.com CNAME mdp-appconf-in.heytapdl.com.edgesuite.net CNAME a1749.d.akamai.net A 207.194.175.114 A 207.194.175.75
339,702.162534,10.113.171.201,10.113.112.211,DNS,73,Standard query 0x3c7a A mdp-appconf-sg.heytapdl.com
340,702.202814,10.113.112.211,10.113.171.201,DNS,176,Standard query response 0x3c7a A mdp-appconf-sg.heytapdl.com CNAME heytapdl.com.akamaized.net CNAME a745.dscd.akamai.net A 207.194.199.40 A 207.194.199.67
341,702.389031,10.113.171.201,10.234.177.153,TCP,40,"40780  >  443 [RST, ACK] Seq=1905 Ack=6864 Win=116480 Len=0"
342,702.551643,10.113.171.201,10.113.112.211,DNS,58,Standard query 0xf94a A pool.ntp.org
343,702.594721,10.113.112.211,10.113.171.201,DNS,122,Standard query response 0xf94a A pool.ntp.org A 155.138.155.0 A 216.197.228.230 A 216.232.132.102 A 54.39.23.64
344,703.621651,10.113.171.201,10.113.112.211,DNS,73,Standard query 0xd691 A obus-in.dc.heytapmobile.com
345,703.658647,10.113.112.211,10.113.171.201,DNS,89,Standard query response 0xd691 A obus-in.dc.heytapmobile.com A 129.227.29.116
346,748.086538,10.2.188.222,10.113.171.201,TCP,115,"5222  >  52034 [PSH, ACK] Seq=947 Ack=634 Win=1048576 Len=75 [TCP PDU reassembled in 596]"
347,748.088067,10.113.171.201,10.2.188.222,TCP,40,52034  >  5222 [ACK] Seq=634 Ack=1022 Win=82944 Len=0
348,748.153687,10.113.171.201,10.2.188.222,TCP,43,"52034  >  5222 [PSH, ACK] Seq=634 Ack=1022 Win=82944 Len=3 [TCP PDU reassembled in 618]"
349,748.154064,10.2.188.222,10.113.171.201,TCP,40,5222  >  52034 [ACK] Seq=1022 Ack=637 Win=1048320 Len=0
350,748.154378,10.113.171.201,10.2.188.222,TCP,83,"52034  >  5222 [PSH, ACK] Seq=637 Ack=1022 Win=82944 Len=43 [TCP PDU reassembled in 618]"
351,748.154425,10.2.188.222,10.113.171.201,TCP,40,5222  >  52034 [ACK] Seq=1022 Ack=680 Win=1048320 Len=0
352,898.625535,10.2.188.222,10.113.171.201,TCP,79,"5222  >  52034 [PSH, ACK] Seq=1022 Ack=680 Win=1048576 Len=39 [TCP PDU reassembled in 596]"
353,898.626179,10.113.171.201,10.2.188.222,TCP,40,52034  >  5222 [ACK] Seq=680 Ack=1061 Win=82944 Len=0
354,898.629724,10.113.171.201,10.2.188.222,TCP,43,"52034  >  5222 [PSH, ACK] Seq=680 Ack=1061 Win=82944 Len=3 [TCP PDU reassembled in 618]"
355,898.630113,10.2.188.222,10.113.171.201,TCP,40,5222  >  52034 [ACK] Seq=1061 Ack=683 Win=1048320 Len=0
356,898.630516,10.113.171.201,10.2.188.222,TCP,66,"52034  >  5222 [PSH, ACK] Seq=683 Ack=1061 Win=82944 Len=26 [TCP PDU reassembled in 618]"
357,898.630935,10.2.188.222,10.113.171.201,TCP,40,5222  >  52034 [ACK] Seq=1061 Ack=709 Win=1048320 Len=0
358,917.014954,10.113.171.201,10.63.57.221,TLSv1.3,64,Application Data
359,917.016338,10.63.57.221,10.113.171.201,TCP,40,443  >  33412 [ACK] Seq=466 Ack=1044 Win=1048320 Len=0
360,917.019480,10.113.171.201,10.56.253.8,TCP,42,"50250  >  443 [PSH, ACK] Seq=892 Ack=5 Win=79872 Len=2"
361,917.019946,10.56.253.8,10.113.171.201,TCP,40,443  >  50250 [ACK] Seq=5 Ack=894 Win=1048320 Len=0
362,917.048377,10.56.253.8,10.113.171.201,TCP,40,"443  >  50250 [FIN, ACK] Seq=5 Ack=894 Win=1048320 Len=0"
