No.,Time,Source,Destination,Protocol,Length,Info
1,0.000000,10.148.138.27,10.64.230.69,DNS,68,Standard query 0xa6db A mqtt-mini.facebook.com
2,0.034075,10.148.138.27,10.215.32.176,TCP,60,33012  >  443 [SYN] Seq=0 Win=65535 Len=0 MSS=9960 SACK_PERM TSval=1354093566 TSecr=0 WS=1024
3,0.064090,10.148.138.27,10.64.230.69,DNS,62,Standard query 0x7144 A mtalk.google.com
4,0.427882,10.64.230.69,10.148.138.27,DNS,113,Standard query response 0xa6db A mqtt-mini.facebook.com CNAME mqtt-mini.c10r.facebook.com A 31.13.80.34
5,0.428191,10.64.230.69,10.148.138.27,DNS,107,Standard query response 0x7144 A mtalk.google.com CNAME mobile-gtalk.l.google.com A 142.251.179.188
6,0.434876,10.215.32.176,10.148.138.27,TCP,48,"443  >  33012 [SYN, ACK] Seq=0 Ack=1 Win=1536 Len=0 MSS=9960 WS=1024"
7,0.435041,10.148.138.27,10.215.32.176,TCP,40,33012  >  443 [ACK] Seq=1 Ack=1 Win=65536 Len=0
8,0.441851,10.148.138.27,10.249.238.144,TCP,60,35734  >  5228 [SYN] Seq=0 Win=65535 Len=0 MSS=9960 SACK_PERM TSval=3017949122 TSecr=0 WS=1024
9,0.451445,10.148.138.27,10.215.32.176,TLSv1.3,446,Client Hello (SNI=mqtt-mini.facebook.com)
10,0.452249,10.215.32.176,10.148.138.27,TCP,40,443  >  33012 [ACK] Seq=1 Ack=407 Win=1571840 Len=0
11,0.484964,10.249.238.144,10.148.138.27,TCP,48,"5228  >  35734 [SYN, ACK] Seq=0 Ack=1 Win=1536 Len=0 MSS=9960 WS=1024"
12,0.485219,10.148.138.27,10.249.238.144,TCP,40,35734  >  5228 [ACK] Seq=1 Ack=1 Win=65536 Len=0
13,0.488787,10.148.138.27,10.249.238.144,TLSv1.3,557,Client Hello (SNI=mtalk.google.com)
14,0.489215,10.249.238.144,10.148.138.27,TCP,40,5228  >  35734 [ACK] Seq=1 Ack=518 Win=1571840 Len=0
15,0.505098,10.215.32.176,10.148.138.27,TLSv1.3,276,"Server Hello, Change Cipher Spec, Application Data"
16,0.505444,10.148.138.27,10.215.32.176,TCP,40,33012  >  443 [ACK] Seq=407 Ack=237 Win=67584 Len=0
17,0.518199,10.148.138.27,10.215.32.176,TLSv1.3,46,Change Cipher Spec
18,0.518423,10.215.32.176,10.148.138.27,TCP,40,443  >  33012 [ACK] Seq=237 Ack=413 Win=1571840 Len=0
19,0.519081,10.148.138.27,10.215.32.176,TLSv1.3,98,Application Data
20,0.519187,10.215.32.176,10.148.138.27,TCP,40,443  >  33012 [ACK] Seq=237 Ack=471 Win=1571840 Len=0
21,0.546567,10.148.138.27,10.215.32.176,TLSv1.3,568,Application Data
22,0.546755,10.215.32.176,10.148.138.27,TCP,40,443  >  33012 [ACK] Seq=237 Ack=999 Win=1571840 Len=0
23,0.560736,10.215.32.176,10.148.138.27,TLSv1.3,217,Application Data
24,0.560967,10.249.238.144,10.148.138.27,TLSv1.3,6636,"Server Hello, Change Cipher Spec, Application Data"
25,0.561450,10.148.138.27,10.215.32.176,TCP,40,33012  >  443 [ACK] Seq=999 Ack=414 Win=68608 Len=0
26,0.561466,10.148.138.27,10.249.238.144,TCP,40,35734  >  5228 [ACK] Seq=518 Ack=6597 Win=86016 Len=0
27,0.585717,10.148.138.27,10.249.238.144,TLSv1.3,104,"Change Cipher Spec, Application Data"
28,0.585969,10.249.238.144,10.148.138.27,TCP,40,5228  >  35734 [ACK] Seq=6597 Ack=582 Win=1571840 Len=0
29,0.614521,10.148.138.27,10.249.238.144,TLSv1.3,527,Application Data
30,0.614750,10.249.238.144,10.148.138.27,TCP,40,5228  >  35734 [ACK] Seq=6597 Ack=1069 Win=1571840 Len=0
31,0.622042,10.215.32.176,10.148.138.27,TLSv1.3,66,Application Data
32,0.622556,10.148.138.27,10.215.32.176,TCP,40,33012  >  443 [ACK] Seq=999 Ack=440 Win=68608 Len=0
33,0.680589,10.249.238.144,10.148.138.27,TLSv1.3,575,"Application Data, Application Data"
34,0.680845,10.148.138.27,10.249.238.144,TCP,40,35734  >  5228 [ACK] Seq=1069 Ack=7132 Win=99328 Len=0
35,0.718244,10.249.238.144,10.148.138.27,TLSv1.3,158,"Application Data, Application Data"
36,0.718573,10.148.138.27,10.249.238.144,TCP,40,35734  >  5228 [ACK] Seq=1069 Ack=7250 Win=99328 Len=0
37,0.788641,10.148.138.27,10.64.230.69,DNS,69,Standard query 0xb67b A android.apis.google.com
38,0.818435,10.64.230.69,10.148.138.27,DNS,109,Standard query response 0xb67b A android.apis.google.com CNAME clients.l.google.com A 142.250.69.78
39,0.832517,10.249.238.144,10.148.138.27,TLSv1.3,797,Application Data
40,0.832936,10.148.138.27,10.249.238.144,TCP,40,35734  >  5228 [ACK] Seq=1069 Ack=8007 Win=112640 Len=0
41,0.835056,10.249.238.144,10.148.138.27,TLSv1.3,1895,"Application Data, Application Data, Application Data"
42,0.835265,10.148.138.27,10.249.238.144,TCP,40,35734  >  5228 [ACK] Seq=1069 Ack=9862 Win=125952 Len=0
43,0.837458,10.249.238.144,10.148.138.27,TLSv1.3,1699,"Application Data, Application Data, Application Data, Application Data, Application Data"
44,0.837652,10.148.138.27,10.249.238.144,TCP,40,35734  >  5228 [ACK] Seq=1069 Ack=11521 Win=138240 Len=0
45,0.851173,10.148.138.27,10.188.241.137,QUIC,1278,"Initial, DCID=49ba63df42216587, PKN: 1, CRYPTO"
46,0.856918,10.148.138.27,10.188.241.137,QUIC,1278,"Initial, DCID=49ba63df42216587, PKN: 2, PADDING, PING, CRYPTO, CRYPTO, CRYPTO, CRYPTO, PING, PING, PING, PING, CRYPTO, PING, PING, PING, CRYPTO, PING, CRYPTO, CRYPTO, CRYPTO"
47,0.861920,10.148.138.27,10.188.241.137,QUIC,103,"0-RTT, DCID=49ba63df42216587"
48,0.875590,10.148.138.27,10.249.238.144,TLSv1.3,78,Application Data
49,0.875795,10.249.238.144,10.148.138.27,TCP,40,5228  >  35734 [ACK] Seq=11521 Ack=1107 Win=1571840 Len=0
50,0.888489,10.148.138.27,10.249.238.144,TLSv1.3,78,Application Data
51,0.888693,10.249.238.144,10.148.138.27,TCP,40,5228  >  35734 [ACK] Seq=11521 Ack=1145 Win=1571840 Len=0
52,0.901861,10.148.138.27,10.249.238.144,TLSv1.3,78,Application Data
53,0.901985,10.249.238.144,10.148.138.27,TCP,40,5228  >  35734 [ACK] Seq=11521 Ack=1183 Win=1571840 Len=0
54,0.902906,10.188.241.137,10.148.138.27,QUIC,68,"Initial, SCID=e9ba63df42216587, PKN: 1, ACK"
55,0.903115,10.188.241.137,10.148.138.27,QUIC,1278,"Initial, SCID=e9ba63df42216587, PKN: 2, ACK, PADDING"
56,0.916909,10.188.241.137,10.148.138.27,QUIC,1278,"Initial, SCID=e9ba63df42216587, PKN: 3, CRYPTO, PADDING"
57,0.917452,10.188.241.137,10.148.138.27,QUIC,322,Protected Payload (KP0)
58,0.917514,10.188.241.137,10.148.138.27,QUIC,984,Protected Payload (KP0)
59,0.917566,10.188.241.137,10.148.138.27,QUIC,55,Protected Payload (KP0)
60,0.919500,10.148.138.27,10.188.241.137,QUIC,1278,"Initial, DCID=e9ba63df42216587, PKN: 4, ACK, PADDING"
61,0.921176,10.148.138.27,10.188.241.137,QUIC,107,"Handshake, DCID=e9ba63df42216587"
62,0.923793,10.148.138.27,10.249.238.144,TLSv1.3,78,Application Data
63,0.923897,10.249.238.144,10.148.138.27,TCP,40,5228  >  35734 [ACK] Seq=11521 Ack=1221 Win=1571840 Len=0
64,0.925623,10.148.138.27,10.188.241.137,QUIC,340,"Protected Payload (KP0), DCID=e9ba63df42216587"
65,0.926186,10.148.138.27,10.188.241.137,QUIC,59,"Protected Payload (KP0), DCID=e9ba63df42216587"
66,0.927230,10.148.138.27,10.188.241.137,QUIC,286,"Protected Payload (KP0), DCID=e9ba63df42216587"
67,0.929343,10.188.241.137,10.148.138.27,QUIC,52,Protected Payload (KP0)
68,0.957938,10.188.241.137,10.148.138.27,QUIC,148,Protected Payload (KP0)
69,0.958061,10.188.241.137,10.148.138.27,QUIC,57,Protected Payload (KP0)
70,0.958453,10.148.138.27,10.188.241.137,QUIC,59,"Protected Payload (KP0), DCID=e9ba63df42216587"
71,0.958652,10.188.241.137,10.148.138.27,QUIC,53,Protected Payload (KP0)
72,0.985821,10.148.138.27,10.249.238.144,TLSv1.3,78,Application Data
73,0.985937,10.249.238.144,10.148.138.27,TCP,40,5228  >  35734 [ACK] Seq=11521 Ack=1259 Win=1571840 Len=0
74,1.003315,10.188.241.137,10.148.138.27,QUIC,244,Protected Payload (KP0)
75,1.003609,10.188.241.137,10.148.138.27,QUIC,95,Protected Payload (KP0)
76,1.003687,10.188.241.137,10.148.138.27,QUIC,200,Protected Payload (KP0)
77,1.008425,10.148.138.27,10.188.241.137,QUIC,63,"Protected Payload (KP0), DCID=e9ba63df42216587"
78,1.036562,10.148.138.27,10.188.241.137,QUIC,60,"Protected Payload (KP0), DCID=e9ba63df42216587"
79,1.064768,10.188.241.137,10.148.138.27,QUIC,52,Protected Payload (KP0)
80,1.080793,10.148.138.27,10.95.32.170,TCP,60,59092  >  443 [SYN] Seq=0 Win=65535 Len=0 MSS=9960 SACK_PERM TSval=4241618554 TSecr=0 WS=1024
81,1.099538,10.148.138.27,10.64.230.69,DNS,69,Standard query 0x356b A g-fallback.whatsapp.net
82,1.118888,10.95.32.170,10.148.138.27,TCP,48,"443  >  59092 [SYN, ACK] Seq=0 Ack=1 Win=1536 Len=0 MSS=9960 WS=1024"
83,1.119037,10.148.138.27,10.95.32.170,TCP,40,59092  >  443 [ACK] Seq=1 Ack=1 Win=65536 Len=0
84,1.133751,10.148.138.27,10.95.32.170,TLSv1.3,557,Client Hello
85,1.133927,10.95.32.170,10.148.138.27,TCP,40,443  >  59092 [ACK] Seq=1 Ack=518 Win=1571840 Len=0
86,1.140944,10.64.230.69,10.148.138.27,DNS,117,Standard query response 0x356b A g-fallback.whatsapp.net CNAME chat-fallback.cdn.whatsapp.net A 157.240.254.61
87,1.156410,10.148.138.27,10.159.80.59,TCP,60,39534  >  5222 [SYN] Seq=0 Win=65535 Len=0 MSS=9960 SACK_PERM TSval=2879923445 TSecr=0 WS=1024
88,1.179937,10.95.32.170,10.148.138.27,TLSv1.3,258,"Server Hello, Change Cipher Spec, Application Data"
89,1.180107,10.148.138.27,10.95.32.170,TCP,40,59092  >  443 [ACK] Seq=518 Ack=219 Win=67584 Len=0
90,1.186093,10.148.138.27,10.95.32.170,TLSv1.3,104,"Change Cipher Spec, Application Data"
91,1.186194,10.95.32.170,10.148.138.27,TCP,40,443  >  59092 [ACK] Seq=219 Ack=582 Win=1571840 Len=0
92,1.216991,10.159.80.59,10.148.138.27,TCP,48,"5222  >  39534 [SYN, ACK] Seq=0 Ack=1 Win=1536 Len=0 MSS=9960 WS=1024"
93,1.217259,10.148.138.27,10.159.80.59,TCP,40,39534  >  5222 [ACK] Seq=1 Ack=1 Win=65536 Len=0
94,1.222031,10.95.32.170,10.148.138.27,TLSv1.3,217,Application Data
95,1.223734,10.148.138.27,10.95.32.170,TCP,40,59092  >  443 [ACK] Seq=582 Ack=396 Win=68608 Len=0
96,1.307662,10.148.138.27,10.95.32.170,TLSv1.3,1424,Application Data
97,1.307892,10.95.32.170,10.148.138.27,TCP,40,443  >  59092 [ACK] Seq=396 Ack=1966 Win=1570816 Len=0
98,1.312369,10.148.138.27,10.159.80.59,TCP,44,"39534  >  5222 [PSH, ACK] Seq=1 Ack=1 Win=65536 Len=4 [TCP PDU reassembled in 235]"
99,1.312598,10.159.80.59,10.148.138.27,TCP,40,5222  >  39534 [ACK] Seq=1 Ack=5 Win=1571840 Len=0
100,1.323307,10.148.138.27,10.159.80.59,TCP,43,"39534  >  5222 [PSH, ACK] Seq=5 Ack=1 Win=65536 Len=3 [TCP PDU reassembled in 235]"
101,1.323583,10.159.80.59,10.148.138.27,TCP,40,5222  >  39534 [ACK] Seq=1 Ack=8 Win=1571840 Len=0
102,1.323743,10.148.138.27,10.159.80.59,TCP,48,"39534  >  5222 [PSH, ACK] Seq=8 Ack=1 Win=65536 Len=8 [TCP PDU reassembled in 235]"
103,1.323915,10.159.80.59,10.148.138.27,TCP,40,5222  >  39534 [ACK] Seq=1 Ack=16 Win=1571840 Len=0
104,1.374989,10.148.138.27,10.159.80.59,TCP,43,"39534  >  5222 [PSH, ACK] Seq=16 Ack=1 Win=65536 Len=3 [TCP PDU reassembled in 235]"
105,1.375289,10.159.80.59,10.148.138.27,TCP,40,5222  >  39534 [ACK] Seq=1 Ack=19 Win=1571840 Len=0
106,1.376056,10.148.138.27,10.159.80.59,TCP,371,"39534  >  5222 [PSH, ACK] Seq=19 Ack=1 Win=65536 Len=331 [TCP PDU reassembled in 235]"
107,1.376583,10.159.80.59,10.148.138.27,TCP,40,5222  >  39534 [ACK] Seq=1 Ack=350 Win=1571840 Len=0
108,1.381099,10.95.32.170,10.148.138.27,TLSv1.3,781,Application Data
109,1.381353,10.148.138.27,10.95.32.170,TCP,40,59092  >  443 [ACK] Seq=1966 Ack=1137 Win=69632 Len=0
110,1.528203,10.159.80.59,10.148.138.27,TCP,192,"5222  >  39534 [PSH, ACK] Seq=1 Ack=350 Win=1572864 Len=152 [TCP PDU reassembled in 140]"
111,1.528797,10.148.138.27,10.159.80.59,TCP,40,39534  >  5222 [ACK] Seq=350 Ack=153 Win=67584 Len=0
112,1.580248,10.148.138.27,10.159.80.59,TCP,43,"39534  >  5222 [PSH, ACK] Seq=350 Ack=153 Win=67584 Len=3 [TCP PDU reassembled in 235]"
113,1.580482,10.159.80.59,10.148.138.27,TCP,40,5222  >  39534 [ACK] Seq=153 Ack=353 Win=1571840 Len=0
114,1.581166,10.148.138.27,10.159.80.59,TCP,367,"39534  >  5222 [PSH, ACK] Seq=353 Ack=153 Win=67584 Len=327 [TCP PDU reassembled in 235]"
115,1.581291,10.159.80.59,10.148.138.27,TCP,40,5222  >  39534 [ACK] Seq=153 Ack=680 Win=1571840 Len=0
116,1.613485,10.148.138.27,10.159.80.59,TCP,43,"39534  >  5222 [PSH, ACK] Seq=680 Ack=153 Win=67584 Len=3 [TCP PDU reassembled in 235]"
117,1.613757,10.159.80.59,10.148.138.27,TCP,40,5222  >  39534 [ACK] Seq=153 Ack=683 Win=1571840 Len=0
118,1.613972,10.148.138.27,10.159.80.59,TCP,77,"39534  >  5222 [PSH, ACK] Seq=683 Ack=153 Win=67584 Len=37 [TCP PDU reassembled in 235]"
119,1.614072,10.159.80.59,10.148.138.27,TCP,40,5222  >  39534 [ACK] Seq=153 Ack=720 Win=1571840 Len=0
120,1.616201,10.148.138.27,10.159.80.59,TCP,43,"39534  >  5222 [PSH, ACK] Seq=720 Ack=153 Win=67584 Len=3 [TCP PDU reassembled in 235]"
121,1.616553,10.159.80.59,10.148.138.27,TCP,40,5222  >  39534 [ACK] Seq=153 Ack=723 Win=1571840 Len=0
122,1.616763,10.148.138.27,10.159.80.59,TCP,92,"39534  >  5222 [PSH, ACK] Seq=723 Ack=153 Win=67584 Len=52 [TCP PDU reassembled in 235]"
123,1.616868,10.159.80.59,10.148.138.27,TCP,40,5222  >  39534 [ACK] Seq=153 Ack=775 Win=1571840 Len=0
124,1.648683,10.148.138.27,10.159.80.59,TCP,43,"39534  >  5222 [PSH, ACK] Seq=775 Ack=153 Win=67584 Len=3 [TCP PDU reassembled in 235]"
125,1.648859,10.159.80.59,10.148.138.27,TCP,40,5222  >  39534 [ACK] Seq=153 Ack=778 Win=1571840 Len=0
126,1.648972,10.148.138.27,10.159.80.59,TCP,83,"39534  >  5222 [PSH, ACK] Seq=778 Ack=153 Win=67584 Len=43 [TCP PDU reassembled in 235]"
127,1.649022,10.159.80.59,10.148.138.27,TCP,40,5222  >  39534 [ACK] Seq=153 Ack=821 Win=1571840 Len=0
128,1.698468,10.148.138.27,10.159.80.59,TCP,43,"39534  >  5222 [PSH, ACK] Seq=821 Ack=153 Win=67584 Len=3 [TCP PDU reassembled in 235]"
129,1.698638,10.159.80.59,10.148.138.27,TCP,40,5222  >  39534 [ACK] Seq=153 Ack=824 Win=1571840 Len=0
130,1.698743,10.148.138.27,10.159.80.59,TCP,77,"39534  >  5222 [PSH, ACK] Seq=824 Ack=153 Win=67584 Len=37 [TCP PDU reassembled in 235]"
131,1.698790,10.159.80.59,10.148.138.27,TCP,40,5222  >  39534 [ACK] Seq=153 Ack=861 Win=1571840 Len=0
132,1.714308,10.148.138.27,10.159.80.59,TCP,43,"39534  >  5222 [PSH, ACK] Seq=861 Ack=153 Win=67584 Len=3 [TCP PDU reassembled in 235]"
133,1.714744,10.159.80.59,10.148.138.27,TCP,40,5222  >  39534 [ACK] Seq=153 Ack=864 Win=1571840 Len=0
134,1.715396,10.148.138.27,10.159.80.59,TCP,1140,"39534  >  5222 [PSH, ACK] Seq=864 Ack=153 Win=67584 Len=1100 [TCP PDU reassembled in 235]"
135,1.715598,10.159.80.59,10.148.138.27,TCP,40,5222  >  39534 [ACK] Seq=153 Ack=1964 Win=1570816 Len=0
136,1.730017,10.159.80.59,10.148.138.27,TCP,900,"5222  >  39534 [PSH, ACK] Seq=153 Ack=1964 Win=1570816 Len=860 [TCP PDU reassembled in 140]"
137,1.730417,10.148.138.27,10.159.80.59,TCP,40,39534  >  5222 [ACK] Seq=1964 Ack=1013 Win=68608 Len=0
138,1.802475,10.159.80.59,10.148.138.27,TCP,79,"5222  >  39534 [PSH, ACK] Seq=1013 Ack=1964 Win=1572864 Len=39 [TCP PDU reassembled in 140]"
139,1.803038,10.148.138.27,10.159.80.59,TCP,40,39534  >  5222 [ACK] Seq=1964 Ack=1052 Win=68608 Len=0
140,1.838275,10.159.80.59,10.148.138.27,XMPP/XML,73,
141,1.840675,10.148.138.27,10.159.80.59,TCP,40,39534  >  5222 [ACK] Seq=1964 Ack=1085 Win=68608 Len=0
142,1.878819,10.159.80.59,10.148.138.27,TCP,91,"5222  >  39534 [PSH, ACK] Seq=1085 Ack=1964 Win=1572864 Len=51 [TCP PDU reassembled in 243]"
143,1.879070,10.148.138.27,10.159.80.59,TCP,40,39534  >  5222 [ACK] Seq=1964 Ack=1136 Win=68608 Len=0
144,1.883238,10.159.80.59,10.148.138.27,TCP,904,"5222  >  39534 [PSH, ACK] Seq=1136 Ack=1964 Win=1572864 Len=864 [TCP PDU reassembled in 243]"
145,1.883435,10.148.138.27,10.159.80.59,TCP,40,39534  >  5222 [ACK] Seq=1964 Ack=2000 Win=70656 Len=0
146,1.900625,10.148.138.27,10.159.80.59,TCP,43,"39534  >  5222 [PSH, ACK] Seq=1964 Ack=2000 Win=70656 Len=3 [TCP PDU reassembled in 235]"
147,1.900868,10.159.80.59,10.148.138.27,TCP,40,5222  >  39534 [ACK] Seq=2000 Ack=1967 Win=1571840 Len=0
148,1.901292,10.148.138.27,10.159.80.59,TCP,70,"39534  >  5222 [PSH, ACK] Seq=1967 Ack=2000 Win=70656 Len=30 [TCP PDU reassembled in 235]"
149,1.901382,10.159.80.59,10.148.138.27,TCP,40,5222  >  39534 [ACK] Seq=2000 Ack=1997 Win=1571840 Len=0
150,1.982604,10.148.138.27,10.159.80.59,TCP,43,"39534  >  5222 [PSH, ACK] Seq=1997 Ack=2000 Win=70656 Len=3 [TCP PDU reassembled in 235]"
151,1.982881,10.159.80.59,10.148.138.27,TCP,40,5222  >  39534 [ACK] Seq=2000 Ack=2000 Win=1571840 Len=0
152,1.983137,10.148.138.27,10.159.80.59,TCP,146,"39534  >  5222 [PSH, ACK] Seq=2000 Ack=2000 Win=70656 Len=106 [TCP PDU reassembled in 235]"
153,1.983262,10.159.80.59,10.148.138.27,TCP,40,5222  >  39534 [ACK] Seq=2000 Ack=2106 Win=1571840 Len=0
154,2.013518,10.159.80.59,10.148.138.27,TCP,81,"5222  >  39534 [PSH, ACK] Seq=2000 Ack=2106 Win=1571840 Len=41 [TCP PDU reassembled in 243]"
155,2.051576,10.148.138.27,10.159.80.59,TCP,40,39534  >  5222 [ACK] Seq=2106 Ack=2041 Win=70656 Len=0
156,2.068585,10.148.138.27,10.159.80.59,TCP,43,"39534  >  5222 [PSH, ACK] Seq=2106 Ack=2041 Win=70656 Len=3 [TCP PDU reassembled in 235]"
157,2.068840,10.159.80.59,10.148.138.27,TCP,40,5222  >  39534 [ACK] Seq=2041 Ack=2109 Win=1571840 Len=0
158,2.068962,10.148.138.27,10.159.80.59,TCP,146,"39534  >  5222 [PSH, ACK] Seq=2109 Ack=2041 Win=70656 Len=106 [TCP PDU reassembled in 235]"
159,2.069013,10.159.80.59,10.148.138.27,TCP,40,5222  >  39534 [ACK] Seq=2041 Ack=2215 Win=1571840 Len=0
160,2.099876,10.159.80.59,10.148.138.27,TCP,73,"5222  >  39534 [PSH, ACK] Seq=2041 Ack=2215 Win=1571840 Len=33 [TCP PDU reassembled in 243]"
161,2.108150,10.148.138.27,10.159.80.59,TCP,40,39534  >  5222 [ACK] Seq=2215 Ack=2074 Win=70656 Len=0
162,2.112114,10.148.138.27,10.159.80.59,TCP,43,"39534  >  5222 [PSH, ACK] Seq=2215 Ack=2074 Win=70656 Len=3 [TCP PDU reassembled in 235]"
163,2.112341,10.159.80.59,10.148.138.27,TCP,40,5222  >  39534 [ACK] Seq=2074 Ack=2218 Win=1571840 Len=0
164,2.112531,10.148.138.27,10.159.80.59,TCP,458,"39534  >  5222 [PSH, ACK] Seq=2218 Ack=2074 Win=70656 Len=418 [TCP PDU reassembled in 235]"
165,2.112676,10.159.80.59,10.148.138.27,TCP,40,5222  >  39534 [ACK] Seq=2074 Ack=2636 Win=1571840 Len=0
166,2.133491,10.148.138.27,10.159.80.59,TCP,43,"39534  >  5222 [PSH, ACK] Seq=2636 Ack=2074 Win=70656 Len=3 [TCP PDU reassembled in 235]"
167,2.133671,10.159.80.59,10.148.138.27,TCP,40,5222  >  39534 [ACK] Seq=2074 Ack=2639 Win=1571840 Len=0
168,2.133765,10.148.138.27,10.159.80.59,TCP,83,"39534  >  5222 [PSH, ACK] Seq=2639 Ack=2074 Win=70656 Len=43 [TCP PDU reassembled in 235]"
169,2.139220,10.159.80.59,10.148.138.27,TCP,40,5222  >  39534 [ACK] Seq=2074 Ack=2682 Win=1571840 Len=0
170,2.179520,10.159.80.59,10.148.138.27,TCP,73,"5222  >  39534 [PSH, ACK] Seq=2074 Ack=2682 Win=1571840 Len=33 [TCP PDU reassembled in 243]"
171,2.218579,10.148.138.27,10.159.80.59,TCP,40,39534  >  5222 [ACK] Seq=2682 Ack=2107 Win=70656 Len=0
172,2.220905,10.159.80.59,10.148.138.27,TCP,73,"5222  >  39534 [PSH, ACK] Seq=2107 Ack=2682 Win=1572864 Len=33 [TCP PDU reassembled in 243]"
173,2.221350,10.148.138.27,10.159.80.59,TCP,40,39534  >  5222 [ACK] Seq=2682 Ack=2140 Win=70656 Len=0
174,2.247530,10.148.138.27,10.159.80.59,TCP,43,"39534  >  5222 [PSH, ACK] Seq=2682 Ack=2140 Win=70656 Len=3 [TCP PDU reassembled in 235]"
175,2.247719,10.159.80.59,10.148.138.27,TCP,40,5222  >  39534 [ACK] Seq=2140 Ack=2685 Win=1571840 Len=0
176,2.247821,10.148.138.27,10.159.80.59,TCP,83,"39534  >  5222 [PSH, ACK] Seq=2685 Ack=2140 Win=70656 Len=43 [TCP PDU reassembled in 235]"
177,2.247868,10.159.80.59,10.148.138.27,TCP,40,5222  >  39534 [ACK] Seq=2140 Ack=2728 Win=1571840 Len=0
178,2.249218,10.148.138.27,10.159.80.59,TCP,43,"39534  >  5222 [PSH, ACK] Seq=2728 Ack=2140 Win=70656 Len=3 [TCP PDU reassembled in 235]"
179,2.249259,10.159.80.59,10.148.138.27,TCP,40,5222  >  39534 [ACK] Seq=2140 Ack=2731 Win=1571840 Len=0
180,2.249360,10.148.138.27,10.159.80.59,TCP,83,"39534  >  5222 [PSH, ACK] Seq=2731 Ack=2140 Win=70656 Len=43 [TCP PDU reassembled in 235]"
181,2.249419,10.159.80.59,10.148.138.27,TCP,40,5222  >  39534 [ACK] Seq=2140 Ack=2774 Win=1571840 Len=0
182,2.251365,10.148.138.27,10.159.80.59,TCP,43,"39534  >  5222 [PSH, ACK] Seq=2774 Ack=2140 Win=70656 Len=3 [TCP PDU reassembled in 235]"
183,2.251487,10.159.80.59,10.148.138.27,TCP,40,5222  >  39534 [ACK] Seq=2140 Ack=2777 Win=1571840 Len=0
184,2.251578,10.148.138.27,10.159.80.59,TCP,130,"39534  >  5222 [PSH, ACK] Seq=2777 Ack=2140 Win=70656 Len=90 [TCP PDU reassembled in 235]"
185,2.251612,10.159.80.59,10.148.138.27,TCP,40,5222  >  39534 [ACK] Seq=2140 Ack=2867 Win=1571840 Len=0
186,2.512290,10.148.138.27,10.159.80.59,TCP,43,"39534  >  5222 [PSH, ACK] Seq=2867 Ack=2140 Win=70656 Len=3 [TCP PDU reassembled in 235]"
187,2.512504,10.159.80.59,10.148.138.27,TCP,40,5222  >  39534 [ACK] Seq=2140 Ack=2870 Win=1571840 Len=0
188,2.512605,10.148.138.27,10.159.80.59,TCP,92,"39534  >  5222 [PSH, ACK] Seq=2870 Ack=2140 Win=70656 Len=52 [TCP PDU reassembled in 235]"
189,2.512655,10.159.80.59,10.148.138.27,TCP,40,5222  >  39534 [ACK] Seq=2140 Ack=2922 Win=1571840 Len=0
190,2.540811,10.148.138.27,10.159.80.59,TCP,43,"39534  >  5222 [PSH, ACK] Seq=2922 Ack=2140 Win=70656 Len=3 [TCP PDU reassembled in 235]"
191,2.541293,10.159.80.59,10.148.138.27,TCP,40,5222  >  39534 [ACK] Seq=2140 Ack=2925 Win=1571840 Len=0
192,2.541570,10.148.138.27,10.159.80.59,TCP,95,"39534  >  5222 [PSH, ACK] Seq=2925 Ack=2140 Win=70656 Len=55 [TCP PDU reassembled in 235]"
193,2.541731,10.159.80.59,10.148.138.27,TCP,40,5222  >  39534 [ACK] Seq=2140 Ack=2980 Win=1571840 Len=0
194,2.553837,10.148.138.27,10.159.80.59,TCP,43,"39534  >  5222 [PSH, ACK] Seq=2980 Ack=2140 Win=70656 Len=3 [TCP PDU reassembled in 235]"
195,2.554040,10.159.80.59,10.148.138.27,TCP,40,5222  >  39534 [ACK] Seq=2140 Ack=2983 Win=1571840 Len=0
196,2.554490,10.148.138.27,10.159.80.59,TCP,71,"39534  >  5222 [PSH, ACK] Seq=2983 Ack=2140 Win=70656 Len=31 [TCP PDU reassembled in 235]"
197,2.554628,10.159.80.59,10.148.138.27,TCP,40,5222  >  39534 [ACK] Seq=2140 Ack=3014 Win=1571840 Len=0
198,2.657841,10.159.80.59,10.148.138.27,TCP,81,"5222  >  39534 [PSH, ACK] Seq=2140 Ack=3014 Win=1572864 Len=41 [TCP PDU reassembled in 243]"
199,2.658120,10.148.138.27,10.159.80.59,TCP,40,39534  >  5222 [ACK] Seq=3014 Ack=2181 Win=70656 Len=0
200,2.741666,10.159.80.59,10.148.138.27,TCP,331,"5222  >  39534 [PSH, ACK] Seq=2181 Ack=3014 Win=1572864 Len=291 [TCP PDU reassembled in 243]"
201,2.742170,10.148.138.27,10.159.80.59,TCP,40,39534  >  5222 [ACK] Seq=3014 Ack=2472 Win=72704 Len=0
202,3.658258,10.148.138.27,10.159.80.59,TCP,43,"39534  >  5222 [PSH, ACK] Seq=3014 Ack=2472 Win=72704 Len=3 [TCP PDU reassembled in 235]"
203,3.658836,10.159.80.59,10.148.138.27,TCP,40,5222  >  39534 [ACK] Seq=2472 Ack=3017 Win=1571840 Len=0
204,3.659112,10.148.138.27,10.159.80.59,TCP,83,"39534  >  5222 [PSH, ACK] Seq=3017 Ack=2472 Win=72704 Len=43 [TCP PDU reassembled in 235]"
205,3.659212,10.159.80.59,10.148.138.27,TCP,40,5222  >  39534 [ACK] Seq=2472 Ack=3060 Win=1571840 Len=0
206,3.796016,10.159.80.59,10.148.138.27,TCP,1171,"5222  >  39534 [PSH, ACK] Seq=2472 Ack=3060 Win=1572864 Len=1131 [TCP PDU reassembled in 243]"
207,3.796331,10.148.138.27,10.159.80.59,TCP,40,39534  >  5222 [ACK] Seq=3060 Ack=3603 Win=74752 Len=0
208,4.110669,10.148.138.27,10.95.32.170,TCP,60,59104  >  443 [SYN] Seq=0 Win=65535 Len=0 MSS=9960 SACK_PERM TSval=4241621587 TSecr=0 WS=1024
209,4.157482,10.95.32.170,10.148.138.27,TCP,48,"443  >  59104 [SYN, ACK] Seq=0 Ack=1 Win=1536 Len=0 MSS=9960 WS=1024"
210,4.158681,10.148.138.27,10.95.32.170,TCP,40,59104  >  443 [ACK] Seq=1 Ack=1 Win=65536 Len=0
211,4.268694,10.148.138.27,10.159.80.59,TCP,43,"39534  >  5222 [PSH, ACK] Seq=3060 Ack=3603 Win=74752 Len=3 [TCP PDU reassembled in 235]"
212,4.269018,10.159.80.59,10.148.138.27,TCP,40,5222  >  39534 [ACK] Seq=3603 Ack=3063 Win=1571840 Len=0
213,4.269211,10.148.138.27,10.159.80.59,TCP,86,"39534  >  5222 [PSH, ACK] Seq=3063 Ack=3603 Win=74752 Len=46 [TCP PDU reassembled in 235]"
214,4.269313,10.159.80.59,10.148.138.27,TCP,40,5222  >  39534 [ACK] Seq=3603 Ack=3109 Win=1571840 Len=0
215,4.302844,10.148.138.27,10.159.80.59,TCP,43,"39534  >  5222 [PSH, ACK] Seq=3109 Ack=3603 Win=74752 Len=3 [TCP PDU reassembled in 235]"
216,4.303051,10.159.80.59,10.148.138.27,TCP,40,5222  >  39534 [ACK] Seq=3603 Ack=3112 Win=1571840 Len=0
217,4.303218,10.148.138.27,10.159.80.59,TCP,615,"39534  >  5222 [PSH, ACK] Seq=3112 Ack=3603 Win=74752 Len=575 [TCP PDU reassembled in 235]"
218,4.303299,10.159.80.59,10.148.138.27,TCP,40,5222  >  39534 [ACK] Seq=3603 Ack=3687 Win=1571840 Len=0
219,4.309197,10.148.138.27,10.95.32.170,TLSv1.3,447,Client Hello (SNI=media-yyz1-1.cdn.whatsapp.net)
220,4.309540,10.95.32.170,10.148.138.27,TCP,40,443  >  59104 [ACK] Seq=1 Ack=408 Win=1571840 Len=0
221,4.315197,10.148.138.27,10.95.32.170,TLSv1.3,46,Change Cipher Spec
222,4.315499,10.95.32.170,10.148.138.27,TCP,40,443  >  59104 [ACK] Seq=1 Ack=414 Win=1571840 Len=0
223,4.321852,10.148.138.27,10.95.32.170,TLSv1.3,793,Application Data
224,4.322026,10.95.32.170,10.148.138.27,TCP,40,443  >  59104 [ACK] Seq=1 Ack=1167 Win=1570816 Len=0
225,4.357075,10.95.32.170,10.148.138.27,TLSv1.3,262,"Server Hello, Change Cipher Spec, Application Data"
226,4.357563,10.148.138.27,10.95.32.170,TCP,40,59104  >  443 [ACK] Seq=1167 Ack=223 Win=67584 Len=0
227,4.366581,10.148.138.27,10.95.32.170,TLSv1.3,66,Application Data
228,4.366810,10.95.32.170,10.148.138.27,TCP,40,443  >  59104 [ACK] Seq=223 Ack=1193 Win=1571840 Len=0
229,4.370271,10.148.138.27,10.95.32.170,TLSv1.3,98,Application Data
230,4.370506,10.95.32.170,10.148.138.27,TCP,40,443  >  59104 [ACK] Seq=223 Ack=1251 Win=1571840 Len=0
231,4.371203,10.95.32.170,10.148.138.27,TLSv1.3,1955,Application Data
232,4.371362,10.148.138.27,10.95.32.170,TCP,40,59104  >  443 [ACK] Seq=1251 Ack=2138 Win=70656 Len=0
233,4.386861,10.148.138.27,10.159.80.59,TCP,43,"39534  >  5222 [PSH, ACK] Seq=3687 Ack=3603 Win=74752 Len=3 [TCP PDU reassembled in 235]"
234,4.387167,10.159.80.59,10.148.138.27,TCP,40,5222  >  39534 [ACK] Seq=3603 Ack=3690 Win=1571840 Len=0
235,4.387388,10.148.138.27,10.159.80.59,TCP,84,"39534  >  5222 [PSH, ACK] Seq=3690 Ack=3603 Win=74752 Len=44 [TCP PDU reassembled in 235]"
236,4.387500,10.159.80.59,10.148.138.27,TCP,40,5222  >  39534 [ACK] Seq=3603 Ack=3734 Win=1571840 Len=0
237,4.409306,10.95.32.170,10.148.138.27,TLSv1.3,225,Application Data
238,4.409974,10.148.138.27,10.95.32.170,TCP,40,59104  >  443 [ACK] Seq=1251 Ack=2323 Win=74752 Len=0
239,4.423800,10.159.80.59,10.148.138.27,TCP,705,"5222  >  39534 [PSH, ACK] Seq=3603 Ack=3734 Win=1571840 Len=665 [TCP PDU reassembled in 243]"
240,4.424134,10.148.138.27,10.159.80.59,TCP,40,39534  >  5222 [ACK] Seq=3734 Ack=4268 Win=76800 Len=0
241,4.435319,10.159.80.59,10.148.138.27,TCP,92,"5222  >  39534 [PSH, ACK] Seq=4268 Ack=3734 Win=1571840 Len=52 [TCP PDU reassembled in 243]"
242,4.435460,10.148.138.27,10.159.80.59,TCP,40,39534  >  5222 [ACK] Seq=3734 Ack=4320 Win=76800 Len=0
243,4.554316,10.159.80.59,10.148.138.27,TCP,91,"5222  >  39534 [PSH, ACK] Seq=4320 Ack=3734 Win=1572864 Len=51 [TCP PDU reassembled in 243]"
244,4.554714,10.148.138.27,10.159.80.59,TCP,40,39534  >  5222 [ACK] Seq=3734 Ack=4371 Win=76800 Len=0
245,4.994037,10.214.169.128,10.64.230.69,DNS,67,Standard query 0xf7d4 AAAA alt5-mtalk.google.com
246,4.998046,10.214.169.128,10.64.230.69,DNS,67,Standard query 0xc04a A alt5-mtalk.google.com
247,5.033178,10.64.230.69,10.214.169.128,DNS,129,Standard query response 0xf7d4 AAAA alt5-mtalk.google.com CNAME alt5.mobile-gtalk.l.google.com AAAA 2a00:1450:4025:c03::bc
248,5.035748,10.64.230.69,10.214.169.128,DNS,117,Standard query response 0xc04a A alt5-mtalk.google.com CNAME alt5.mobile-gtalk.l.google.com A 142.251.9.188
249,5.353348,10.148.138.27,10.249.238.144,TLSv1.3,408,Application Data
250,5.353736,10.249.238.144,10.148.138.27,TCP,40,5228  >  35734 [ACK] Seq=11521 Ack=1627 Win=1571840 Len=0
251,5.409086,10.249.238.144,10.148.138.27,TLSv1.3,122,Application Data
252,5.409344,10.148.138.27,10.249.238.144,TCP,40,35734  >  5228 [ACK] Seq=1627 Ack=11603 Win=138240 Len=0
253,5.432251,10.148.138.27,10.249.238.144,TLSv1.3,64,Application Data
254,5.432435,10.249.238.144,10.148.138.27,TCP,40,5228  >  35734 [ACK] Seq=11603 Ack=1651 Win=1571840 Len=0
255,5.433068,10.148.138.27,10.249.238.144,TCP,40,"35734  >  5228 [FIN, ACK] Seq=1651 Ack=11603 Win=138240 Len=0"
256,5.433178,10.249.238.144,10.148.138.27,TCP,40,5228  >  35734 [ACK] Seq=11603 Ack=1652 Win=1571840 Len=0
257,5.477168,10.249.238.144,10.148.138.27,TCP,40,"5228  >  35734 [RST, ACK] Seq=11603 Ack=1652 Win=64512 Len=0"
258,5.508020,10.148.138.27,10.95.32.170,TLSv1.3,773,Application Data
259,5.508272,10.95.32.170,10.148.138.27,TCP,40,443  >  59104 [ACK] Seq=2323 Ack=1984 Win=1571840 Len=0
260,5.547380,10.95.32.170,10.148.138.27,TLSv1.3,883,Application Data
261,5.550895,10.95.32.170,10.148.138.27,TLSv1.3,1224,Application Data
262,5.551975,10.148.138.27,10.95.32.170,TCP,40,59104  >  443 [ACK] Seq=1984 Ack=3166 Win=78848 Len=0
263,5.552080,10.148.138.27,10.95.32.170,TCP,40,59104  >  443 [ACK] Seq=1984 Ack=4350 Win=98304 Len=0
264,11.580575,10.148.138.27,10.95.99.90,DNS,64,Standard query 0x3780 A graph.facebook.com
265,11.641931,10.95.99.90,10.148.138.27,DNS,104,Standard query response 0x3780 A graph.facebook.com CNAME star.c10r.facebook.com A 31.13.80.8
266,12.037739,10.148.138.27,10.249.238.144,TCP,60,35004  >  5228 [SYN] Seq=0 Win=65535 Len=0 MSS=9960 SACK_PERM TSval=3017960718 TSecr=0 WS=1024
267,12.085301,10.249.238.144,10.148.138.27,TCP,48,"5228  >  35004 [SYN, ACK] Seq=0 Ack=1 Win=1536 Len=0 MSS=9960 WS=1024"
268,12.085659,10.148.138.27,10.249.238.144,TCP,40,35004  >  5228 [ACK] Seq=1 Ack=1 Win=65536 Len=0
269,12.087073,10.148.138.27,10.249.238.144,TLSv1.3,576,Client Hello (SNI=mtalk.google.com)
270,12.087302,10.249.238.144,10.148.138.27,TCP,40,5228  >  35004 [ACK] Seq=1 Ack=537 Win=1571840 Len=0
271,12.141484,10.249.238.144,10.148.138.27,TLSv1.3,243,"Server Hello, Change Cipher Spec, Application Data"
272,12.142483,10.148.138.27,10.249.238.144,TCP,40,35004  >  5228 [ACK] Seq=537 Ack=204 Win=67584 Len=0
273,12.142937,10.148.138.27,10.249.238.144,TLSv1.3,104,"Change Cipher Spec, Application Data"
274,12.143103,10.249.238.144,10.148.138.27,TCP,40,5228  >  35004 [ACK] Seq=204 Ack=601 Win=1571840 Len=0
275,12.156824,10.148.138.27,10.249.238.144,TLSv1.3,812,Application Data
276,12.157071,10.249.238.144,10.148.138.27,TCP,40,5228  >  35004 [ACK] Seq=204 Ack=1373 Win=1571840 Len=0
277,12.207208,10.249.238.144,10.148.138.27,TLSv1.3,575,"Application Data, Application Data"
278,12.207634,10.148.138.27,10.249.238.144,TCP,40,35004  >  5228 [ACK] Seq=1373 Ack=739 Win=68608 Len=0
279,12.234271,10.249.238.144,10.148.138.27,TLSv1.3,158,"Application Data, Application Data"
280,12.234682,10.148.138.27,10.249.238.144,TCP,40,35004  >  5228 [ACK] Seq=1373 Ack=857 Win=68608 Len=0
281,12.268218,10.148.138.27,10.188.241.137,QUIC,89,"Protected Payload (KP0), DCID=e9ba63df42216587"
282,12.268605,10.148.138.27,10.188.241.137,QUIC,286,"Protected Payload (KP0), DCID=e9ba63df42216587"
283,12.299997,10.188.241.137,10.148.138.27,QUIC,55,Protected Payload (KP0)
284,12.326137,10.148.138.27,10.188.241.137,QUIC,60,"Protected Payload (KP0), DCID=e9ba63df42216587"
285,12.357956,10.188.241.137,10.148.138.27,QUIC,118,Protected Payload (KP0)
286,12.358095,10.188.241.137,10.148.138.27,QUIC,95,Protected Payload (KP0)
287,12.358149,10.188.241.137,10.148.138.27,QUIC,254,Protected Payload (KP0)
288,12.358631,10.148.138.27,10.188.241.137,QUIC,63,"Protected Payload (KP0), DCID=e9ba63df42216587"
289,12.385247,10.148.138.27,10.188.241.137,QUIC,60,"Protected Payload (KP0), DCID=e9ba63df42216587"
290,12.408727,10.188.241.137,10.148.138.27,QUIC,52,Protected Payload (KP0)
291,14.948690,10.148.138.27,10.95.99.90,DNS,76,Standard query 0x9585 A self.events.data.microsoft.com
292,14.999738,10.95.99.90,10.148.138.27,DNS,197,Standard query response 0x9585 A self.events.data.microsoft.com CNAME self-events-data.trafficmanager.net CNAME onedscolprdcus17.centralus.cloudapp.azure.com A 104.208.16.91
293,32.813443,10.148.138.27,10.159.80.59,TCP,40,"39534  >  5222 [RST, ACK] Seq=3734 Ack=4371 Win=76800 Len=0"
294,32.813945,10.159.80.59,10.148.138.27,TCP,40,"5222  >  39534 [RST, ACK] Seq=4371 Ack=3734 Win=64512 Len=0"
295,36.814496,10.148.138.27,10.64.230.69,DNS,61,Standard query 0x79c7 A api.weather.com
296,36.864080,10.64.230.69,10.148.138.27,DNS,283,Standard query response 0x79c7 A api.weather.com CNAME api.weather.com.edgesuite.net CNAME a2049.dscapi7.akamai.net A 23.43.243.136 A 23.43.243.137 A 23.43.243.168 A 23.43.243.169 A 23.43.243.161 A 23.43.243.153 A 23.43.243.154 A 23.43.243.160 A 23.43.243.145
297,36.879324,10.148.138.27,10.211.146.57,TCP,60,44600  >  443 [SYN] Seq=0 Win=65535 Len=0 MSS=9960 SACK_PERM TSval=414171763 TSecr=0 WS=1024
298,36.910775,10.211.146.57,10.148.138.27,TCP,48,"443  >  44600 [SYN, ACK] Seq=0 Ack=1 Win=1536 Len=0 MSS=9960 WS=1024"
299,36.910931,10.148.138.27,10.211.146.57,TCP,40,44600  >  443 [ACK] Seq=1 Ack=1 Win=65536 Len=0
300,36.929663,10.148.138.27,10.211.146.57,TLSv1.3,557,Client Hello (SNI=api.weather.com)
301,36.929973,10.211.146.57,10.148.138.27,TCP,40,443  >  44600 [ACK] Seq=1 Ack=518 Win=1571840 Len=0
302,37.010460,10.211.146.57,10.148.138.27,TLSv1.3,1416,"Server Hello, Change Cipher Spec, Application Data"
303,37.010721,10.148.138.27,10.211.146.57,TCP,40,44600  >  443 [ACK] Seq=518 Ack=1377 Win=86016 Len=0
304,37.011542,10.211.146.57,10.148.138.27,TLSv1.3,2244,"Application Data, Application Data, Application Data"
305,37.011605,10.148.138.27,10.211.146.57,TCP,40,44600  >  443 [ACK] Seq=518 Ack=3581 Win=105472 Len=0
306,37.083201,10.148.138.27,10.211.146.57,TLSv1.3,120,"Change Cipher Spec, Application Data"
307,37.085729,10.211.146.57,10.148.138.27,TCP,40,443  >  44600 [ACK] Seq=3581 Ack=598 Win=1571840 Len=0
308,37.093818,10.148.138.27,10.211.146.57,TLSv1.3,518,Application Data
309,37.093919,10.211.146.57,10.148.138.27,TCP,40,443  >  44600 [ACK] Seq=3581 Ack=1076 Win=1571840 Len=0
310,37.116981,10.211.146.57,10.148.138.27,TLSv1.3,327,Application Data
311,37.117796,10.148.138.27,10.211.146.57,TCP,40,44600  >  443 [ACK] Seq=1076 Ack=3868 Win=110592 Len=0
312,37.120064,10.211.146.57,10.148.138.27,TLSv1.3,327,Application Data
313,37.120376,10.148.138.27,10.211.146.57,TCP,40,44600  >  443 [ACK] Seq=1076 Ack=4155 Win=114688 Len=0
314,37.323686,10.211.146.57,10.148.138.27,TLSv1.3,7194,Application Data
315,37.323964,10.148.138.27,10.211.146.57,TCP,40,44600  >  443 [ACK] Seq=1076 Ack=11309 Win=134144 Len=0
316,37.355600,10.148.138.27,10.211.146.57,TLSv1.3,392,Application Data
317,37.355854,10.211.146.57,10.148.138.27,TCP,40,443  >  44600 [ACK] Seq=11309 Ack=1428 Win=1571840 Len=0
318,37.540129,10.211.146.57,10.148.138.27,TLSv1.3,1220,Application Data
319,37.540439,10.148.138.27,10.211.146.57,TCP,40,44600  >  443 [ACK] Seq=1428 Ack=12489 Win=154624 Len=0
320,37.663347,10.148.138.27,10.211.146.57,TLSv1.3,413,Application Data
321,37.668502,10.211.146.57,10.148.138.27,TCP,40,443  >  44600 [ACK] Seq=12489 Ack=1801 Win=1571840 Len=0
322,37.844185,10.211.146.57,10.148.138.27,TLSv1.3,2146,Application Data
323,37.844667,10.148.138.27,10.211.146.57,TCP,40,44600  >  443 [ACK] Seq=1801 Ack=14595 Win=168960 Len=0
324,38.244543,10.148.138.27,10.211.146.57,TLSv1.3,422,Application Data
325,38.245131,10.211.146.57,10.148.138.27,TCP,40,443  >  44600 [ACK] Seq=14595 Ack=2183 Win=1571840 Len=0
326,38.480070,10.211.146.57,10.148.138.27,TLSv1.3,705,"Application Data, Application Data"
327,38.480382,10.148.138.27,10.211.146.57,TCP,40,44600  >  443 [ACK] Seq=2183 Ack=15260 Win=183296 Len=0
328,60.558585,10.215.32.176,10.148.138.27,TCP,40,"443  >  33012 [RST, ACK] Seq=440 Ack=999 Win=64512 Len=0"
329,60.623625,10.148.138.27,10.64.230.69,DNS,68,Standard query 0x044d A mqtt-mini.facebook.com
330,60.728338,10.64.230.69,10.148.138.27,DNS,113,Standard query response 0x044d A mqtt-mini.facebook.com CNAME mqtt-mini.c10r.facebook.com A 31.13.80.34
331,60.742613,10.148.138.27,10.215.32.176,TCP,60,55300  >  443 [SYN] Seq=0 Win=65535 Len=0 MSS=9960 SACK_PERM TSval=1354154271 TSecr=0 WS=1024
332,60.789629,10.215.32.176,10.148.138.27,TCP,48,"443  >  55300 [SYN, ACK] Seq=0 Ack=1 Win=1536 Len=0 MSS=9960 WS=1024"
333,60.790511,10.148.138.27,10.215.32.176,TCP,40,55300  >  443 [ACK] Seq=1 Ack=1 Win=65536 Len=0
334,60.806546,10.148.138.27,10.215.32.176,TLSv1.3,446,Client Hello (SNI=mqtt-mini.facebook.com)
335,60.807318,10.215.32.176,10.148.138.27,TCP,40,443  >  55300 [ACK] Seq=1 Ack=407 Win=1571840 Len=0
336,60.867066,10.215.32.176,10.148.138.27,TLSv1.3,276,"Server Hello, Change Cipher Spec, Application Data"
337,60.868314,10.148.138.27,10.215.32.176,TCP,40,55300  >  443 [ACK] Seq=407 Ack=237 Win=67584 Len=0
338,60.890749,10.148.138.27,10.215.32.176,TLSv1.3,46,Change Cipher Spec
339,60.891182,10.215.32.176,10.148.138.27,TCP,40,443  >  55300 [ACK] Seq=237 Ack=413 Win=1571840 Len=0
340,60.892580,10.148.138.27,10.215.32.176,TLSv1.3,98,Application Data
341,60.892827,10.215.32.176,10.148.138.27,TCP,40,443  >  55300 [ACK] Seq=237 Ack=471 Win=1571840 Len=0
342,60.925308,10.215.32.176,10.148.138.27,TLSv1.3,217,Application Data
343,60.925735,10.148.138.27,10.215.32.176,TCP,40,55300  >  443 [ACK] Seq=471 Ack=414 Win=68608 Len=0
344,60.928854,10.148.138.27,10.215.32.176,TLSv1.3,567,Application Data
345,60.929136,10.215.32.176,10.148.138.27,TCP,40,443  >  55300 [ACK] Seq=414 Ack=998 Win=1571840 Len=0
346,61.003329,10.215.32.176,10.148.138.27,TLSv1.3,66,Application Data
347,61.003816,10.148.138.27,10.215.32.176,TCP,40,55300  >  443 [ACK] Seq=998 Ack=440 Win=68608 Len=0
348,65.765240,10.95.32.170,10.148.138.27,TCP,40,"443  >  59092 [RST, ACK] Seq=1137 Ack=1966 Win=64512 Len=0"
349,65.767191,10.95.32.170,10.148.138.27,TCP,40,"443  >  59104 [RST, ACK] Seq=4350 Ack=1984 Win=64512 Len=0"
350,75.787758,10.249.238.144,10.148.138.27,TCP,40,"5228  >  35004 [RST, ACK] Seq=857 Ack=1373 Win=64512 Len=0"
351,83.314878,10.148.138.27,10.249.238.144,TCP,60,57812  >  5228 [SYN] Seq=0 Win=65535 Len=0 MSS=9960 SACK_PERM TSval=3018031995 TSecr=0 WS=1024
352,83.388714,10.249.238.144,10.148.138.27,TCP,48,"5228  >  57812 [SYN, ACK] Seq=0 Ack=1 Win=1536 Len=0 MSS=9960 WS=1024"
353,83.389368,10.148.138.27,10.249.238.144,TCP,40,57812  >  5228 [ACK] Seq=1 Ack=1 Win=65536 Len=0
354,83.391520,10.148.138.27,10.249.238.144,TLSv1.3,576,Client Hello (SNI=mtalk.google.com)
355,83.391947,10.249.238.144,10.148.138.27,TCP,40,5228  >  57812 [ACK] Seq=1 Ack=537 Win=1571840 Len=0
356,83.456242,10.249.238.144,10.148.138.27,TLSv1.3,243,"Server Hello, Change Cipher Spec, Application Data"
357,83.457400,10.148.138.27,10.249.238.144,TCP,40,57812  >  5228 [ACK] Seq=537 Ack=204 Win=67584 Len=0
358,83.459618,10.148.138.27,10.249.238.144,TLSv1.3,104,"Change Cipher Spec, Application Data"
359,83.459832,10.249.238.144,10.148.138.27,TCP,40,5228  >  57812 [ACK] Seq=204 Ack=601 Win=1571840 Len=0
360,83.485752,10.148.138.27,10.249.238.144,TLSv1.3,456,Application Data
361,83.486098,10.249.238.144,10.148.138.27,TCP,40,5228  >  57812 [ACK] Seq=204 Ack=1017 Win=1571840 Len=0
362,83.533886,10.249.238.144,10.148.138.27,TLSv1.3,575,"Application Data, Application Data"
363,83.534256,10.148.138.27,10.249.238.144,TCP,40,57812  >  5228 [ACK] Seq=1017 Ack=739 Win=68608 Len=0
364,83.562989,10.249.238.144,10.148.138.27,TLSv1.3,158,"Application Data, Application Data"
365,83.564199,10.148.138.27,10.249.238.144,TCP,40,57812  >  5228 [ACK] Seq=1017 Ack=857 Win=68608 Len=0
366,83.640286,10.148.138.27,10.188.241.137,QUIC,1278,"Initial, DCID=992a113028e1a898, PKN: 1, CRYPTO"
367,83.648539,10.148.138.27,10.188.241.137,QUIC,1278,"Initial, DCID=992a113028e1a898, PKN: 2, CRYPTO, PADDING, CRYPTO, CRYPTO"
368,83.651229,10.148.138.27,10.188.241.137,QUIC,110,"0-RTT, DCID=992a113028e1a898"
369,83.681719,10.188.241.137,10.148.138.27,QUIC,68,"Initial, SCID=f92a113028e1a898, PKN: 1, ACK"
370,83.681950,10.188.241.137,10.148.138.27,QUIC,1278,"Initial, SCID=f92a113028e1a898, PKN: 2, ACK, PADDING"
371,83.696675,10.188.241.137,10.148.138.27,QUIC,1278,"Initial, SCID=f92a113028e1a898, PKN: 3, CRYPTO, PADDING"
372,83.696800,10.188.241.137,10.148.138.27,QUIC,335,Protected Payload (KP0)
