No.,Time,Source,Destination,Protocol,Length,Info
1,0.000000,10.209.225.230,10.132.243.49,DNS,62,Standard query 0xd774 A mtalk.google.com
2,0.032163,10.132.243.49,10.209.225.230,DNS,107,Standard query response 0xd774 A mtalk.google.com CNAME mobile-gtalk.l.google.com A 172.253.63.188
3,0.066458,10.209.225.230,10.49.89.149,TCP,60,47508  >  5228 [SYN] Seq=0 Win=65535 Len=0 MSS=9960 SACK_PERM TSval=3852636579 TSecr=0 WS=512
4,0.111117,10.49.89.149,10.209.225.230,TCP,48,"5228  >  47508 [SYN, ACK] Seq=0 Ack=1 Win=4096 Len=0 MSS=9960 WS=512"
5,0.111298,10.209.225.230,10.49.89.149,TCP,40,47508  >  5228 [ACK] Seq=1 Ack=1 Win=79872 Len=0
6,0.112108,10.209.225.230,10.49.89.149,TLSv1.3,576,Client Hello (SNI=mtalk.google.com)
7,0.112280,10.49.89.149,10.209.225.230,TCP,40,5228  >  47508 [ACK] Seq=1 Ack=537 Win=2096128 Len=0
8,0.119871,10.209.225.230,10.141.224.128,TCP,60,40350  >  443 [SYN] Seq=0 Win=65535 Len=0 MSS=9960 SACK_PERM TSval=4275018190 TSecr=0 WS=512
9,0.155565,10.49.89.149,10.209.225.230,TLSv1.3,243,"Server Hello, Change Cipher Spec, Application Data"
10,0.155870,10.209.225.230,10.49.89.149,TCP,40,47508  >  5228 [ACK] Seq=537 Ack=204 Win=80896 Len=0
11,0.157049,10.209.225.230,10.49.89.149,TLSv1.3,104,"Change Cipher Spec, Application Data"
12,0.157162,10.49.89.149,10.209.225.230,TCP,40,5228  >  47508 [ACK] Seq=204 Ack=601 Win=2096640 Len=0
13,0.173459,10.209.225.230,10.49.89.149,TLSv1.3,457,Application Data
14,0.173620,10.49.89.149,10.209.225.230,TCP,40,5228  >  47508 [ACK] Seq=204 Ack=1018 Win=2096640 Len=0
15,0.225751,10.209.225.230,10.49.89.149,TLSv1.3,481,Application Data
16,0.226046,10.49.89.149,10.209.225.230,TCP,40,5228  >  47508 [ACK] Seq=204 Ack=1459 Win=2096128 Len=0
17,0.230200,10.49.89.149,10.209.225.230,TLSv1.3,575,"Application Data, Application Data"
18,0.257503,10.49.89.149,10.209.225.230,TLSv1.3,158,"Application Data, Application Data"
19,0.257683,10.209.225.230,10.49.89.149,TCP,40,47508  >  5228 [ACK] Seq=1459 Ack=857 Win=81920 Len=0
20,0.275913,10.49.89.149,10.209.225.230,TLSv1.3,144,"Application Data, Application Data"
21,0.288094,10.209.225.230,10.49.89.149,TLSv1.3,64,Application Data
22,0.288334,10.49.89.149,10.209.225.230,TCP,40,5228  >  47508 [ACK] Seq=961 Ack=1483 Win=2096640 Len=0
23,0.289365,10.209.225.230,10.49.89.149,TCP,40,"47508  >  5228 [FIN, ACK] Seq=1483 Ack=961 Win=81920 Len=0"
24,0.289531,10.49.89.149,10.209.225.230,TCP,40,5228  >  47508 [ACK] Seq=961 Ack=1484 Win=2096640 Len=0
25,0.327860,10.49.89.149,10.209.225.230,TCP,40,"5228  >  47508 [RST, ACK] Seq=961 Ack=1484 Win=65024 Len=0"
26,0.372939,10.141.224.128,10.209.225.230,TCP,48,"443  >  40350 [SYN, ACK] Seq=0 Ack=1 Win=4096 Len=0 MSS=9960 WS=512"
27,0.373334,10.209.225.230,10.141.224.128,TCP,40,40350  >  443 [ACK] Seq=1 Ack=1 Win=79872 Len=0
28,0.375762,10.209.225.230,10.141.224.128,TCP,148,"40350  >  443 [PSH, ACK] Seq=1 Ack=1 Win=79872 Len=108"
29,0.376249,10.141.224.128,10.209.225.230,TCP,40,443  >  40350 [ACK] Seq=1 Ack=109 Win=2096640 Len=0
30,0.668682,10.141.224.128,10.209.225.230,TCP,106,"443  >  40350 [PSH, ACK] Seq=1 Ack=109 Win=2097152 Len=66"
31,0.670030,10.209.225.230,10.141.224.128,TCP,40,40350  >  443 [ACK] Seq=109 Ack=67 Win=79872 Len=0
32,0.682841,10.209.225.230,10.141.224.128,TCP,590,"40350  >  443 [PSH, ACK] Seq=109 Ack=67 Win=79872 Len=550"
33,0.683370,10.141.224.128,10.209.225.230,TCP,40,443  >  40350 [ACK] Seq=67 Ack=659 Win=2096128 Len=0
34,0.990610,10.141.224.128,10.209.225.230,TCP,145,"443  >  40350 [PSH, ACK] Seq=67 Ack=659 Win=2097152 Len=105"
35,1.030266,10.209.225.230,10.141.224.128,TCP,40,40350  >  443 [ACK] Seq=659 Ack=172 Win=79872 Len=0
36,5.309802,10.209.225.230,10.49.89.149,TCP,60,47516  >  5228 [SYN] Seq=0 Win=65535 Len=0 MSS=9960 SACK_PERM TSval=3852641820 TSecr=0 WS=512
37,5.371353,10.49.89.149,10.209.225.230,TCP,48,"5228  >  47516 [SYN, ACK] Seq=0 Ack=1 Win=4096 Len=0 MSS=9960 WS=512"
38,5.371766,10.209.225.230,10.49.89.149,TCP,40,47516  >  5228 [ACK] Seq=1 Ack=1 Win=79872 Len=0
39,5.374605,10.209.225.230,10.49.89.149,TLSv1.3,576,Client Hello (SNI=mtalk.google.com)
40,5.375201,10.49.89.149,10.209.225.230,TCP,40,5228  >  47516 [ACK] Seq=1 Ack=537 Win=2096128 Len=0
41,5.433530,10.49.89.149,10.209.225.230,TLSv1.3,243,"Server Hello, Change Cipher Spec, Application Data"
42,5.434139,10.209.225.230,10.49.89.149,TCP,40,47516  >  5228 [ACK] Seq=537 Ack=204 Win=80896 Len=0
43,5.437386,10.209.225.230,10.49.89.149,TLSv1.3,104,"Change Cipher Spec, Application Data"
44,5.437693,10.49.89.149,10.209.225.230,TCP,40,5228  >  47516 [ACK] Seq=204 Ack=601 Win=2096640 Len=0
45,5.456604,10.209.225.230,10.49.89.149,TLSv1.3,460,Application Data
46,5.456894,10.49.89.149,10.209.225.230,TCP,40,5228  >  47516 [ACK] Seq=204 Ack=1021 Win=2096640 Len=0
47,5.505596,10.49.89.149,10.209.225.230,TLSv1.3,575,"Application Data, Application Data"
48,5.536705,10.49.89.149,10.209.225.230,TLSv1.3,158,"Application Data, Application Data"
49,5.536973,10.209.225.230,10.49.89.149,TCP,40,47516  >  5228 [ACK] Seq=1021 Ack=857 Win=81920 Len=0
50,16.677621,10.209.225.230,10.132.243.49,DNS,65,Standard query 0xd580 A sdk-01.moengage.com
51,16.722180,10.132.243.49,10.209.225.230,DNS,129,Standard query response 0xd580 A sdk-01.moengage.com A 3.162.3.19 A 3.162.3.5 A 3.162.3.65 A 3.162.3.126
52,16.733934,10.209.225.230,10.1.154.217,TCP,60,40550  >  443 [SYN] Seq=0 Win=65535 Len=0 MSS=9960 SACK_PERM TSval=57213365 TSecr=0 WS=512
53,16.774236,10.1.154.217,10.209.225.230,TCP,48,"443  >  40550 [SYN, ACK] Seq=0 Ack=1 Win=4096 Len=0 MSS=9960 WS=512"
54,16.774788,10.209.225.230,10.1.154.217,TCP,40,40550  >  443 [ACK] Seq=1 Ack=1 Win=79872 Len=0
55,16.783798,10.209.225.230,10.1.154.217,TLSv1.3,557,Client Hello (SNI=sdk-01.moengage.com)
56,16.784760,10.1.154.217,10.209.225.230,TCP,40,443  >  40550 [ACK] Seq=1 Ack=518 Win=2096128 Len=0
57,16.840310,10.1.154.217,10.209.225.230,TLSv1.3,280,"Server Hello, Change Cipher Spec, Application Data, Application Data"
58,16.841137,10.209.225.230,10.1.154.217,TCP,40,40550  >  443 [ACK] Seq=518 Ack=241 Win=80896 Len=0
59,16.847367,10.209.225.230,10.1.154.217,TLSv1.3,104,"Change Cipher Spec, Application Data"
60,16.847684,10.1.154.217,10.209.225.230,TCP,40,443  >  40550 [ACK] Seq=241 Ack=582 Win=2096640 Len=0
61,16.853498,10.209.225.230,10.1.154.217,TCP,1064,40550  >  443 [ACK] Seq=582 Ack=241 Win=80896 Len=1024 [TCP PDU reassembled in 63]
62,16.853605,10.209.225.230,10.1.154.217,TCP,1064,40550  >  443 [ACK] Seq=1606 Ack=241 Win=80896 Len=1024 [TCP PDU reassembled in 63]
63,16.853649,10.209.225.230,10.1.154.217,TLSv1.3,288,Application Data
64,16.854087,10.1.154.217,10.209.225.230,TCP,40,443  >  40550 [ACK] Seq=241 Ack=2878 Win=2094592 Len=0
65,16.888079,10.1.154.217,10.209.225.230,TLSv1.3,219,Application Data
66,16.920727,10.209.225.230,10.1.154.217,TCP,40,40550  >  443 [ACK] Seq=2878 Ack=420 Win=81920 Len=0
67,16.930256,10.1.154.217,10.209.225.230,TLSv1.3,614,"Application Data, Application Data"
68,16.930658,10.209.225.230,10.1.154.217,TCP,40,40550  >  443 [ACK] Seq=2878 Ack=994 Win=83456 Len=0
69,21.432209,10.209.225.230,10.132.243.49,DNS,72,Standard query 0x7ac9 A android.clients.google.com
70,21.469247,10.132.243.49,10.209.225.230,DNS,160,Standard query response 0x7ac9 A android.clients.google.com CNAME android.l.google.com A 142.250.69.46 A 142.250.69.110 A 142.250.69.78 A 142.250.69.142
71,21.482572,10.209.225.230,10.15.81.32,TCP,60,43846  >  443 [SYN] Seq=0 Win=65535 Len=0 MSS=9960 SACK_PERM TSval=2463062217 TSecr=0 WS=512
72,21.522133,10.15.81.32,10.209.225.230,TCP,48,"443  >  43846 [SYN, ACK] Seq=0 Ack=1 Win=4096 Len=0 MSS=9960 WS=512"
73,21.522411,10.209.225.230,10.15.81.32,TCP,40,43846  >  443 [ACK] Seq=1 Ack=1 Win=79872 Len=0
74,21.526714,10.209.225.230,10.15.81.32,TLSv1.3,557,Client Hello (SNI=android.clients.google.com)
75,21.527093,10.15.81.32,10.209.225.230,TCP,40,443  >  43846 [ACK] Seq=1 Ack=518 Win=2096128 Len=0
76,21.583011,10.15.81.32,10.209.225.230,TLSv1.3,1428,"Server Hello, Change Cipher Spec"
77,21.583937,10.209.225.230,10.15.81.32,TCP,40,43846  >  443 [ACK] Seq=518 Ack=1389 Win=99840 Len=0
78,21.595129,10.15.81.32,10.209.225.230,TLSv1.3,3925,Application Data
79,21.595480,10.209.225.230,10.15.81.32,TCP,40,43846  >  443 [ACK] Seq=518 Ack=5274 Win=107520 Len=0
80,21.643255,10.209.225.230,10.15.81.32,TLSv1.3,104,"Change Cipher Spec, Application Data"
81,21.643660,10.15.81.32,10.209.225.230,TCP,40,443  >  43846 [ACK] Seq=5274 Ack=582 Win=2096640 Len=0
82,21.653036,10.209.225.230,10.15.81.32,TLSv1.3,625,Application Data
83,21.653332,10.15.81.32,10.209.225.230,TCP,40,443  >  43846 [ACK] Seq=5274 Ack=1167 Win=2096128 Len=0
84,21.738771,10.15.81.32,10.209.225.230,TLSv1.3,1469,"Application Data, Application Data, Application Data, Application Data, Application Data"
85,21.739549,10.209.225.230,10.15.81.32,TCP,40,43846  >  443 [ACK] Seq=1167 Ack=6703 Win=127488 Len=0
86,29.952450,10.209.225.230,10.132.243.49,DNS,60,Standard query 0xee57 A g.whatsapp.net
87,30.095643,10.132.243.49,10.209.225.230,DNS,99,Standard query response 0xee57 A g.whatsapp.net CNAME chat.cdn.whatsapp.net A 31.13.80.48
88,30.108506,10.209.225.230,10.39.74.109,TCP,60,46744  >  80 [SYN] Seq=0 Win=65535 Len=0 MSS=9960 SACK_PERM TSval=3810267267 TSecr=0 WS=512
89,30.118152,10.209.225.230,10.39.74.109,TCP,60,46746  >  80 [SYN] Seq=0 Win=65535 Len=0 MSS=9960 SACK_PERM TSval=3810267273 TSecr=0 WS=512
90,30.157976,10.39.74.109,10.209.225.230,TCP,48,"80  >  46744 [SYN, ACK] Seq=0 Ack=1 Win=4096 Len=0 MSS=9960 WS=512"
91,30.158502,10.209.225.230,10.39.74.109,TCP,40,46744  >  80 [ACK] Seq=1 Ack=1 Win=79872 Len=0
92,30.170511,10.39.74.109,10.209.225.230,TCP,48,"80  >  46746 [SYN, ACK] Seq=0 Ack=1 Win=4096 Len=0 MSS=9960 WS=512"
93,30.171106,10.209.225.230,10.39.74.109,TCP,40,46746  >  80 [ACK] Seq=1 Ack=1 Win=79872 Len=0
94,30.182872,10.209.225.230,10.39.74.109,TCP,197,"46744  >  80 [PSH, ACK] Seq=1 Ack=1 Win=79872 Len=157 [TCP PDU reassembled in 1162]"
95,30.183625,10.39.74.109,10.209.225.230,TCP,40,80  >  46744 [ACK] Seq=1 Ack=158 Win=2096640 Len=0
96,30.184488,10.209.225.230,10.39.74.109,TCP,43,"46744  >  80 [PSH, ACK] Seq=158 Ack=1 Win=79872 Len=3 [TCP PDU reassembled in 1162]"
97,30.184796,10.39.74.109,10.209.225.230,TCP,40,80  >  46744 [ACK] Seq=1 Ack=161 Win=2096640 Len=0
98,30.185362,10.209.225.230,10.39.74.109,TCP,41,"46744  >  80 [PSH, ACK] Seq=161 Ack=1 Win=79872 Len=1 [TCP PDU reassembled in 1162]"
99,30.185460,10.39.74.109,10.209.225.230,TCP,40,80  >  46744 [ACK] Seq=1 Ack=162 Win=2096640 Len=0
100,30.185886,10.209.225.230,10.39.74.109,TCP,41,"46744  >  80 [PSH, ACK] Seq=162 Ack=1 Win=79872 Len=1 [TCP PDU reassembled in 1162]"
101,30.185964,10.39.74.109,10.209.225.230,TCP,40,80  >  46744 [ACK] Seq=1 Ack=163 Win=2096640 Len=0
102,30.186414,10.209.225.230,10.39.74.109,TCP,384,"46744  >  80 [PSH, ACK] Seq=163 Ack=1 Win=79872 Len=344 [TCP PDU reassembled in 1162]"
103,30.186983,10.39.74.109,10.209.225.230,TCP,40,80  >  46744 [ACK] Seq=1 Ack=507 Win=2096640 Len=0
104,30.187413,10.209.225.230,10.39.74.109,TCP,41,"46744  >  80 [PSH, ACK] Seq=507 Ack=1 Win=79872 Len=1 [TCP PDU reassembled in 1162]"
105,30.187487,10.39.74.109,10.209.225.230,TCP,40,80  >  46744 [ACK] Seq=1 Ack=508 Win=2096640 Len=0
106,30.188098,10.209.225.230,10.39.74.109,TCP,41,"46744  >  80 [PSH, ACK] Seq=508 Ack=1 Win=79872 Len=1 [TCP PDU reassembled in 1162]"
107,30.188168,10.39.74.109,10.209.225.230,TCP,40,80  >  46744 [ACK] Seq=1 Ack=509 Win=2096640 Len=0
108,30.193254,10.209.225.230,10.39.74.109,TCP,197,"46746  >  80 [PSH, ACK] Seq=1 Ack=1 Win=79872 Len=157 [TCP PDU reassembled in 213]"
109,30.193809,10.39.74.109,10.209.225.230,TCP,40,80  >  46746 [ACK] Seq=1 Ack=158 Win=2096640 Len=0
110,30.194420,10.209.225.230,10.39.74.109,TCP,43,"46746  >  80 [PSH, ACK] Seq=158 Ack=1 Win=79872 Len=3 [TCP PDU reassembled in 213]"
111,30.194499,10.39.74.109,10.209.225.230,TCP,40,80  >  46746 [ACK] Seq=1 Ack=161 Win=2096640 Len=0
112,30.194862,10.209.225.230,10.39.74.109,TCP,41,"46746  >  80 [PSH, ACK] Seq=161 Ack=1 Win=79872 Len=1 [TCP PDU reassembled in 213]"
113,30.194921,10.39.74.109,10.209.225.230,TCP,40,80  >  46746 [ACK] Seq=1 Ack=162 Win=2096640 Len=0
114,30.195218,10.209.225.230,10.39.74.109,TCP,41,"46746  >  80 [PSH, ACK] Seq=162 Ack=1 Win=79872 Len=1 [TCP PDU reassembled in 213]"
115,30.195273,10.39.74.109,10.209.225.230,TCP,40,80  >  46746 [ACK] Seq=1 Ack=163 Win=2096640 Len=0
116,30.195569,10.209.225.230,10.39.74.109,TCP,378,"46746  >  80 [PSH, ACK] Seq=163 Ack=1 Win=79872 Len=338 [TCP PDU reassembled in 213]"
117,30.195796,10.39.74.109,10.209.225.230,TCP,40,80  >  46746 [ACK] Seq=1 Ack=501 Win=2096640 Len=0
118,30.196040,10.209.225.230,10.39.74.109,TCP,41,"46746  >  80 [PSH, ACK] Seq=501 Ack=1 Win=79872 Len=1 [TCP PDU reassembled in 213]"
119,30.196168,10.39.74.109,10.209.225.230,TCP,40,80  >  46746 [ACK] Seq=1 Ack=502 Win=2096640 Len=0
120,30.196407,10.209.225.230,10.39.74.109,TCP,41,"46746  >  80 [PSH, ACK] Seq=502 Ack=1 Win=79872 Len=1 [TCP PDU reassembled in 213]"
121,30.196446,10.39.74.109,10.209.225.230,TCP,40,80  >  46746 [ACK] Seq=1 Ack=503 Win=2096640 Len=0
122,30.261815,10.39.74.109,10.209.225.230,TCP,331,"80  >  46746 [PSH, ACK] Seq=1 Ack=503 Win=2097152 Len=291 [TCP PDU reassembled in 219]"
123,30.262630,10.209.225.230,10.39.74.109,TCP,40,46746  >  80 [ACK] Seq=503 Ack=292 Win=80896 Len=0
124,30.295012,10.209.225.230,10.39.74.109,TCP,42,"46746  >  80 [PSH, ACK] Seq=503 Ack=292 Win=80896 Len=2 [TCP PDU reassembled in 213]"
125,30.295346,10.39.74.109,10.209.225.230,TCP,40,80  >  46746 [ACK] Seq=292 Ack=505 Win=2096640 Len=0
126,30.296095,10.39.74.109,10.209.225.230,TCP,333,"80  >  46744 [PSH, ACK] Seq=1 Ack=509 Win=2097152 Len=293 [TCP PDU reassembled in 868]"
127,30.296426,10.209.225.230,10.39.74.109,TCP,40,46744  >  80 [ACK] Seq=509 Ack=294 Win=80896 Len=0
128,30.296763,10.209.225.230,10.39.74.109,TCP,41,"46746  >  80 [PSH, ACK] Seq=505 Ack=292 Win=80896 Len=1 [TCP PDU reassembled in 213]"
129,30.296829,10.39.74.109,10.209.225.230,TCP,40,80  >  46746 [ACK] Seq=292 Ack=506 Win=2096640 Len=0
130,30.297113,10.209.225.230,10.39.74.109,TCP,41,"46746  >  80 [PSH, ACK] Seq=506 Ack=292 Win=80896 Len=1 [TCP PDU reassembled in 213]"
131,30.297156,10.39.74.109,10.209.225.230,TCP,40,80  >  46746 [ACK] Seq=292 Ack=507 Win=2096640 Len=0
132,30.297690,10.209.225.230,10.39.74.109,TCP,288,"46746  >  80 [PSH, ACK] Seq=507 Ack=292 Win=80896 Len=248 [TCP PDU reassembled in 213]"
133,30.297808,10.39.74.109,10.209.225.230,TCP,40,80  >  46746 [ACK] Seq=292 Ack=755 Win=2096640 Len=0
134,30.298046,10.209.225.230,10.39.74.109,TCP,41,"46746  >  80 [PSH, ACK] Seq=755 Ack=292 Win=80896 Len=1 [TCP PDU reassembled in 213]"
135,30.298089,10.39.74.109,10.209.225.230,TCP,40,80  >  46746 [ACK] Seq=292 Ack=756 Win=2096640 Len=0
136,30.298310,10.209.225.230,10.39.74.109,TCP,41,"46746  >  80 [PSH, ACK] Seq=756 Ack=292 Win=80896 Len=1 [TCP PDU reassembled in 213]"
137,30.298350,10.39.74.109,10.209.225.230,TCP,40,80  >  46746 [ACK] Seq=292 Ack=757 Win=2096640 Len=0
138,30.301159,10.209.225.230,10.39.74.109,TCP,42,"46746  >  80 [PSH, ACK] Seq=757 Ack=292 Win=80896 Len=2 [TCP PDU reassembled in 213]"
139,30.301300,10.39.74.109,10.209.225.230,TCP,40,80  >  46746 [ACK] Seq=292 Ack=759 Win=2096640 Len=0
140,30.301867,10.209.225.230,10.39.74.109,TCP,41,"46746  >  80 [PSH, ACK] Seq=759 Ack=292 Win=80896 Len=1 [TCP PDU reassembled in 213]"
141,30.302078,10.39.74.109,10.209.225.230,TCP,40,80  >  46746 [ACK] Seq=292 Ack=760 Win=2096640 Len=0
142,30.302400,10.209.225.230,10.39.74.109,TCP,41,"46746  >  80 [PSH, ACK] Seq=760 Ack=292 Win=80896 Len=1 [TCP PDU reassembled in 213]"
143,30.302448,10.39.74.109,10.209.225.230,TCP,40,80  >  46746 [ACK] Seq=292 Ack=761 Win=2096640 Len=0
144,30.302743,10.209.225.230,10.39.74.109,TCP,80,"46746  >  80 [PSH, ACK] Seq=761 Ack=292 Win=80896 Len=40 [TCP PDU reassembled in 213]"
145,30.302784,10.39.74.109,10.209.225.230,TCP,40,80  >  46746 [ACK] Seq=292 Ack=801 Win=2096640 Len=0
146,30.303011,10.209.225.230,10.39.74.109,TCP,41,"46746  >  80 [PSH, ACK] Seq=801 Ack=292 Win=80896 Len=1 [TCP PDU reassembled in 213]"
147,30.303050,10.39.74.109,10.209.225.230,TCP,40,80  >  46746 [ACK] Seq=292 Ack=802 Win=2096640 Len=0
148,30.303481,10.209.225.230,10.39.74.109,TCP,41,"46746  >  80 [PSH, ACK] Seq=802 Ack=292 Win=80896 Len=1 [TCP PDU reassembled in 213]"
149,30.303525,10.39.74.109,10.209.225.230,TCP,40,80  >  46746 [ACK] Seq=292 Ack=803 Win=2096640 Len=0
150,30.304406,10.209.225.230,10.39.74.109,TCP,42,"46746  >  80 [PSH, ACK] Seq=803 Ack=292 Win=80896 Len=2 [TCP PDU reassembled in 213]"
151,30.304453,10.39.74.109,10.209.225.230,TCP,40,80  >  46746 [ACK] Seq=292 Ack=805 Win=2096640 Len=0
152,30.304701,10.209.225.230,10.39.74.109,TCP,41,"46746  >  80 [PSH, ACK] Seq=805 Ack=292 Win=80896 Len=1 [TCP PDU reassembled in 213]"
153,30.304740,10.39.74.109,10.209.225.230,TCP,40,80  >  46746 [ACK] Seq=292 Ack=806 Win=2096640 Len=0
154,30.304970,10.209.225.230,10.39.74.109,TCP,41,"46746  >  80 [PSH, ACK] Seq=806 Ack=292 Win=80896 Len=1 [TCP PDU reassembled in 213]"
155,30.305008,10.39.74.109,10.209.225.230,TCP,40,80  >  46746 [ACK] Seq=292 Ack=807 Win=2096640 Len=0
156,30.305229,10.209.225.230,10.39.74.109,TCP,95,"46746  >  80 [PSH, ACK] Seq=807 Ack=292 Win=80896 Len=55 [TCP PDU reassembled in 213]"
157,30.305534,10.39.74.109,10.209.225.230,TCP,40,80  >  46746 [ACK] Seq=292 Ack=862 Win=2096640 Len=0
158,30.305778,10.209.225.230,10.39.74.109,TCP,41,"46746  >  80 [PSH, ACK] Seq=862 Ack=292 Win=80896 Len=1 [TCP PDU reassembled in 213]"
159,30.305824,10.39.74.109,10.209.225.230,TCP,40,80  >  46746 [ACK] Seq=292 Ack=863 Win=2096640 Len=0
160,30.306981,10.209.225.230,10.39.74.109,TCP,41,"46746  >  80 [PSH, ACK] Seq=863 Ack=292 Win=80896 Len=1 [TCP PDU reassembled in 213]"
161,30.307052,10.39.74.109,10.209.225.230,TCP,40,80  >  46746 [ACK] Seq=292 Ack=864 Win=2096640 Len=0
162,30.312781,10.209.225.230,10.39.74.109,TCP,43,"46744  >  80 [PSH, ACK] Seq=509 Ack=294 Win=80896 Len=3 [TCP PDU reassembled in 1162]"
163,30.313086,10.39.74.109,10.209.225.230,TCP,40,80  >  46744 [ACK] Seq=294 Ack=512 Win=2096640 Len=0
164,30.313515,10.209.225.230,10.39.74.109,TCP,41,"46744  >  80 [PSH, ACK] Seq=512 Ack=294 Win=80896 Len=1 [TCP PDU reassembled in 1162]"
165,30.313572,10.39.74.109,10.209.225.230,TCP,40,80  >  46744 [ACK] Seq=294 Ack=513 Win=2096640 Len=0
166,30.313828,10.209.225.230,10.39.74.109,TCP,41,"46744  >  80 [PSH, ACK] Seq=513 Ack=294 Win=80896 Len=1 [TCP PDU reassembled in 1162]"
167,30.313882,10.39.74.109,10.209.225.230,TCP,40,80  >  46744 [ACK] Seq=294 Ack=514 Win=2096640 Len=0
168,30.314095,10.209.225.230,10.39.74.109,TCP,320,"46744  >  80 [PSH, ACK] Seq=514 Ack=294 Win=80896 Len=280 [TCP PDU reassembled in 1162]"
169,30.314130,10.39.74.109,10.209.225.230,TCP,40,80  >  46744 [ACK] Seq=294 Ack=794 Win=2096640 Len=0
170,30.314315,10.209.225.230,10.39.74.109,TCP,41,"46744  >  80 [PSH, ACK] Seq=794 Ack=294 Win=80896 Len=1 [TCP PDU reassembled in 1162]"
171,30.314347,10.39.74.109,10.209.225.230,TCP,40,80  >  46744 [ACK] Seq=294 Ack=795 Win=2096640 Len=0
172,30.314525,10.209.225.230,10.39.74.109,TCP,41,"46744  >  80 [PSH, ACK] Seq=795 Ack=294 Win=80896 Len=1 [TCP PDU reassembled in 1162]"
173,30.314557,10.39.74.109,10.209.225.230,TCP,40,80  >  46744 [ACK] Seq=294 Ack=796 Win=2096640 Len=0
174,30.316141,10.209.225.230,10.39.74.109,TCP,42,"46744  >  80 [PSH, ACK] Seq=796 Ack=294 Win=80896 Len=2 [TCP PDU reassembled in 1162]"
175,30.316230,10.39.74.109,10.209.225.230,TCP,40,80  >  46744 [ACK] Seq=294 Ack=798 Win=2096640 Len=0
176,30.316542,10.209.225.230,10.39.74.109,TCP,41,"46744  >  80 [PSH, ACK] Seq=798 Ack=294 Win=80896 Len=1 [TCP PDU reassembled in 1162]"
177,30.316588,10.39.74.109,10.209.225.230,TCP,40,80  >  46744 [ACK] Seq=294 Ack=799 Win=2096640 Len=0
178,30.316805,10.209.225.230,10.39.74.109,TCP,41,"46744  >  80 [PSH, ACK] Seq=799 Ack=294 Win=80896 Len=1 [TCP PDU reassembled in 1162]"
179,30.316839,10.39.74.109,10.209.225.230,TCP,40,80  >  46744 [ACK] Seq=294 Ack=800 Win=2096640 Len=0
180,30.317349,10.209.225.230,10.39.74.109,TCP,80,"46744  >  80 [PSH, ACK] Seq=800 Ack=294 Win=80896 Len=40 [TCP PDU reassembled in 1162]"
181,30.317444,10.39.74.109,10.209.225.230,TCP,40,80  >  46744 [ACK] Seq=294 Ack=840 Win=2096640 Len=0
182,30.317690,10.209.225.230,10.39.74.109,TCP,41,"46744  >  80 [PSH, ACK] Seq=840 Ack=294 Win=80896 Len=1 [TCP PDU reassembled in 1162]"
183,30.317728,10.39.74.109,10.209.225.230,TCP,40,80  >  46744 [ACK] Seq=294 Ack=841 Win=2096640 Len=0
184,30.323585,10.209.225.230,10.39.74.109,TCP,41,"46744  >  80 [PSH, ACK] Seq=841 Ack=294 Win=80896 Len=1 [TCP PDU reassembled in 1162]"
185,30.323917,10.39.74.109,10.209.225.230,TCP,40,80  >  46744 [ACK] Seq=294 Ack=842 Win=2096640 Len=0
186,30.325344,10.209.225.230,10.39.74.109,TCP,42,"46744  >  80 [PSH, ACK] Seq=842 Ack=294 Win=80896 Len=2 [TCP PDU reassembled in 1162]"
187,30.325653,10.39.74.109,10.209.225.230,TCP,40,80  >  46744 [ACK] Seq=294 Ack=844 Win=2096640 Len=0
188,30.326115,10.209.225.230,10.39.74.109,TCP,41,"46744  >  80 [PSH, ACK] Seq=844 Ack=294 Win=80896 Len=1 [TCP PDU reassembled in 1162]"
189,30.326170,10.39.74.109,10.209.225.230,TCP,40,80  >  46744 [ACK] Seq=294 Ack=845 Win=2096640 Len=0
190,30.326414,10.209.225.230,10.39.74.109,TCP,41,"46744  >  80 [PSH, ACK] Seq=845 Ack=294 Win=80896 Len=1 [TCP PDU reassembled in 1162]"
191,30.326449,10.39.74.109,10.209.225.230,TCP,40,80  >  46744 [ACK] Seq=294 Ack=846 Win=2096640 Len=0
192,30.326662,10.209.225.230,10.39.74.109,TCP,95,"46744  >  80 [PSH, ACK] Seq=846 Ack=294 Win=80896 Len=55 [TCP PDU reassembled in 1162]"
193,30.326696,10.39.74.109,10.209.225.230,TCP,40,80  >  46744 [ACK] Seq=294 Ack=901 Win=2096640 Len=0
194,30.326893,10.209.225.230,10.39.74.109,TCP,41,"46744  >  80 [PSH, ACK] Seq=901 Ack=294 Win=80896 Len=1 [TCP PDU reassembled in 1162]"
195,30.326925,10.39.74.109,10.209.225.230,TCP,40,80  >  46744 [ACK] Seq=294 Ack=902 Win=2096640 Len=0
196,30.327115,10.209.225.230,10.39.74.109,TCP,41,"46744  >  80 [PSH, ACK] Seq=902 Ack=294 Win=80896 Len=1 [TCP PDU reassembled in 1162]"
197,30.327147,10.39.74.109,10.209.225.230,TCP,40,80  >  46744 [ACK] Seq=294 Ack=903 Win=2096640 Len=0
198,30.348111,10.209.225.230,10.39.74.109,TCP,43,"46744  >  80 [PSH, ACK] Seq=903 Ack=294 Win=80896 Len=3 [TCP PDU reassembled in 1162]"
199,30.348300,10.39.74.109,10.209.225.230,TCP,40,80  >  46744 [ACK] Seq=294 Ack=906 Win=2096640 Len=0
200,30.348789,10.209.225.230,10.39.74.109,TCP,41,"46744  >  80 [PSH, ACK] Seq=906 Ack=294 Win=80896 Len=1 [TCP PDU reassembled in 1162]"
201,30.348836,10.39.74.109,10.209.225.230,TCP,40,80  >  46744 [ACK] Seq=294 Ack=907 Win=2096640 Len=0
202,30.348965,10.209.225.230,10.39.74.109,TCP,455,"46744  >  80 [PSH, ACK] Seq=907 Ack=294 Win=80896 Len=415 [TCP PDU reassembled in 1162]"
203,30.349066,10.39.74.109,10.209.225.230,TCP,40,80  >  46744 [ACK] Seq=294 Ack=1322 Win=2096128 Len=0
204,30.437801,10.39.74.109,10.209.225.230,TCP,881,"80  >  46746 [PSH, ACK] Seq=292 Ack=864 Win=2097152 Len=841 [TCP PDU reassembled in 219]"
205,30.448959,10.39.74.109,10.209.225.230,TCP,83,"80  >  46746 [PSH, ACK] Seq=1133 Ack=864 Win=2097152 Len=43 [TCP PDU reassembled in 219]"
206,30.449269,10.209.225.230,10.39.74.109,TCP,40,46746  >  80 [ACK] Seq=864 Ack=1176 Win=82944 Len=0
207,30.518352,10.39.74.109,10.209.225.230,TCP,713,"80  >  46744 [PSH, ACK] Seq=294 Ack=1322 Win=2097152 Len=673 [TCP PDU reassembled in 868]"
208,30.551973,10.209.225.230,10.39.74.109,TCP,40,46744  >  80 [ACK] Seq=1322 Ack=967 Win=82432 Len=0
209,30.603673,10.39.74.109,10.209.225.230,TCP,83,"80  >  46744 [PSH, ACK] Seq=967 Ack=1322 Win=2097152 Len=43 [TCP PDU reassembled in 868]"
210,30.604041,10.209.225.230,10.39.74.109,TCP,40,46744  >  80 [ACK] Seq=1322 Ack=1010 Win=82432 Len=0
211,115.787071,10.209.225.230,10.39.74.109,TCP,42,"46746  >  80 [PSH, ACK] Seq=864 Ack=1176 Win=82944 Len=2 [TCP PDU reassembled in 213]"
212,115.803028,10.39.74.109,10.209.225.230,TCP,40,80  >  46746 [ACK] Seq=1176 Ack=866 Win=2096640 Len=0
213,115.803259,10.209.225.230,10.39.74.109,TCP,77,POST /chat HTTP/1.1  [TCP PDU reassembled in 213]
214,115.803299,10.39.74.109,10.209.225.230,TCP,40,80  >  46746 [ACK] Seq=1176 Ack=903 Win=2096640 Len=0
215,115.818209,10.209.225.230,10.39.74.109,TCP,42,"46744  >  80 [PSH, ACK] Seq=1322 Ack=1010 Win=82432 Len=2 [TCP PDU reassembled in 1162]"
216,115.818444,10.39.74.109,10.209.225.230,TCP,40,80  >  46744 [ACK] Seq=1010 Ack=1324 Win=2096640 Len=0
217,115.818638,10.209.225.230,10.39.74.109,TCP,77,"46744  >  80 [PSH, ACK] Seq=1324 Ack=1010 Win=82432 Len=37 [TCP PDU reassembled in 1162]"
218,115.818677,10.39.74.109,10.209.225.230,TCP,40,80  >  46744 [ACK] Seq=1010 Ack=1361 Win=2096640 Len=0
219,116.144947,10.39.74.109,10.209.225.230,TCP,87,HTTP/1.1 200 OK  [TCP PDU reassembled in 219]
220,116.184380,10.209.225.230,10.39.74.109,TCP,40,46746  >  80 [ACK] Seq=903 Ack=1223 Win=82944 Len=0
221,116.184436,10.39.74.109,10.209.225.230,TCP,87,"80  >  46744 [PSH, ACK] Seq=1010 Ack=1361 Win=2097152 Len=47 [TCP PDU reassembled in 868]"
222,116.184657,10.209.225.230,10.39.74.109,TCP,40,46744  >  80 [ACK] Seq=1361 Ack=1057 Win=82432 Len=0
223,118.693176,10.141.224.128,10.209.225.230,TCP,40,"443  >  40350 [RST, ACK] Seq=172 Ack=659 Win=65024 Len=0"
224,120.236105,10.209.225.230,10.141.224.128,TCP,60,40374  >  443 [SYN] Seq=0 Win=65535 Len=0 MSS=9960 SACK_PERM TSval=4275080110 TSecr=0 WS=512
225,120.519151,10.141.224.128,10.209.225.230,TCP,48,"443  >  40374 [SYN, ACK] Seq=0 Ack=1 Win=4096 Len=0 MSS=9960 WS=512"
226,120.519524,10.209.225.230,10.141.224.128,TCP,40,40374  >  443 [ACK] Seq=1 Ack=1 Win=79872 Len=0
227,120.522195,10.209.225.230,10.141.224.128,TCP,148,"40374  >  443 [PSH, ACK] Seq=1 Ack=1 Win=79872 Len=108"
228,120.522823,10.141.224.128,10.209.225.230,TCP,40,443  >  40374 [ACK] Seq=1 Ack=109 Win=2096640 Len=0
229,120.898558,10.141.224.128,10.209.225.230,TCP,106,"443  >  40374 [PSH, ACK] Seq=1 Ack=109 Win=2097152 Len=66"
230,120.899906,10.209.225.230,10.141.224.128,TCP,40,40374  >  443 [ACK] Seq=109 Ack=67 Win=79872 Len=0
231,120.913716,10.209.225.230,10.141.224.128,TCP,590,"40374  >  443 [PSH, ACK] Seq=109 Ack=67 Win=79872 Len=550"
232,120.914429,10.141.224.128,10.209.225.230,TCP,40,443  >  40374 [ACK] Seq=67 Ack=659 Win=2096128 Len=0
233,121.225526,10.141.224.128,10.209.225.230,TCP,145,"443  >  40374 [PSH, ACK] Seq=67 Ack=659 Win=2097152 Len=105"
234,121.263098,10.209.225.230,10.141.224.128,TCP,40,40374  >  443 [ACK] Seq=659 Ack=172 Win=79872 Len=0
235,123.927879,10.49.89.149,10.209.225.230,TCP,40,"5228  >  47516 [RST, ACK] Seq=857 Ack=1021 Win=65024 Len=0"
236,128.790260,10.209.225.230,10.15.81.32,TCP,60,43862  >  443 [SYN] Seq=0 Win=65535 Len=0 MSS=9960 SACK_PERM TSval=2463111333 TSecr=0 WS=512
237,128.835116,10.15.81.32,10.209.225.230,TCP,48,"443  >  43862 [SYN, ACK] Seq=0 Ack=1 Win=4096 Len=0 MSS=9960 WS=512"
238,128.835550,10.209.225.230,10.15.81.32,TCP,40,43862  >  443 [ACK] Seq=1 Ack=1 Win=79872 Len=0
239,128.840647,10.209.225.230,10.15.81.32,TLSv1.3,557,Client Hello (SNI=android.clients.google.com)
240,128.841103,10.15.81.32,10.209.225.230,TCP,40,443  >  43862 [ACK] Seq=1 Ack=518 Win=2096128 Len=0
241,128.894483,10.15.81.32,10.209.225.230,TLSv1.3,2816,"Server Hello, Change Cipher Spec"
242,128.895268,10.209.225.230,10.15.81.32,TCP,40,43862  >  443 [ACK] Seq=518 Ack=2777 Win=99840 Len=0
243,128.906748,10.15.81.32,10.209.225.230,TLSv1.3,2535,Application Data
244,128.907050,10.209.225.230,10.15.81.32,TCP,40,43862  >  443 [ACK] Seq=518 Ack=5272 Win=119808 Len=0
245,128.954783,10.209.225.230,10.15.81.32,TLSv1.3,104,"Change Cipher Spec, Application Data"
246,128.955182,10.15.81.32,10.209.225.230,TCP,40,443  >  43862 [ACK] Seq=5272 Ack=582 Win=2096640 Len=0
247,128.964399,10.209.225.230,10.15.81.32,TLSv1.3,625,Application Data
248,128.964739,10.15.81.32,10.209.225.230,TCP,40,443  >  43862 [ACK] Seq=5272 Ack=1167 Win=2096128 Len=0
249,129.036274,10.15.81.32,10.209.225.230,TLSv1.3,1347,"Application Data, Application Data, Application Data, Application Data"
250,129.036630,10.209.225.230,10.15.81.32,TCP,40,43862  >  443 [ACK] Seq=1167 Ack=6579 Win=139776 Len=0
251,129.048421,10.15.81.32,10.209.225.230,TLSv1.3,67,Application Data
252,129.048756,10.209.225.230,10.15.81.32,TCP,40,43862  >  443 [ACK] Seq=1167 Ack=6606 Win=139776 Len=0
253,129.895819,10.209.225.230,10.49.89.149,TCP,60,47544  >  5228 [SYN] Seq=0 Win=65535 Len=0 MSS=9960 SACK_PERM TSval=3852708212 TSecr=0 WS=512
254,129.960731,10.49.89.149,10.209.225.230,TCP,48,"5228  >  47544 [SYN, ACK] Seq=0 Ack=1 Win=4096 Len=0 MSS=9960 WS=512"
255,129.961159,10.209.225.230,10.49.89.149,TCP,40,47544  >  5228 [ACK] Seq=1 Ack=1 Win=79872 Len=0
256,129.963924,10.209.225.230,10.49.89.149,TLSv1.3,576,Client Hello (SNI=mtalk.google.com)
257,129.964491,10.49.89.149,10.209.225.230,TCP,40,5228  >  47544 [ACK] Seq=1 Ack=537 Win=2096128 Len=0
258,130.027871,10.49.89.149,10.209.225.230,TLSv1.3,243,"Server Hello, Change Cipher Spec, Application Data"
259,130.028706,10.209.225.230,10.49.89.149,TCP,40,47544  >  5228 [ACK] Seq=537 Ack=204 Win=80896 Len=0
260,130.030940,10.209.225.230,10.49.89.149,TLSv1.3,104,"Change Cipher Spec, Application Data"
261,130.031189,10.49.89.149,10.209.225.230,TCP,40,5228  >  47544 [ACK] Seq=204 Ack=601 Win=2096640 Len=0
262,130.064269,10.209.225.230,10.49.89.149,TLSv1.3,456,Application Data
263,130.064767,10.49.89.149,10.209.225.230,TCP,40,5228  >  47544 [ACK] Seq=204 Ack=1017 Win=2096640 Len=0
264,130.127602,10.49.89.149,10.209.225.230,TLSv1.3,575,"Application Data, Application Data"
265,130.155851,10.49.89.149,10.209.225.230,TLSv1.3,158,"Application Data, Application Data"
266,130.156192,10.209.225.230,10.49.89.149,TCP,40,47544  >  5228 [ACK] Seq=1017 Ack=857 Win=81920 Len=0
267,138.892103,10.209.225.230,10.132.243.49,DNS,71,Standard query 0x809d A analytics.apis.mcafee.com
268,139.125022,10.132.243.49,10.209.225.230,DNS,225,Standard query response 0x809d A analytics.apis.mcafee.com CNAME mosaic-nova.apis.mcafee.com A 44.238.49.26 A 54.201.159.33 A 44.242.94.169 A 44.230.170.17 A 54.69.125.197 A 52.89.111.5 A 34.223.237.19 A 52.33.18.59
269,139.129647,10.209.225.230,10.123.22.228,TCP,60,37528  >  443 [SYN] Seq=0 Win=65535 Len=0 MSS=9960 SACK_PERM TSval=377214160 TSecr=0 WS=512
270,139.245005,10.123.22.228,10.209.225.230,TCP,48,"443  >  37528 [SYN, ACK] Seq=0 Ack=1 Win=4096 Len=0 MSS=9960 WS=512"
271,139.245941,10.1.154.217,10.209.225.230,TCP,40,"443  >  40550 [RST, ACK] Seq=994 Ack=2878 Win=65024 Len=0"
272,139.246141,10.209.225.230,10.123.22.228,TCP,40,37528  >  443 [ACK] Seq=1 Ack=1 Win=79872 Len=0
273,139.247263,10.209.225.230,10.123.22.228,TLSv1.3,557,Client Hello (SNI=analytics.apis.mcafee.com)
274,139.247464,10.123.22.228,10.209.225.230,TCP,40,443  >  37528 [ACK] Seq=1 Ack=518 Win=2096128 Len=0
275,139.362897,10.123.22.228,10.209.225.230,TLSv1.3,1428,"Server Hello, Change Cipher Spec, Application Data"
276,139.363358,10.209.225.230,10.123.22.228,TCP,40,37528  >  443 [ACK] Seq=518 Ack=1389 Win=99840 Len=0
277,139.369134,10.123.22.228,10.209.225.230,TCP,2816,"443  >  37528 [PSH, ACK] Seq=1389 Ack=518 Win=2097152 Len=2776 [TCP PDU reassembled in 279]"
278,139.369337,10.209.225.230,10.123.22.228,TCP,40,37528  >  443 [ACK] Seq=518 Ack=4165 Win=119808 Len=0
279,139.369372,10.123.22.228,10.209.225.230,TLSv1.3,1389,"Application Data, Application Data, Application Data"
280,139.369478,10.209.225.230,10.123.22.228,TCP,40,37528  >  443 [ACK] Seq=518 Ack=5514 Win=139776 Len=0
281,139.375914,10.209.225.230,10.123.22.228,TLSv1.3,104,"Change Cipher Spec, Application Data"
282,139.375998,10.123.22.228,10.209.225.230,TCP,40,443  >  37528 [ACK] Seq=5514 Ack=582 Win=2096640 Len=0
283,139.377047,10.209.225.230,10.123.22.228,TLSv1.3,86,Application Data
284,139.377076,10.123.22.228,10.209.225.230,TCP,40,443  >  37528 [ACK] Seq=5514 Ack=628 Win=2096640 Len=0
285,139.377344,10.209.225.230,10.123.22.228,TLSv1.3,77,Application Data
286,139.377363,10.123.22.228,10.209.225.230,TCP,40,443  >  37528 [ACK] Seq=5514 Ack=665 Win=2096640 Len=0
287,139.377534,10.209.225.230,10.123.22.228,TLSv1.3,75,Application Data
288,139.377549,10.123.22.228,10.209.225.230,TCP,40,443  >  37528 [ACK] Seq=5514 Ack=700 Win=2096640 Len=0
289,139.379065,10.209.225.230,10.123.22.228,TLSv1.3,340,Application Data
290,139.379138,10.123.22.228,10.209.225.230,TCP,40,443  >  37528 [ACK] Seq=5514 Ack=1000 Win=2096640 Len=0
291,139.379407,10.209.225.230,10.123.22.228,TCP,1064,37528  >  443 [ACK] Seq=1000 Ack=5514 Win=139776 Len=1024 [TCP PDU reassembled in 303]
292,139.379424,10.209.225.230,10.123.22.228,TCP,1064,37528  >  443 [ACK] Seq=2024 Ack=5514 Win=139776 Len=1024 [TCP PDU reassembled in 303]
293,139.379478,10.123.22.228,10.209.225.230,TCP,40,443  >  37528 [ACK] Seq=5514 Ack=3048 Win=2094592 Len=0
294,139.379551,10.209.225.230,10.123.22.228,TCP,1064,37528  >  443 [ACK] Seq=3048 Ack=5514 Win=139776 Len=1024 [TCP PDU reassembled in 303]
295,139.379561,10.209.225.230,10.123.22.228,TCP,1064,37528  >  443 [ACK] Seq=4072 Ack=5514 Win=139776 Len=1024 [TCP PDU reassembled in 303]
296,139.379570,10.123.22.228,10.209.225.230,TCP,40,443  >  37528 [ACK] Seq=5514 Ack=5096 Win=2092544 Len=0
297,139.379628,10.209.225.230,10.123.22.228,TCP,1064,37528  >  443 [ACK] Seq=5096 Ack=5514 Win=139776 Len=1024 [TCP PDU reassembled in 303]
298,139.379634,10.209.225.230,10.123.22.228,TCP,1064,37528  >  443 [ACK] Seq=6120 Ack=5514 Win=139776 Len=1024 [TCP PDU reassembled in 303]
299,139.379643,10.123.22.228,10.209.225.230,TCP,40,443  >  37528 [ACK] Seq=5514 Ack=7144 Win=2090496 Len=0
300,139.379698,10.209.225.230,10.123.22.228,TCP,1064,37528  >  443 [ACK] Seq=7144 Ack=5514 Win=139776 Len=1024 [TCP PDU reassembled in 303]
301,139.379708,10.209.225.230,10.123.22.228,TCP,1064,37528  >  443 [ACK] Seq=8168 Ack=5514 Win=139776 Len=1024 [TCP PDU reassembled in 303]
302,139.379717,10.123.22.228,10.209.225.230,TCP,40,443  >  37528 [ACK] Seq=5514 Ack=9192 Win=2088448 Len=0
303,139.379767,10.209.225.230,10.123.22.228,TLSv1.3,62,Application Data
304,139.379777,10.123.22.228,10.209.225.230,TCP,40,443  >  37528 [ACK] Seq=5514 Ack=9214 Win=2088448 Len=0
305,139.379965,10.209.225.230,10.123.22.228,TCP,1064,37528  >  443 [ACK] Seq=9214 Ack=5514 Win=139776 Len=1024 [TCP PDU reassembled in 314]
306,139.379972,10.209.225.230,10.123.22.228,TCP,1064,37528  >  443 [ACK] Seq=10238 Ack=5514 Win=139776 Len=1024 [TCP PDU reassembled in 314]
307,139.379989,10.123.22.228,10.209.225.230,TCP,40,443  >  37528 [ACK] Seq=5514 Ack=11262 Win=2086400 Len=0
308,139.380048,10.209.225.230,10.123.22.228,TCP,1064,37528  >  443 [ACK] Seq=11262 Ack=5514 Win=139776 Len=1024 [TCP PDU reassembled in 314]
309,139.380054,10.209.225.230,10.123.22.228,TCP,1064,37528  >  443 [ACK] Seq=12286 Ack=5514 Win=139776 Len=1024 [TCP PDU reassembled in 314]
310,139.380063,10.123.22.228,10.209.225.230,TCP,40,443  >  37528 [ACK] Seq=5514 Ack=13310 Win=2084352 Len=0
311,139.380117,10.209.225.230,10.123.22.228,TCP,1064,37528  >  443 [ACK] Seq=13310 Ack=5514 Win=139776 Len=1024 [TCP PDU reassembled in 314]
312,139.380123,10.209.225.230,10.123.22.228,TCP,1064,37528  >  443 [ACK] Seq=14334 Ack=5514 Win=139776 Len=1024 [TCP PDU reassembled in 314]
313,139.380136,10.123.22.228,10.209.225.230,TCP,40,443  >  37528 [ACK] Seq=5514 Ack=15358 Win=2082304 Len=0
314,139.380187,10.209.225.230,10.123.22.228,TLSv1.3,415,Application Data
315,139.380198,10.123.22.228,10.209.225.230,TCP,40,443  >  37528 [ACK] Seq=5514 Ack=15733 Win=2081792 Len=0
316,139.493821,10.123.22.228,10.209.225.230,TLSv1.3,290,"Application Data, Application Data"
317,139.496306,10.209.225.230,10.123.22.228,TLSv1.3,71,Application Data
318,139.496384,10.123.22.228,10.209.225.230,TCP,40,443  >  37528 [ACK] Seq=5764 Ack=15764 Win=2081792 Len=0
319,139.537918,10.209.225.230,10.132.243.49,DNS,62,Standard query 0x7290 A www.linkedin.com
320,139.590144,10.132.243.49,10.209.225.230,DNS,190,Standard query response 0x7290 A www.linkedin.com CNAME afd-wcs-ramp.www.linkedin.com CNAME afd-cf.www.linkedin.com CNAME www-linkedin-com.l-0005.l-msedge.net CNAME l-0005.l-msedge.net A 13.107.42.14
321,139.596472,10.209.225.230,10.147.29.219,TCP,60,38746  >  443 [SYN] Seq=0 Win=65535 Len=0 MSS=9960 SACK_PERM TSval=1911747255 TSecr=0 WS=512
322,139.601646,10.123.22.228,10.209.225.230,TLSv1.3,75,Application Data
323,139.623320,10.123.22.228,10.209.225.230,TLSv1.3,180,"Application Data, Application Data"
324,139.623626,10.209.225.230,10.123.22.228,TCP,40,37528  >  443 [ACK] Seq=15764 Ack=5939 Win=151040 Len=0
325,139.628956,10.147.29.219,10.209.225.230,TCP,48,"443  >  38746 [SYN, ACK] Seq=0 Ack=1 Win=4096 Len=0 MSS=9960 WS=512"
326,139.629202,10.209.225.230,10.147.29.219,TCP,40,38746  >  443 [ACK] Seq=1 Ack=1 Win=79872 Len=0
327,139.633591,10.209.225.230,10.147.29.219,TLSv1.3,576,Client Hello (SNI=www.linkedin.com)
328,139.634088,10.147.29.219,10.209.225.230,TCP,40,443  >  38746 [ACK] Seq=1 Ack=537 Win=2096128 Len=0
329,139.665820,10.147.29.219,10.209.225.230,TLSv1.3,139,"Hello Retry Request, Change Cipher Spec"
330,139.666339,10.209.225.230,10.147.29.219,TCP,40,38746  >  443 [ACK] Seq=537 Ack=100 Win=79872 Len=0
331,139.670001,10.209.225.230,10.147.29.219,TLSv1.3,642,"Change Cipher Spec, Client Hello (SNI=www.linkedin.com)"
332,139.670104,10.147.29.219,10.209.225.230,TCP,40,443  >  38746 [ACK] Seq=100 Ack=1139 Win=2096128 Len=0
333,139.704774,10.147.29.219,10.209.225.230,TLSv1.3,1440,Server Hello
334,139.710890,10.147.29.219,10.209.225.230,TCP,2840,"443  >  38746 [PSH, ACK] Seq=1500 Ack=1139 Win=2097152 Len=2800 [TCP PDU reassembled in 336]"
335,139.710979,10.209.225.230,10.147.29.219,TCP,40,38746  >  443 [ACK] Seq=1139 Ack=4300 Win=119808 Len=0
336,139.716940,10.147.29.219,10.209.225.230,TLSv1.3,661,Application Data
337,139.752121,10.209.225.230,10.147.29.219,TCP,40,38746  >  443 [ACK] Seq=1139 Ack=4921 Win=125440 Len=0
338,139.756485,10.209.225.230,10.147.29.219,TLSv1.3,114,Application Data
339,139.756602,10.147.29.219,10.209.225.230,TCP,40,443  >  38746 [ACK] Seq=4921 Ack=1213 Win=2096640 Len=0
340,139.756909,10.209.225.230,10.147.29.219,TLSv1.3,132,Application Data
341,139.756926,10.147.29.219,10.209.225.230,TCP,40,443  >  38746 [ACK] Seq=4921 Ack=1305 Win=2096640 Len=0
342,139.759176,10.209.225.230,10.147.29.219,TCP,1064,38746  >  443 [ACK] Seq=1305 Ack=4921 Win=125440 Len=1024 [TCP PDU reassembled in 343]
343,139.759192,10.209.225.230,10.147.29.219,TLSv1.3,305,Application Data
344,139.759197,10.209.225.230,10.147.29.219,TLSv1.3,314,Application Data
345,139.759259,10.147.29.219,10.209.225.230,TCP,40,443  >  38746 [ACK] Seq=4921 Ack=2868 Win=2095104 Len=0
346,139.759508,10.209.225.230,10.147.29.219,TLSv1.3,91,Application Data
347,139.759531,10.147.29.219,10.209.225.230,TCP,40,443  >  38746 [ACK] Seq=4921 Ack=2919 Win=2095104 Len=0
348,139.759639,10.209.225.230,10.147.29.219,TLSv1.3,188,Application Data
349,139.759649,10.147.29.219,10.209.225.230,TCP,40,443  >  38746 [ACK] Seq=4921 Ack=3067 Win=2095104 Len=0
350,139.759789,10.209.225.230,10.147.29.219,TLSv1.3,258,Application Data
351,139.759799,10.147.29.219,10.209.225.230,TCP,40,443  >  38746 [ACK] Seq=4921 Ack=3285 Win=2094592 Len=0
352,139.760830,10.209.225.230,10.147.29.219,TLSv1.3,229,Application Data
353,139.760858,10.209.225.230,10.147.29.219,TLSv1.3,232,Application Data
354,139.760861,10.209.225.230,10.147.29.219,TLSv1.3,472,Application Data
355,139.760866,10.209.225.230,10.147.29.219,TCP,1064,38746  >  443 [ACK] Seq=4098 Ack=4921 Win=125440 Len=1024 [TCP PDU reassembled in 363]
356,139.760871,10.209.225.230,10.147.29.219,TCP,1064,38746  >  443 [ACK] Seq=5122 Ack=4921 Win=125440 Len=1024 [TCP PDU reassembled in 363]
