No.,Time,Source,Destination,Protocol,Length,Info
3,0.478164,10.171.113.129,10.218.219.126,TCP,68,64813  >  443 [SYN] Seq=0 Win=65535 Len=0 MSS=1410 WS=64 TSval=3555715942 TSecr=0 SACK_PERM
4,0.479732,10.171.113.129,10.218.219.126,TCP,68,64814  >  443 [SYN] Seq=0 Win=65535 Len=0 MSS=1410 WS=64 TSval=2141994608 TSecr=0 SACK_PERM
11,0.535814,10.218.219.126,10.171.113.129,TCP,64,"443  >  64814 [SYN, ACK] Seq=0 Ack=1 Win=65535 Len=0 MSS=1400 WS=256 SACK_PERM TSval=319442789 TSecr=2141994608"
12,0.535835,10.218.219.126,10.171.113.129,TCP,64,"443  >  64813 [SYN, ACK] Seq=0 Ack=1 Win=65535 Len=0 MSS=1400 WS=256 SACK_PERM TSval=47525640 TSecr=3555715942"
13,0.537495,10.171.113.129,10.218.219.126,TCP,56,64814  >  443 [ACK] Seq=1 Ack=1 Win=131840 Len=0 TSval=2141994665 TSecr=319442789
14,0.537497,10.171.113.129,10.218.219.126,TLSv1.2,573,Client Hello (SNI=m.hotmail.com)
15,0.537507,10.171.113.129,10.218.219.126,TCP,56,64813  >  443 [ACK] Seq=1 Ack=1 Win=131840 Len=0 TSval=3555716001 TSecr=47525640
16,0.537508,10.171.113.129,10.218.219.126,TLSv1.2,573,Client Hello (SNI=outlook.office365.com)
19,0.58392,10.218.219.126,10.171.113.129,TCP,1444,443  >  64814 [ACK] Seq=1 Ack=518 Win=4193792 Len=1388 TSval=319442829 TSecr=2141994665 [TCP PDU reassembled in 24]
20,0.58415,10.171.113.129,10.218.219.126,TCP,56,64814  >  443 [ACK] Seq=518 Ack=1389 Win=130432 Len=0 TSval=2141994713 TSecr=319442829
21,0.585507,10.218.219.126,10.171.113.129,TCP,1444,443  >  64814 [ACK] Seq=1389 Ack=518 Win=4193792 Len=1388 TSval=319442829 TSecr=2141994665 [TCP PDU reassembled in 24]
22,0.585631,10.171.113.129,10.218.219.126,TCP,56,64814  >  443 [ACK] Seq=518 Ack=2777 Win=129664 Len=0 TSval=2141994714 TSecr=319442829
23,0.58755,10.218.219.126,10.171.113.129,TCP,1444,443  >  64814 [ACK] Seq=2777 Ack=518 Win=4193792 Len=1388 TSval=319442829 TSecr=2141994665 [TCP PDU reassembled in 24]
24,0.587553,10.218.219.126,10.171.113.129,TLSv1.2,331,"Server Hello, Certificate, Certificate Status, Server Key Exchange, Server Hello Done"
25,0.587574,10.218.219.126,10.171.113.129,TCP,1444,443  >  64813 [ACK] Seq=1 Ack=518 Win=4193792 Len=1388 TSval=47525687 TSecr=3555716002 [TCP PDU reassembled in 30]
26,0.587576,10.218.219.126,10.171.113.129,TCP,1444,443  >  64813 [ACK] Seq=1389 Ack=518 Win=4193792 Len=1388 TSval=47525687 TSecr=3555716002 [TCP PDU reassembled in 30]
27,0.588488,10.171.113.129,10.218.219.126,TCP,56,64814  >  443 [ACK] Seq=518 Ack=4440 Win=129408 Len=0 TSval=2141994716 TSecr=319442829
28,0.588494,10.171.113.129,10.218.219.126,TCP,56,64813  >  443 [ACK] Seq=518 Ack=2777 Win=129024 Len=0 TSval=3555716052 TSecr=47525687
29,0.589545,10.218.219.126,10.171.113.129,TCP,1444,443  >  64813 [ACK] Seq=2777 Ack=518 Win=4193792 Len=1388 TSval=47525687 TSecr=3555716002 [TCP PDU reassembled in 30]
30,0.589547,10.218.219.126,10.171.113.129,TLSv1.2,331,"Server Hello, Certificate, Certificate Status, Server Key Exchange, Server Hello Done"
31,0.590192,10.171.113.129,10.218.219.126,TCP,56,64813  >  443 [ACK] Seq=518 Ack=4440 Win=129408 Len=0 TSval=3555716054 TSecr=47525687
44,2.488257,10.171.113.129,10.107.253.142,TCP,68,64815  >  443 [SYN] Seq=0 Win=65535 Len=0 MSS=1410 WS=64 TSval=84841684 TSecr=0 SACK_PERM
45,2.489964,10.171.113.129,10.107.253.142,TCP,68,64816  >  443 [SYN] Seq=0 Win=65535 Len=0 MSS=1410 WS=64 TSval=369101497 TSecr=0 SACK_PERM
52,2.55378,10.107.253.142,10.171.113.129,TCP,64,"443  >  64815 [SYN, ACK] Seq=0 Ack=1 Win=65535 Len=0 MSS=1400 WS=256 SACK_PERM TSval=138714676 TSecr=84841684"
53,2.553807,10.107.253.142,10.171.113.129,TCP,64,"443  >  64816 [SYN, ACK] Seq=0 Ack=1 Win=65535 Len=0 MSS=1400 WS=256 SACK_PERM TSval=60589841 TSecr=369101497"
56,2.555627,10.171.113.129,10.107.253.142,TCP,56,64815  >  443 [ACK] Seq=1 Ack=1 Win=131840 Len=0 TSval=84841750 TSecr=138714676
57,2.555629,10.171.113.129,10.107.253.142,TLSv1.2,573,Client Hello (SNI=outlook.office365.com)
58,2.555637,10.171.113.129,10.107.253.142,TCP,56,64816  >  443 [ACK] Seq=1 Ack=1 Win=131840 Len=0 TSval=369101561 TSecr=60589841
59,2.555638,10.171.113.129,10.107.253.142,TLSv1.2,573,Client Hello (SNI=m.hotmail.com)
61,2.589624,10.118.254.218,10.239.227.202,MDNS,143,"Standard query 0x0000 PTR _companion-link._tcp.local, ""QM"" question PTR _rdlink._tcp.local, ""QM"" question PTR Hinddeep‚\200\231s MacBook Air (2)._companion-link._tcp.local"
63,2.592676,10.107.253.142,10.171.113.129,TCP,1444,443  >  64815 [ACK] Seq=1 Ack=518 Win=4193792 Len=1388 TSval=138714715 TSecr=84841750 [TCP PDU reassembled in 67]
64,2.592907,10.171.113.129,10.107.253.142,TCP,56,64815  >  443 [ACK] Seq=518 Ack=1389 Win=130432 Len=0 TSval=84841789 TSecr=138714715
65,2.595543,10.107.253.142,10.171.113.129,TCP,1444,443  >  64815 [ACK] Seq=1389 Ack=518 Win=4193792 Len=1388 TSval=138714715 TSecr=84841750 [TCP PDU reassembled in 67]
66,2.595544,10.107.253.142,10.171.113.129,TCP,1444,443  >  64815 [ACK] Seq=2777 Ack=518 Win=4193792 Len=1388 TSval=138714715 TSecr=84841750 [TCP PDU reassembled in 67]
67,2.595546,10.107.253.142,10.171.113.129,TLSv1.2,331,"Server Hello, Certificate, Certificate Status, Server Key Exchange, Server Hello Done"
68,2.595568,10.107.253.142,10.171.113.129,TCP,1444,443  >  64816 [ACK] Seq=1 Ack=518 Win=4193792 Len=1388 TSval=60589874 TSecr=369101563 [TCP PDU reassembled in 74]
69,2.59557,10.107.253.142,10.171.113.129,TCP,1444,443  >  64816 [ACK] Seq=1389 Ack=518 Win=4193792 Len=1388 TSval=60589874 TSecr=369101563 [TCP PDU reassembled in 74]
70,2.596462,10.171.113.129,10.107.253.142,TCP,56,64815  >  443 [ACK] Seq=518 Ack=4440 Win=128000 Len=0 TSval=84841792 TSecr=138714715
72,2.59647,10.171.113.129,10.107.253.142,TCP,56,64816  >  443 [ACK] Seq=518 Ack=2777 Win=129024 Len=0 TSval=369101603 TSecr=60589874
73,2.597563,10.107.253.142,10.171.113.129,TCP,1444,443  >  64816 [ACK] Seq=2777 Ack=518 Win=4193792 Len=1388 TSval=60589874 TSecr=369101563 [TCP PDU reassembled in 74]
74,2.597565,10.107.253.142,10.171.113.129,TLSv1.2,331,"Server Hello, Certificate, Certificate Status, Server Key Exchange, Server Hello Done"
75,2.59819,10.171.113.129,10.107.253.142,TCP,56,64816  >  443 [ACK] Seq=518 Ack=4440 Win=129408 Len=0 TSval=369101605 TSecr=60589874
88,4.494596,10.171.113.129,10.93.14.27,TCP,68,64817  >  443 [SYN] Seq=0 Win=65535 Len=0 MSS=1410 WS=64 TSval=926109769 TSecr=0 SACK_PERM
89,4.496452,10.171.113.129,10.93.14.27,TCP,68,64818  >  443 [SYN] Seq=0 Win=65535 Len=0 MSS=1410 WS=64 TSval=964165598 TSecr=0 SACK_PERM
100,4.560827,10.93.14.27,10.171.113.129,TCP,64,"443  >  64817 [SYN, ACK] Seq=0 Ack=1 Win=65535 Len=0 MSS=1400 WS=256 SACK_PERM TSval=124362185 TSecr=926109769"
101,4.561539,10.93.14.27,10.171.113.129,TCP,64,"443  >  64818 [SYN, ACK] Seq=0 Ack=1 Win=65535 Len=0 MSS=1400 WS=256 SACK_PERM TSval=50992626 TSecr=964165598"
102,4.561779,10.171.113.129,10.93.14.27,TCP,56,64817  >  443 [ACK] Seq=1 Ack=1 Win=131840 Len=0 TSval=926109835 TSecr=124362185
103,4.56178,10.171.113.129,10.93.14.27,TLSv1.2,573,Client Hello (SNI=outlook.office365.com)
104,4.5625,10.171.113.129,10.93.14.27,TCP,56,64818  >  443 [ACK] Seq=1 Ack=1 Win=131840 Len=0 TSval=964165662 TSecr=50992626
105,4.562501,10.171.113.129,10.93.14.27,TLSv1.2,573,Client Hello (SNI=m.hotmail.com)
106,4.59776,10.93.14.27,10.171.113.129,TCP,1444,443  >  64817 [ACK] Seq=1 Ack=518 Win=4193792 Len=1388 TSval=124362238 TSecr=926109835 [TCP PDU reassembled in 110]
107,4.598039,10.171.113.129,10.93.14.27,TCP,56,64817  >  443 [ACK] Seq=518 Ack=1389 Win=130432 Len=0 TSval=926109872 TSecr=124362238
108,4.599596,10.93.14.27,10.171.113.129,TCP,1444,443  >  64817 [ACK] Seq=1389 Ack=518 Win=4193792 Len=1388 TSval=124362238 TSecr=926109835 [TCP PDU reassembled in 110]
109,4.599598,10.93.14.27,10.171.113.129,TCP,1444,443  >  64817 [ACK] Seq=2777 Ack=518 Win=4193792 Len=1388 TSval=124362238 TSecr=926109835 [TCP PDU reassembled in 110]
110,4.5996,10.93.14.27,10.171.113.129,TLSv1.2,331,"Server Hello, Certificate, Certificate Status, Server Key Exchange, Server Hello Done"
111,4.600467,10.171.113.129,10.93.14.27,TCP,56,64817  >  443 [ACK] Seq=518 Ack=4440 Win=128000 Len=0 TSval=926109874 TSecr=124362238
113,4.601599,10.93.14.27,10.171.113.129,TCP,1444,443  >  64818 [ACK] Seq=1 Ack=518 Win=4193792 Len=1388 TSval=50992669 TSecr=964165664 [TCP PDU reassembled in 116]
114,4.601601,10.93.14.27,10.171.113.129,TCP,1444,443  >  64818 [ACK] Seq=1389 Ack=518 Win=4193792 Len=1388 TSval=50992669 TSecr=964165664 [TCP PDU reassembled in 116]
115,4.601603,10.93.14.27,10.171.113.129,TCP,1444,443  >  64818 [ACK] Seq=2777 Ack=518 Win=4193792 Len=1388 TSval=50992669 TSecr=964165664 [TCP PDU reassembled in 116]
116,4.601604,10.93.14.27,10.171.113.129,TLSv1.2,331,"Server Hello, Certificate, Certificate Status, Server Key Exchange, Server Hello Done"
117,4.602341,10.171.113.129,10.93.14.27,TCP,56,64818  >  443 [ACK] Seq=518 Ack=4440 Win=127360 Len=0 TSval=964165703 TSecr=50992669
214,14.044185,10.118.254.218,10.239.227.202,MDNS,130,Standard query response 0x0000 PTR 453E895B-2BE2-49B0-9235-586E0C55297C._remotepairing._tcp.local
217,14.180614,10.118.254.218,10.239.227.202,MDNS,161,"Standard query 0x0000 ANY 2E1B7ED5-4B5A-4975-AD38-CE8A43E5A4B4._remotepairing._tcp.local, ""QU"" question SRV 0 0 49152 Tomass-iPhone-mini.local"
220,14.432322,10.118.254.218,10.239.227.202,MDNS,161,"Standard query 0x0000 ANY 2E1B7ED5-4B5A-4975-AD38-CE8A43E5A4B4._remotepairing._tcp.local, ""QM"" question SRV 0 0 49152 Tomass-iPhone-mini.local"
231,14.682923,10.118.254.218,10.239.227.202,MDNS,161,"Standard query 0x0000 ANY 2E1B7ED5-4B5A-4975-AD38-CE8A43E5A4B4._remotepairing._tcp.local, ""QM"" question SRV 0 0 49152 Tomass-iPhone-mini.local"
234,14.93305,10.118.254.218,10.239.227.202,MDNS,392,"Standard query response 0x0000 TXT, cache flush PTR _remotepairing._tcp.local PTR 2E1B7ED5-4B5A-4975-AD38-CE8A43E5A4B4._remotepairing._tcp.local SRV, cache flush 0 0 49152 Tomass-iPhone-mini.local AAAA, cache flush fe80::82:cf4f:ec88:ffec A, cache flush 169.254.135.112 NSEC, cache flush Tomass-iPhone-mini.local NSEC, cache flush 2E1B7ED5-4B5A-4975-AD38-CE8A43E5A4B4._remotepairing._tcp.local"
259,15.934271,10.118.254.218,10.239.227.202,MDNS,392,"Standard query response 0x0000 TXT, cache flush PTR _remotepairing._tcp.local PTR 2E1B7ED5-4B5A-4975-AD38-CE8A43E5A4B4._remotepairing._tcp.local SRV, cache flush 0 0 49152 Tomass-iPhone-mini.local AAAA, cache flush fe80::82:cf4f:ec88:ffec A, cache flush 169.254.135.112 NSEC, cache flush Tomass-iPhone-mini.local NSEC, cache flush 2E1B7ED5-4B5A-4975-AD38-CE8A43E5A4B4._remotepairing._tcp.local"
264,16.045068,10.118.254.218,10.239.227.202,MDNS,130,Standard query response 0x0000 PTR 453E895B-2BE2-49B0-9235-586E0C55297C._remotepairing._tcp.local
285,17.935053,10.118.254.218,10.239.227.202,MDNS,392,"Standard query response 0x0000 TXT, cache flush PTR _remotepairing._tcp.local PTR 2E1B7ED5-4B5A-4975-AD38-CE8A43E5A4B4._remotepairing._tcp.local SRV, cache flush 0 0 49152 Tomass-iPhone-mini.local AAAA, cache flush fe80::82:cf4f:ec88:ffec A, cache flush 169.254.135.112 NSEC, cache flush Tomass-iPhone-mini.local NSEC, cache flush 2E1B7ED5-4B5A-4975-AD38-CE8A43E5A4B4._remotepairing._tcp.local"
290,18.045638,10.118.254.218,10.239.227.202,MDNS,130,Standard query response 0x0000 PTR 453E895B-2BE2-49B0-9235-586E0C55297C._remotepairing._tcp.local
312,20.392093,10.114.71.182,10.133.37.223,DHCP,342,DHCP Discover - Transaction ID 0xc64cf8f8
331,21.614306,10.114.71.182,10.133.37.223,DHCP,342,DHCP Discover - Transaction ID 0xc64cf8f8
332,21.681707,10.4.150.209,10.171.113.129,TLSv1.2,95,Application Data
333,21.68171,10.4.150.209,10.171.113.129,TLSv1.2,80,Application Data
335,21.682487,10.171.113.129,10.4.150.209,TCP,56,64798  >  443 [ACK] Seq=1 Ack=65 Win=2047 Len=0 TSval=1411776788 TSecr=3139218059
337,21.682976,10.171.113.129,10.4.150.209,TLSv1.2,95,Application Data
338,21.683796,10.171.113.129,10.4.150.209,TLSv1.2,80,Application Data
339,21.684645,10.171.113.129,10.4.150.209,TCP,56,"64798  >  443 [FIN, ACK] Seq=64 Ack=65 Win=2048 Len=0 TSval=1411776789 TSecr=3139218059"
346,21.728614,10.4.150.209,10.171.113.129,TCP,68,443  >  64798 [ACK] Seq=65 Ack=40 Win=63 Len=0 TSval=3139219473 TSecr=1411776788 SLE=64 SRE=65
347,21.728616,10.4.150.209,10.171.113.129,TCP,68,443  >  64798 [ACK] Seq=65 Ack=65 Win=63 Len=0 TSval=3139219473 TSecr=1411776789 SLE=64 SRE=65
349,21.936322,10.118.254.218,10.239.227.202,MDNS,392,"Standard query response 0x0000 TXT, cache flush PTR _remotepairing._tcp.local PTR 2E1B7ED5-4B5A-4975-AD38-CE8A43E5A4B4._remotepairing._tcp.local SRV, cache flush 0 0 49152 Tomass-iPhone-mini.local AAAA, cache flush fe80::82:cf4f:ec88:ffec A, cache flush 169.254.135.112 NSEC, cache flush Tomass-iPhone-mini.local NSEC, cache flush 2E1B7ED5-4B5A-4975-AD38-CE8A43E5A4B4._remotepairing._tcp.local"
353,22.264305,10.114.71.182,10.133.37.223,DHCP,342,DHCP Discover - Transaction ID 0x7f5a8bd3
372,23.713216,10.171.113.129,10.186.16.231,DNS,71,Standard query 0xa26f HTTPS p119-quota.icloud.com
373,23.713583,10.171.113.129,10.186.16.231,DNS,71,Standard query 0xbda5 A p119-quota.icloud.com
374,23.731018,10.114.71.182,10.133.37.223,DHCP,342,DHCP Discover - Transaction ID 0xc64cf8f8
375,23.751804,10.186.16.231,10.171.113.129,DNS,190,Standard query response 0xa26f HTTPS p119-quota.icloud.com CNAME quota.fe2.apple-dns.net SOA ns-1396.awsdns-46.org
376,23.753124,10.171.113.129,10.186.16.231,DNS,73,Standard query 0xc1e4 HTTPS quota.fe2.apple-dns.net
377,23.763804,10.186.16.231,10.171.113.129,DNS,156,Standard query response 0xbda5 A p119-quota.icloud.com CNAME quota.fe2.apple-dns.net A 17.248.202.66 A 17.248.202.65 A 17.248.202.64
378,23.779737,10.186.16.231,10.171.113.129,DNS,158,Standard query response 0xc1e4 HTTPS quota.fe2.apple-dns.net SOA ns-1396.awsdns-46.org
379,23.785722,10.171.113.129,10.165.240.65,TCP,68,64819  >  443 [SYN] Seq=0 Win=65535 Len=0 MSS=1410 WS=64 TSval=3788456773 TSecr=0 SACK_PERM
380,23.816477,10.165.240.65,10.171.113.129,TCP,64,"443  >  64819 [SYN, ACK] Seq=0 Ack=1 Win=31856 Len=0 MSS=1400 SACK_PERM TSval=188940957 TSecr=3788456773 WS=512"
381,23.817814,10.171.113.129,10.165.240.65,TCP,56,64819  >  443 [ACK] Seq=1 Ack=1 Win=131840 Len=0 TSval=3788456804 TSecr=188940957
382,23.817817,10.171.113.129,10.165.240.65,TLSv1.2,573,Client Hello (SNI=p119-quota.icloud.com)
383,23.857521,10.165.240.65,10.171.113.129,TCP,56,443  >  64819 [ACK] Seq=1 Ack=518 Win=32256 Len=0 TSval=188940998 TSecr=3788456805
384,23.857523,10.165.240.65,10.171.113.129,TLSv1.2,1444,Server Hello
385,23.857797,10.171.113.129,10.165.240.65,TCP,56,64819  >  443 [ACK] Seq=518 Ack=1389 Win=130432 Len=0 TSval=3788456845 TSecr=188940999
386,23.858622,10.165.240.65,10.171.113.129,TCP,1444,"443  >  64819 [PSH, ACK] Seq=1389 Ack=518 Win=32256 Len=1388 TSval=188940999 TSecr=3788456805 [TCP PDU reassembled in 389]"
387,23.858624,10.165.240.65,10.171.113.129,TCP,1376,"443  >  64819 [PSH, ACK] Seq=2777 Ack=518 Win=32256 Len=1320 TSval=188940999 TSecr=3788456805 [TCP PDU reassembled in 389]"
388,23.858802,10.171.113.129,10.165.240.65,TCP,56,64819  >  443 [ACK] Seq=518 Ack=4097 Win=128320 Len=0 TSval=3788456846 TSecr=188940999
389,23.860543,10.165.240.65,10.171.113.129,TLSv1.2,1444,Certificate
390,23.860545,10.165.240.65,10.171.113.129,TLSv1.2,1080,"Certificate Status, Server Key Exchange, Server Hello Done"
391,23.861421,10.171.113.129,10.165.240.65,TCP,56,64819  >  443 [ACK] Seq=518 Ack=6509 Win=128640 Len=0 TSval=3788456848 TSecr=188940999
392,23.895813,10.171.113.129,10.186.16.231,DNS,67,Standard query 0xdf2c HTTPS ocsp.digicert.com
393,23.896167,10.171.113.129,10.186.16.231,DNS,67,Standard query 0x972c A ocsp.digicert.com
394,23.915594,10.186.16.231,10.171.113.129,DNS,188,Standard query response 0x972c A ocsp.digicert.com CNAME ocsp.edge.digicert.com CNAME cac-ocsp.digicert.com.edgekey.net CNAME e3913.cd.akamaiedge.net A 23.58.191.18
395,23.915602,10.186.16.231,10.171.113.129,DNS,231,Standard query response 0xdf2c HTTPS ocsp.digicert.com CNAME ocsp.edge.digicert.com CNAME cac-ocsp.digicert.com.edgekey.net CNAME e3913.cd.akamaiedge.net SOA n0cd.akamaiedge.net
396,23.916833,10.171.113.129,10.186.16.231,DNS,73,Standard query 0xce65 HTTPS e3913.cd.akamaiedge.net
397,23.947537,10.186.16.231,10.171.113.129,DNS,135,Standard query response 0xce65 HTTPS e3913.cd.akamaiedge.net SOA n0cd.akamaiedge.net
398,23.953492,10.171.113.129,10.140.136.15,TCP,68,64820  >  80 [SYN] Seq=0 Win=65535 Len=0 MSS=1410 WS=64 TSval=3001639892 TSecr=0 SACK_PERM
399,23.987524,10.140.136.15,10.171.113.129,TCP,64,"80  >  64820 [SYN, ACK] Seq=0 Ack=1 Win=65160 Len=0 MSS=1400 SACK_PERM TSval=2500325779 TSecr=3001639892 WS=128"
400,23.988049,10.171.113.129,10.140.136.15,TCP,56,64820  >  80 [ACK] Seq=1 Ack=1 Win=131840 Len=0 TSval=3001639926 TSecr=2500325779
401,23.988596,10.171.113.129,10.140.136.15,HTTP,417,GET /ME8wTTBLMEkwRzAHBgUrDgMCGgQUwS9Fdu0VWeywXbqJv52AeOUj1BMEFOWdWTCCR1jMrPoIVDaGezq1BE3wAhAFUsfv%2FuwpK6nxOHsHr5Kf HTTP/1.1 
402,24.011558,10.140.136.15,10.171.113.129,TCP,56,80  >  64820 [ACK] Seq=1 Ack=362 Win=64896 Len=0 TSval=2500325803 TSecr=3001639926
403,24.011559,10.140.136.15,10.171.113.129,TCP,1444,80  >  64820 [ACK] Seq=1 Ack=362 Win=64896 Len=1388 TSval=2500325804 TSecr=3001639926 [TCP PDU reassembled in 404]
404,24.011562,10.140.136.15,10.171.113.129,OCSP,578,Response
405,24.011815,10.171.113.129,10.140.136.15,TCP,56,64820  >  80 [ACK] Seq=362 Ack=1911 Win=129920 Len=0 TSval=3001639950 TSecr=2500325804
406,24.020896,10.171.113.129,10.165.240.65,TLSv1.2,149,"Client Key Exchange, Change Cipher Spec, Encrypted Handshake Message"
409,24.057447,10.165.240.65,10.171.113.129,TLSv1.2,107,"Change Cipher Spec, Encrypted Handshake Message"
410,24.058876,10.171.113.129,10.165.240.65,TCP,56,64819  >  443 [ACK] Seq=611 Ack=6560 Win=131008 Len=0 TSval=3788457045 TSecr=188941198
411,24.059931,10.171.113.129,10.165.240.65,TLSv1.2,1154,Application Data
412,24.158303,10.165.240.65,10.171.113.129,TCP,56,443  >  64819 [ACK] Seq=6560 Ack=1709 Win=32256 Len=0 TSval=188941283 TSecr=3788457047
413,24.200021,10.114.71.182,10.133.37.223,DHCP,342,DHCP Discover - Transaction ID 0x7f5a8bd3
414,24.241533,10.165.240.65,10.171.113.129,TCP,1444,443  >  64819 [ACK] Seq=6560 Ack=1709 Win=32256 Len=1388 TSval=188941382 TSecr=3788457047 [TCP PDU reassembled in 417]
415,24.241767,10.171.113.129,10.165.240.65,TCP,56,64819  >  443 [ACK] Seq=1709 Ack=7948 Win=129664 Len=0 TSval=3788457229 TSecr=188941382
416,24.242585,10.165.240.65,10.171.113.129,TCP,1444,"443  >  64819 [PSH, ACK] Seq=7948 Ack=1709 Win=32256 Len=1388 TSval=188941382 TSecr=3788457047 [TCP PDU reassembled in 417]"
417,24.242587,10.165.240.65,10.171.113.129,TLSv1.2,917,Application Data
418,24.242916,10.171.113.129,10.165.240.65,TCP,56,64819  >  443 [ACK] Seq=1709 Ack=10197 Win=128768 Len=0 TSval=3788457230 TSecr=188941382
431,25.133747,10.171.113.129,10.148.208.69,TCP,68,64821  >  443 [SYN] Seq=0 Win=65535 Len=0 MSS=1410 WS=64 TSval=3645911151 TSecr=0 SACK_PERM
432,25.194653,10.148.208.69,10.171.113.129,TCP,64,"443  >  64821 [SYN, ACK] Seq=0 Ack=1 Win=31856 Len=0 MSS=1400 SACK_PERM TSval=3687767862 TSecr=3645911151 WS=512"
433,25.195762,10.171.113.129,10.148.208.69,TCP,56,64821  >  443 [ACK] Seq=1 Ack=1 Win=131840 Len=0 TSval=3645911212 TSecr=3687767862
434,25.195765,10.171.113.129,10.148.208.69,TLSv1.3,573,Client Hello (SNI=gateway.icloud.com)
435,25.239747,10.148.208.69,10.171.113.129,TCP,56,443  >  64821 [ACK] Seq=1 Ack=518 Win=32256 Len=0 TSval=3687767908 TSecr=3645911212
436,25.23975,10.148.208.69,10.171.113.129,TLSv1.3,1444,"Server Hello, Change Cipher Spec, Application Data"
437,25.239752,10.148.208.69,10.171.113.129,TCP,1444,"443  >  64821 [PSH, ACK] Seq=1389 Ack=518 Win=32256 Len=1388 TSval=3687767908 TSecr=3645911212 [TCP PDU reassembled in 438]"
438,25.2406,10.148.208.69,10.171.113.129,TLSv1.3,850,"Application Data, Application Data, Application Data"
439,25.240698,10.171.113.129,10.148.208.69,TCP,56,64821  >  443 [ACK] Seq=518 Ack=2777 Win=129024 Len=0 TSval=3645911257 TSecr=3687767908
440,25.241588,10.171.113.129,10.148.208.69,TCP,56,64821  >  443 [ACK] Seq=518 Ack=3571 Win=130240 Len=0 TSval=3645911257 TSecr=3687767908
441,25.260487,10.171.113.129,10.148.208.69,TLSv1.3,120,"Change Cipher Spec, Application Data"
442,25.272626,10.171.113.129,10.148.208.69,TLSv1.3,1295,Application Data
443,25.273265,10.171.113.129,10.148.208.69,TLSv1.3,597,Application Data
444,25.306611,10.148.208.69,10.171.113.129,TLSv1.3,343,Application Data
445,25.306614,10.148.208.69,10.171.113.129,TLSv1.3,343,Application Data
446,25.306615,10.148.208.69,10.171.113.129,TLSv1.3,118,Application Data
447,25.307068,10.171.113.129,10.148.208.69,TCP,56,64821  >  443 [ACK] Seq=2362 Ack=4207 Win=130432 Len=0 TSval=3645911324 TSecr=3687767975
448,25.307251,10.171.113.129,10.148.208.69,TLSv1.3,87,Application Data
449,25.320558,10.148.208.69,10.171.113.129,TCP,56,443  >  64821 [ACK] Seq=4207 Ack=2362 Win=32256 Len=0 TSval=3687767989 TSecr=3645911290
450,25.32056,10.148.208.69,10.171.113.129,TLSv1.3,87,Application Data
451,25.320764,10.171.113.129,10.148.208.69,TCP,56,64821  >  443 [ACK] Seq=2393 Ack=4238 Win=131008 Len=0 TSval=3645911338 TSecr=3687767989
452,25.391449,10.148.208.69,10.171.113.129,TCP,56,443  >  64821 [ACK] Seq=4238 Ack=2393 Win=32256 Len=0 TSval=3687768055 TSecr=3645911324
453,25.550572,10.148.208.69,10.171.113.129,TLSv1.3,657,Application Data
454,25.550575,10.148.208.69,10.171.113.129,TLSv1.3,87,Application Data
455,25.550865,10.171.113.129,10.148.208.69,TCP,56,64821  >  443 [ACK] Seq=2393 Ack=4870 Win=130432 Len=0 TSval=3645911568 TSecr=3687768219
464,25.644437,10.171.113.129,10.148.208.69,TLSv1.3,174,Application Data
465,25.644926,10.171.113.129,10.148.208.69,TLSv1.3,575,Application Data
466,25.68155,10.148.208.69,10.171.113.129,TCP,56,443  >  64821 [ACK] Seq=4870 Ack=2511 Win=32256 Len=0 TSval=3687768351 TSecr=3645911662
467,25.689527,10.148.208.69,10.171.113.129,TCP,56,443  >  64821 [ACK] Seq=4870 Ack=3030 Win=32256 Len=0 TSval=3687768358 TSecr=3645911662
468,25.737591,10.148.208.69,10.171.113.129,TCP,1444,443  >  64821 [ACK] Seq=4870 Ack=3030 Win=32256 Len=1388 TSval=3687768405 TSecr=3645911662 [TCP PDU reassembled in 470]
469,25.73795,10.171.113.129,10.148.208.69,TCP,56,64821  >  443 [ACK] Seq=3030 Ack=6258 Win=129664 Len=0 TSval=3645911755 TSecr=3687768405
470,25.738565,10.148.208.69,10.171.113.129,TLSv1.3,77,Application Data
471,25.738771,10.171.113.129,10.148.208.69,TCP,56,64821  >  443 [ACK] Seq=3030 Ack=6279 Win=131008 Len=0 TSval=3645911755 TSecr=3687768405
472,25.910789,10.171.113.129,10.148.208.69,TLSv1.3,207,Application Data
473,25.911129,10.171.113.129,10.148.208.69,TLSv1.3,789,Application Data
474,25.978658,10.148.208.69,10.171.113.129,TCP,56,443  >  64821 [ACK] Seq=6279 Ack=3181 Win=32256 Len=0 TSval=3687768639 TSecr=3645911928
475,25.97866,10.148.208.69,10.171.113.129,TCP,56,443  >  64821 [ACK] Seq=6279 Ack=3914 Win=32256 Len=0 TSval=3687768639 TSecr=3645911928
476,26.001519,10.148.208.69,10.171.113.129,TCP,1444,443  >  64821 [ACK] Seq=6279 Ack=3914 Win=32256 Len=1388 TSval=3687768670 TSecr=3645911928 [TCP PDU reassembled in 477]
477,26.001522,10.148.208.69,10.171.113.129,TLSv1.3,306,Application Data
478,26.001523,10.148.208.69,10.171.113.129,TLSv1.3,87,Application Data
479,26.001849,10.171.113.129,10.148.208.69,TCP,56,64821  >  443 [ACK] Seq=3914 Ack=7948 Win=129344 Len=0 TSval=3645912019 TSecr=3687768670
480,26.009685,10.171.113.129,10.140.136.15,TCP,56,"64820  >  80 [FIN, ACK] Seq=362 Ack=1911 Win=131072 Len=0 TSval=3001641948 TSecr=2500325804"
481,26.038429,10.140.136.15,10.171.113.129,TCP,56,"80  >  64820 [FIN, ACK] Seq=1911 Ack=363 Win=64896 Len=0 TSval=2500327831 TSecr=3001641948"
482,26.038785,10.171.113.129,10.140.136.15,TCP,56,64820  >  80 [ACK] Seq=363 Ack=1912 Win=131072 Len=0 TSval=3001641977 TSecr=2500327831
485,26.056133,10.171.113.129,10.148.208.69,TLSv1.3,190,Application Data
486,26.056898,10.171.113.129,10.148.208.69,TLSv1.3,849,Application Data
487,26.098457,10.148.208.69,10.171.113.129,TCP,56,443  >  64821 [ACK] Seq=7948 Ack=4841 Win=32256 Len=0 TSval=3687768759 TSecr=3645912074
488,26.159487,10.148.208.69,10.171.113.129,TCP,1444,443  >  64821 [ACK] Seq=7948 Ack=4841 Win=32256 Len=1388 TSval=3687768828 TSecr=3645912074 [TCP PDU reassembled in 502]
489,26.159767,10.171.113.129,10.148.208.69,TCP,56,64821  >  443 [ACK] Seq=4841 Ack=9336 Win=129664 Len=0 TSval=3645912177 TSecr=3687768828
490,26.166916,10.148.208.69,10.171.113.129,TCP,1444,"443  >  64821 [PSH, ACK] Seq=9336 Ack=4841 Win=32256 Len=1388 TSval=3687768828 TSecr=3645912074 [TCP PDU reassembled in 502]"
491,26.166919,10.148.208.69,10.171.113.129,TCP,1444,443  >  64821 [ACK] Seq=10724 Ack=4841 Win=32256 Len=1388 TSval=3687768829 TSecr=3645912074 [TCP PDU reassembled in 502]
492,26.16692,10.148.208.69,10.171.113.129,TCP,1444,"443  >  64821 [PSH, ACK] Seq=12112 Ack=4841 Win=32256 Len=1388 TSval=3687768829 TSecr=3645912074 [TCP PDU reassembled in 502]"
493,26.166922,10.148.208.69,10.171.113.129,TCP,1444,443  >  64821 [ACK] Seq=13500 Ack=4841 Win=32256 Len=1388 TSval=3687768831 TSecr=3645912074 [TCP PDU reassembled in 502]
494,26.166924,10.148.208.69,10.171.113.129,TCP,1444,"443  >  64821 [PSH, ACK] Seq=14888 Ack=4841 Win=32256 Len=1388 TSval=3687768831 TSecr=3645912074 [TCP PDU reassembled in 502]"
495,26.166926,10.148.208.69,10.171.113.129,TCP,1444,443  >  64821 [ACK] Seq=16276 Ack=4841 Win=32256 Len=1388 TSval=3687768833 TSecr=3645912074 [TCP PDU reassembled in 502]
496,26.167378,10.171.113.129,10.148.208.69,TCP,56,64821  >  443 [ACK] Seq=4841 Ack=17664 Win=122688 Len=0 TSval=3645912185 TSecr=3687768833
498,26.170614,10.148.208.69,10.171.113.129,TCP,1444,"443  >  64821 [PSH, ACK] Seq=17664 Ack=4841 Win=32256 Len=1388 TSval=3687768833 TSecr=3645912074 [TCP PDU reassembled in 502]"
499,26.170616,10.148.208.69,10.171.113.129,TCP,1444,443  >  64821 [ACK] Seq=19052 Ack=4841 Win=32256 Len=1388 TSval=3687768835 TSecr=3645912074 [TCP PDU reassembled in 502]
500,26.170618,10.148.208.69,10.171.113.129,TCP,1444,"443  >  64821 [PSH, ACK] Seq=20440 Ack=4841 Win=32256 Len=1388 TSval=3687768835 TSecr=3645912074 [TCP PDU reassembled in 502]"
501,26.17062,10.148.208.69,10.171.113.129,TCP,1444,443  >  64821 [ACK] Seq=21828 Ack=4841 Win=32256 Len=1388 TSval=3687768837 TSecr=3645912074 [TCP PDU reassembled in 502]
502,26.170621,10.148.208.69,10.171.113.129,TLSv1.3,1444,Application Data
503,26.170622,10.148.208.69,10.171.113.129,TCP,1444,443  >  64821 [ACK] Seq=24604 Ack=4841 Win=32256 Len=1388 TSval=3687768839 TSecr=3645912074 [TCP PDU reassembled in 521]
504,26.171111,10.171.113.129,10.148.208.69,TCP,56,64821  >  443 [ACK] Seq=4841 Ack=25992 Win=122688 Len=0 TSval=3645912189 TSecr=3687768839
506,26.176634,10.148.208.69,10.171.113.129,TCP,1444,"443  >  64821 [PSH, ACK] Seq=25992 Ack=4841 Win=32256 Len=1388 TSval=3687768839 TSecr=3645912074 [TCP PDU reassembled in 521]"
507,26.176637,10.148.208.69,10.171.113.129,TCP,1444,443  >  64821 [ACK] Seq=27380 Ack=4841 Win=32256 Len=1388 TSval=3687768841 TSecr=3645912074 [TCP PDU reassembled in 521]
508,26.176638,10.148.208.69,10.171.113.129,TCP,1444,"443  >  64821 [PSH, ACK] Seq=28768 Ack=4841 Win=32256 Len=1388 TSval=3687768841 TSecr=3645912074 [TCP PDU reassembled in 521]"
509,26.17664,10.148.208.69,10.171.113.129,TCP,1444,443  >  64821 [ACK] Seq=30156 Ack=4841 Win=32256 Len=1388 TSval=3687768843 TSecr=3645912074 [TCP PDU reassembled in 521]
510,26.176989,10.171.113.129,10.148.208.69,TCP,56,64821  >  443 [ACK] Seq=4841 Ack=31544 Win=125504 Len=0 TSval=3645912194 TSecr=3687768843
512,26.196799,10.148.208.69,10.171.113.129,TCP,1444,443  >  64821 [ACK] Seq=31544 Ack=4841 Win=32256 Len=1388 TSval=3687768865 TSecr=3645912177 [TCP PDU reassembled in 521]
513,26.197159,10.171.113.129,10.148.208.69,TCP,56,64821  >  443 [ACK] Seq=4841 Ack=32932 Win=129664 Len=0 TSval=3645912215 TSecr=3687768865
514,26.202632,10.148.208.69,10.171.113.129,TCP,1444,443  >  64821 [ACK] Seq=32932 Ack=4841 Win=32256 Len=1388 TSval=3687768870 TSecr=3645912185 [TCP PDU reassembled in 521]
515,26.202635,10.148.208.69,10.171.113.129,TCP,1444,"443  >  64821 [PSH, ACK] Seq=34320 Ack=4841 Win=32256 Len=1388 TSval=3687768870 TSecr=3645912185 [TCP PDU reassembled in 521]"
516,26.202865,10.171.113.129,10.148.208.69,TCP,56,64821  >  443 [ACK] Seq=4841 Ack=35708 Win=128256 Len=0 TSval=3645912220 TSecr=3687768870
518,26.208665,10.148.208.69,10.171.113.129,TCP,1444,443  >  64821 [ACK] Seq=35708 Ack=4841 Win=32256 Len=1388 TSval=3687768871 TSecr=3645912189 [TCP PDU reassembled in 521]
519,26.208668,10.148.208.69,10.171.113.129,TCP,1444,"443  >  64821 [PSH, ACK] Seq=37096 Ack=4841 Win=32256 Len=1388 TSval=3687768871 TSecr=3645912189 [TCP PDU reassembled in 521]"
520,26.208669,10.148.208.69,10.171.113.129,TCP,1444,443  >  64821 [ACK] Seq=38484 Ack=4841 Win=32256 Len=1388 TSval=3687768873 TSecr=3645912194 [TCP PDU reassembled in 521]
521,26.208671,10.148.208.69,10.171.113.129,TLSv1.3,1444,Application Data
522,26.208673,10.148.208.69,10.171.113.129,TCP,1444,443  >  64821 [ACK] Seq=41260 Ack=4841 Win=32256 Len=1388 TSval=3687768875 TSecr=3645912194 [TCP PDU reassembled in 529]
523,26.208675,10.148.208.69,10.171.113.129,TCP,1444,"443  >  64821 [PSH, ACK] Seq=42648 Ack=4841 Win=32256 Len=1388 TSval=3687768875 TSecr=3645912194 [TCP PDU reassembled in 529]"
524,26.208676,10.148.208.69,10.171.113.129,TCP,1444,443  >  64821 [ACK] Seq=44036 Ack=4841 Win=32256 Len=1388 TSval=3687768877 TSecr=3645912194 [TCP PDU reassembled in 529]
525,26.208678,10.148.208.69,10.171.113.129,TCP,1444,"443  >  64821 [PSH, ACK] Seq=45424 Ack=4841 Win=32256 Len=1388 TSval=3687768877 TSecr=3645912194 [TCP PDU reassembled in 529]"
526,26.209097,10.171.113.129,10.148.208.69,TCP,56,64821  >  443 [ACK] Seq=4841 Ack=46812 Win=119936 Len=0 TSval=3645912227 TSecr=3687768877
528,26.214654,10.148.208.69,10.171.113.129,TCP,1444,443  >  64821 [ACK] Seq=46812 Ack=4841 Win=32256 Len=1388 TSval=3687768878 TSecr=3645912194 [TCP PDU reassembled in 529]
529,26.214657,10.148.208.69,10.171.113.129,TLSv1.3,363,"Application Data, Application Data"
530,26.214995,10.171.113.129,10.148.208.69,TCP,56,64821  >  443 [ACK] Seq=4841 Ack=48507 Win=129344 Len=0 TSval=3645912232 TSecr=3687768878
531,26.226821,10.171.113.129,10.165.240.65,TLSv1.2,87,Encrypted Alert
532,26.227573,10.171.113.129,10.165.240.65,TCP,56,"64819  >  443 [FIN, ACK] Seq=1740 Ack=10197 Win=131072 Len=0 TSval=3788459214 TSecr=188941382"
535,26.264574,10.165.240.65,10.171.113.129,TCP,56,443  >  64819 [ACK] Seq=10197 Ack=1741 Win=32256 Len=0 TSval=188943405 TSecr=3788459214
536,26.264576,10.165.240.65,10.171.113.129,TCP,56,"443  >  64819 [FIN, ACK] Seq=10197 Ack=1741 Win=32256 Len=0 TSval=188943405 TSecr=3788459214"
537,26.265048,10.171.113.129,10.165.240.65,TCP,56,64819  >  443 [ACK] Seq=1741 Ack=10198 Win=131072 Len=0 TSval=3788459252 TSecr=188943405
548,27.083386,10.114.71.182,10.133.37.223,DHCP,342,DHCP Discover - Transaction ID 0x7f5a8bd3
559,28.231251,10.114.71.182,10.133.37.223,DHCP,342,DHCP Discover - Transaction ID 0xc64cf8f8
729,29.644941,10.118.254.218,10.239.227.202,MDNS,143,"Standard query 0x0000 PTR _companion-link._tcp.local, ""QM"" question PTR _rdlink._tcp.local, ""QM"" question PTR Hinddeep‚\200\231s MacBook Air (2)._companion-link._tcp.local"
743,31.586429,10.114.71.182,10.133.37.223,DHCP,342,DHCP Discover - Transaction ID 0x7f5a8bd3
765,32.861681,10.29.189.1,10.239.227.202,MDNS,646,"Standard query 0x0000 PTR lb._dns-sd._udp.local, ""QM"" question PTR _airport._tcp.local, ""QM"" question PTR _adisk._tcp.local, ""QM"" question PTR _hap._tcp.local, ""QM"" question PTR _hap._udp.local, ""QM"" question PTR _uscan._tcp.local, ""QM"" question PTR _pdl-datastream._tcp.local, ""QM"" question PTR _ippusb._tcp.local, ""QM"" question PTR _ipp._tcp.local, ""QM"" question PTR _ptp._tcp.local, ""QM"" question PTR _scanner._tcp.local, ""QM"" question PTR _uscans._tcp.local, ""QM"" question PTR _printer._tcp.local, ""QM"" question PTR _ipps._tcp.local, ""QM"" question PTR _remotepairing-manual-pairing._tcp.local, ""QM"" question PTR _remotepairing._tcp.local, ""QM"" question PTR _00000003-c00d-4bb6-cea8-16f18cfc42cc._sub._appletv-v2._tcp.local, ""QM"" question PTR _afpovertcp._tcp.local, ""QM"" question PTR _smb._tcp.local, ""QM"" question PTR _rfb._tcp.local, ""QM"" question PTR _adisk._tcp.local, ""QM"" question PTR _apple-mobdev._tcp.local, ""QM"" question PTR 951807ff._sub._apple-mobdev2._tcp.local, ""QM"" question PTR _apple-pairable._tcp.local, ""QM"" question PTR _apple-mobdev2._tcp.local, ""QM"" question PTR 2E1B7ED5-4B5A-4975-AD38-CE8A43E5A4B4._remotepairing._tcp.local PTR 08:87:c7:37:56:67@fe80::a87:c7ff:fe37:5667-supportsRP-22._apple-mobdev2._tcp.local PTR 08:87:c7:37:56:67@fe80::a87:c7ff:fe37:5667-supportsRP-22._apple-mobdev2._tcp.local"
799,36.470888,10.114.71.182,10.133.37.223,DHCP,342,DHCP Discover - Transaction ID 0xc64cf8f8
838,40.020938,10.114.71.182,10.133.37.223,DHCP,342,DHCP Discover - Transaction ID 0x7f5a8bd3
881,44.614325,10.114.71.182,10.133.37.223,DHCP,342,DHCP Discover - Transaction ID 0xc64cf8f8
934,48.605172,10.114.71.182,10.133.37.223,DHCP,342,DHCP Discover - Transaction ID 0x7f5a8bd3
977,52.656631,10.114.71.182,10.133.37.223,DHCP,342,DHCP Discover - Transaction ID 0xc64cf8f8
1026,56.941986,10.114.71.182,10.133.37.223,DHCP,342,DHCP Discover - Transaction ID 0x7f5a8bd3
1029,57.484692,10.148.208.69,10.171.113.129,TLSv1.3,95,Application Data
1030,57.484694,10.148.208.69,10.171.113.129,TLSv1.3,80,Application Data
1031,57.484695,10.148.208.69,10.171.113.129,TCP,56,"443  >  64821 [FIN, ACK] Seq=48570 Ack=4841 Win=32256 Len=0 TSval=3687798828 TSecr=3645912232"
1032,57.485537,10.171.113.129,10.148.208.69,TCP,56,64821  >  443 [ACK] Seq=4841 Ack=48571 Win=131008 Len=0 TSval=3645943503 TSecr=3687798828
1033,57.485774,10.171.113.129,10.148.208.69,TLSv1.3,95,Application Data
1034,57.486115,10.171.113.129,10.148.208.69,TLSv1.3,80,Application Data
1035,57.486419,10.171.113.129,10.148.208.69,TCP,56,"64821  >  443 [FIN, ACK] Seq=4904 Ack=48571 Win=131072 Len=0 TSval=3645943504 TSecr=3687798828"
1043,57.524389,10.148.208.69,10.171.113.129,TCP,68,443  >  64821 [ACK] Seq=48571 Ack=4880 Win=32256 Len=0 TSval=3687800194 TSecr=3645943503 SLE=4904 SRE=4905
1044,57.524389,10.148.208.69,10.171.113.129,TCP,68,"443  >  64821 [RST, ACK] Seq=48571 Ack=4880 Win=32256 Len=0 TSval=3687800194 TSecr=3645943503 SLE=4904 SRE=4905"
1046,57.530198,10.148.208.69,10.171.113.129,TCP,44,443  >  64821 [RST] Seq=48571 Win=0 Len=0
1087,60.965477,10.114.71.182,10.133.37.223,DHCP,342,DHCP Discover - Transaction ID 0xc64cf8f8
1276,65.563875,10.114.71.182,10.133.37.223,DHCP,342,DHCP Discover - Transaction ID 0x7f5a8bd3
1319,69.714161,10.114.71.182,10.133.37.223,DHCP,342,DHCP Discover - Transaction ID 0xc64cf8f8
1366,74.120929,10.114.71.182,10.133.37.223,DHCP,342,DHCP Discover - Transaction ID 0x7f5a8bd3
1421,78.481084,10.114.71.182,10.133.37.223,DHCP,342,DHCP Discover - Transaction ID 0xc64cf8f8
1472,83.065504,10.114.71.182,10.133.37.223,DHCP,342,DHCP Discover - Transaction ID 0x7f5a8bd3
1473,83.14447,10.171.113.129,10.186.16.231,DNS,64,Standard query 0x1b9e A www.google.com
1474,83.144953,10.171.113.129,10.186.16.231,DNS,59,Standard query 0xf705 A apple.com
1477,83.259082,10.171.113.129,10.186.16.231,DNS,64,Standard query 0x77df A g.whatsapp.net
1478,83.430534,10.186.16.231,10.171.113.129,DNS,80,Standard query response 0x1b9e A www.google.com A 142.250.69.132
1479,83.440858,10.186.16.231,10.171.113.129,DNS,75,Standard query response 0xf705 A apple.com A 17.253.144.10
1498,85.030554,10.171.113.129,10.254.210.56,DNS,64,Standard query 0xe6c9 A g.whatsapp.net
1499,85.086687,10.254.210.56,10.171.113.129,DNS,103,Standard query response 0xe6c9 A g.whatsapp.net CNAME chat.cdn.whatsapp.net A 31.13.80.48
1500,85.100514,10.171.113.129,10.37.18.151,TCP,68,51172  >  443 [SYN] Seq=0 Win=65535 Len=0 MSS=1410 WS=64 TSval=3940591879 TSecr=0 SACK_PERM
1501,85.12451,10.37.18.151,10.171.113.129,TCP,64,"443  >  51172 [SYN, ACK] Seq=0 Ack=1 Win=65535 Len=0 MSS=1392 SACK_PERM TSval=1943368589 TSecr=3940591879 WS=256"
1502,85.124775,10.171.113.129,10.37.18.151,TCP,56,51172  >  443 [ACK] Seq=1 Ack=1 Win=131072 Len=0 TSval=3940591903 TSecr=1943368589
1503,85.127383,10.171.113.129,10.37.18.151,TCP,60,"51172  >  443 [PSH, ACK] Seq=1 Ack=1 Win=131072 Len=4 TSval=3940591906 TSecr=1943368589 [TCP PDU reassembled in 1504]"
1504,85.127645,10.171.113.129,10.37.18.151,SSL,63,Continuation Data
1505,85.127825,10.171.113.129,10.37.18.151,TCP,60,"51172  >  443 [PSH, ACK] Seq=12 Ack=1 Win=131072 Len=4 TSval=3940591906 TSecr=1943368589 [TCP PDU reassembled in 1506]"
1506,85.131727,10.171.113.129,10.37.18.151,SSL,345,Continuation Data
1507,85.153433,10.37.18.151,10.171.113.129,TCP,56,443  >  51172 [ACK] Seq=1 Ack=5 Win=65536 Len=0 TSval=1943368618 TSecr=3940591906
1508,85.159447,10.37.18.151,10.171.113.129,TCP,56,443  >  51172 [ACK] Seq=1 Ack=12 Win=65536 Len=0 TSval=1943368624 TSecr=3940591906
1509,85.159449,10.37.18.151,10.171.113.129,TCP,56,443  >  51172 [ACK] Seq=1 Ack=16 Win=65536 Len=0 TSval=1943368624 TSecr=3940591906
1510,85.159449,10.37.18.151,10.171.113.129,TCP,56,443  >  51172 [ACK] Seq=1 Ack=305 Win=66816 Len=0 TSval=1943368625 TSecr=3940591910
1511,85.180456,10.37.18.151,10.171.113.129,SSL,113,Continuation Data
1512,85.180457,10.37.18.151,10.171.113.129,SSL,148,Continuation Data
1513,85.1806,10.171.113.129,10.37.18.151,TCP,56,51172  >  443 [ACK] Seq=305 Ack=150 Win=130944 Len=0 TSval=3940591959 TSecr=1943368645
1518,85.20461,10.171.113.129,10.37.18.151,SSL,111,Continuation Data
1519,85.207154,10.171.113.129,10.37.18.151,SSL,272,Continuation Data
1520,85.207482,10.171.113.129,10.37.18.151,SSL,97,Continuation Data
1521,85.2385,10.37.18.151,10.171.113.129,TCP,56,443  >  51172 [ACK] Seq=150 Ack=617 Win=67840 Len=0 TSval=1943368703 TSecr=3940591983
1522,85.277458,10.171.113.129,10.186.16.231,DNS,64,Standard query 0x77df A g.whatsapp.net
1523,85.292609,10.186.16.231,10.171.113.129,DNS,103,Standard query response 0x77df A g.whatsapp.net CNAME chat.cdn.whatsapp.net A 31.13.80.48
1524,85.34951,10.37.18.151,10.171.113.129,SSL,102,Continuation Data
1525,85.349514,10.37.18.151,10.171.113.129,SSL,266,Continuation Data
1526,85.349751,10.171.113.129,10.37.18.151,TCP,56,51172  >  443 [ACK] Seq=617 Ack=406 Win=130816 Len=0 TSval=3940592128 TSecr=1943368813
1527,85.383846,10.37.18.151,10.171.113.129,SSL,93,Continuation Data
1528,85.384075,10.171.113.129,10.37.18.151,TCP,56,51172  >  443 [ACK] Seq=617 Ack=443 Win=131008 Len=0 TSval=3940592163 TSecr=1943368839
1893,105.423247,10.171.113.129,10.37.18.151,TCP,56,"51172  >  443 [FIN, ACK] Seq=617 Ack=443 Win=131072 Len=0 TSval=3940612202 TSecr=1943379165"
1895,105.70147,10.171.113.129,10.37.18.151,TCP,44,51172  >  443 [ACK] Seq=616 Ack=443 Win=131072 Len=0
1896,105.734397,10.37.18.151,10.171.113.129,TCP,56,"443  >  51172 [FIN, ACK] Seq=443 Ack=618 Win=67840 Len=0 TSval=1943389199 TSecr=3940612202"
1899,105.734585,10.171.113.129,10.37.18.151,TCP,56,51172  >  443 [ACK] Seq=618 Ack=444 Win=131072 Len=0 TSval=3940612513 TSecr=1943389199
1955,110.807854,10.118.254.218,10.239.227.202,MDNS,143,"Standard query 0x0000 PTR _companion-link._tcp.local, ""QM"" question PTR _rdlink._tcp.local, ""QM"" question PTR Hinddeep‚\200\231s MacBook Air (2)._companion-link._tcp.local"
2485,147.268119,10.114.71.182,10.133.37.223,DHCP,342,DHCP Discover - Transaction ID 0xc64cf8f9
2500,148.579165,10.114.71.182,10.133.37.223,DHCP,342,DHCP Discover - Transaction ID 0xc64cf8f9
2523,150.941201,10.114.71.182,10.133.37.223,DHCP,342,DHCP Discover - Transaction ID 0xc64cf8f9
2530,151.260609,10.114.71.182,10.133.37.223,DHCP,342,DHCP Discover - Transaction ID 0x7f5a8bd4
2545,152.933749,10.114.71.182,10.133.37.223,DHCP,342,DHCP Discover - Transaction ID 0x7f5a8bd4
