No.,Time,Source,Destination,Protocol,Length,Info
119,3.583831,10.252.98.176,10.172.68.30,IGMPv2,60,"Membership Query, general"
210,6.091661,10.26.231.137,10.213.236.199,TLSv1.2,117,"Application Data, Application Data"
211,6.091663,10.26.231.137,10.213.236.199,TCP,54,"443  >  50293 [FIN, ACK] Seq=64 Ack=1 Win=48180 Len=0"
212,6.092327,10.213.236.199,10.26.231.137,TCP,54,50293  >  443 [ACK] Seq=1 Ack=64 Win=65535 Len=0
213,6.09233,10.213.236.199,10.26.231.137,TCP,54,50293  >  443 [ACK] Seq=1 Ack=65 Win=65535 Len=0
214,6.092685,10.213.236.199,10.26.231.137,TLSv1.2,93,Application Data
215,6.093314,10.213.236.199,10.26.231.137,TLSv1.2,78,Application Data
216,6.093908,10.213.236.199,10.26.231.137,TCP,54,"50293  >  443 [FIN, ACK] Seq=64 Ack=65 Win=65535 Len=0"
217,6.096722,10.26.231.137,10.213.236.199,TCP,54,443  >  50293 [ACK] Seq=65 Ack=65 Win=48180 Len=0
286,8.094653,10.213.236.199,10.70.89.209,DNS,74,Standard query 0x812f HTTPS gdmf.apple.com
287,8.095226,10.213.236.199,10.70.89.209,DNS,74,Standard query 0x706f A gdmf.apple.com
288,8.100951,10.70.89.209,10.213.236.199,DNS,171,Standard query response 0x812f HTTPS gdmf.apple.com CNAME gdmf.v.aaplimg.com SOA a.gslb.aaplimg.com
289,8.101894,10.70.89.209,10.213.236.199,DNS,122,Standard query response 0x706f A gdmf.apple.com CNAME gdmf.v.aaplimg.com A 17.137.162.3
290,8.103756,10.213.236.199,10.12.202.113,TCP,78,50300  >  443 [SYN] Seq=0 Win=65535 Len=0 MSS=1460 WS=64 TSval=2053606528 TSecr=0 SACK_PERM
291,8.107013,10.12.202.113,10.213.236.199,TCP,58,"443  >  50300 [SYN, ACK] Seq=0 Ack=1 Win=14600 Len=0 MSS=1460"
292,8.107825,10.213.236.199,10.12.202.113,TCP,54,50300  >  443 [ACK] Seq=1 Ack=1 Win=65535 Len=0
293,8.107828,10.213.236.199,10.12.202.113,TLSv1.2,571,Client Hello (SNI=gdmf.apple.com)
294,8.110498,10.12.202.113,10.213.236.199,TCP,54,443  >  50300 [ACK] Seq=1 Ack=518 Win=15544 Len=0
299,8.254637,10.213.236.199,10.12.202.113,TCP,54,50300  >  443 [ACK] Seq=518 Ack=4097 Win=65535 Len=0
303,8.255446,10.213.236.199,10.12.202.113,TCP,54,50300  >  443 [ACK] Seq=518 Ack=6391 Win=65535 Len=0
304,8.270628,10.213.236.199,10.12.202.113,TLSv1.2,147,"Client Key Exchange, Change Cipher Spec, Encrypted Handshake Message"
305,8.273626,10.12.202.113,10.213.236.199,TCP,54,443  >  50300 [ACK] Seq=6391 Ack=611 Win=15544 Len=0
306,8.344847,10.12.202.113,10.213.236.199,TLSv1.2,105,"Change Cipher Spec, Encrypted Handshake Message"
307,8.34587,10.213.236.199,10.12.202.113,TCP,54,50300  >  443 [ACK] Seq=611 Ack=6442 Win=65535 Len=0
308,8.346997,10.213.236.199,10.12.202.113,TLSv1.2,542,Application Data
311,8.347698,10.213.236.199,10.12.202.113,TCP,1514,50300  >  443 [ACK] Seq=1099 Ack=6442 Win=65535 Len=1460 [TCP PDU reassembled in 320]
312,8.3477,10.213.236.199,10.12.202.113,TCP,1514,50300  >  443 [ACK] Seq=2559 Ack=6442 Win=65535 Len=1460 [TCP PDU reassembled in 320]
313,8.347701,10.213.236.199,10.12.202.113,TCP,1514,50300  >  443 [ACK] Seq=4019 Ack=6442 Win=65535 Len=1460 [TCP PDU reassembled in 320]
314,8.347702,10.213.236.199,10.12.202.113,TCP,1514,50300  >  443 [ACK] Seq=5479 Ack=6442 Win=65535 Len=1460 [TCP PDU reassembled in 320]
315,8.347703,10.213.236.199,10.12.202.113,TCP,1514,50300  >  443 [ACK] Seq=6939 Ack=6442 Win=65535 Len=1460 [TCP PDU reassembled in 320]
316,8.347704,10.213.236.199,10.12.202.113,TCP,1514,50300  >  443 [ACK] Seq=8399 Ack=6442 Win=65535 Len=1460 [TCP PDU reassembled in 320]
317,8.347706,10.213.236.199,10.12.202.113,TCP,1514,50300  >  443 [ACK] Seq=9859 Ack=6442 Win=65535 Len=1460 [TCP PDU reassembled in 320]
318,8.347707,10.213.236.199,10.12.202.113,TCP,1514,50300  >  443 [ACK] Seq=11319 Ack=6442 Win=65535 Len=1460 [TCP PDU reassembled in 320]
319,8.347708,10.213.236.199,10.12.202.113,TCP,1514,50300  >  443 [ACK] Seq=12779 Ack=6442 Win=65535 Len=1460 [TCP PDU reassembled in 320]
320,8.347709,10.213.236.199,10.12.202.113,TLSv1.2,494,Application Data
325,8.349466,10.12.202.113,10.213.236.199,TCP,54,443  >  50300 [ACK] Seq=6442 Ack=1099 Win=16616 Len=0
326,8.350763,10.12.202.113,10.213.236.199,TCP,54,443  >  50300 [ACK] Seq=6442 Ack=2559 Win=18980 Len=0
327,8.350768,10.12.202.113,10.213.236.199,TCP,54,443  >  50300 [ACK] Seq=6442 Ack=4019 Win=21900 Len=0
328,8.3508,10.12.202.113,10.213.236.199,TCP,54,443  >  50300 [ACK] Seq=6442 Ack=5479 Win=24820 Len=0
329,8.352791,10.12.202.113,10.213.236.199,TCP,54,443  >  50300 [ACK] Seq=6442 Ack=6939 Win=27740 Len=0
330,8.352792,10.12.202.113,10.213.236.199,TCP,54,443  >  50300 [ACK] Seq=6442 Ack=11319 Win=36500 Len=0
332,8.352794,10.12.202.113,10.213.236.199,TCP,54,443  >  50300 [ACK] Seq=6442 Ack=12779 Win=39420 Len=0
333,8.352794,10.12.202.113,10.213.236.199,TCP,54,443  >  50300 [ACK] Seq=6442 Ack=14679 Win=42340 Len=0
334,8.352795,10.12.202.113,10.213.236.199,TCP,54,443  >  50300 [ACK] Seq=6442 Ack=8399 Win=30660 Len=0
335,8.352795,10.12.202.113,10.213.236.199,TCP,54,443  >  50300 [ACK] Seq=6442 Ack=9859 Win=33580 Len=0
344,8.601188,10.12.202.113,10.213.236.199,TCP,1514,"443  >  50300 [PSH, ACK] Seq=6442 Ack=14679 Win=42340 Len=1460 [TCP PDU reassembled in 358]"
345,8.601191,10.12.202.113,10.213.236.199,TCP,1514,443  >  50300 [ACK] Seq=7902 Ack=14679 Win=42340 Len=1460 [TCP PDU reassembled in 358]
346,8.601192,10.12.202.113,10.213.236.199,TCP,1514,443  >  50300 [ACK] Seq=9362 Ack=14679 Win=42340 Len=1460 [TCP PDU reassembled in 358]
347,8.601193,10.12.202.113,10.213.236.199,TCP,1514,443  >  50300 [ACK] Seq=10822 Ack=14679 Win=42340 Len=1460 [TCP PDU reassembled in 358]
348,8.601385,10.213.236.199,10.12.202.113,TCP,54,50300  >  443 [ACK] Seq=14679 Ack=12282 Win=65535 Len=0
349,8.604915,10.12.202.113,10.213.236.199,TCP,1514,"443  >  50300 [PSH, ACK] Seq=12282 Ack=14679 Win=42340 Len=1460 [TCP PDU reassembled in 358]"
350,8.604917,10.12.202.113,10.213.236.199,TCP,1514,443  >  50300 [ACK] Seq=13742 Ack=14679 Win=42340 Len=1460 [TCP PDU reassembled in 358]
351,8.604918,10.12.202.113,10.213.236.199,TCP,1514,"443  >  50300 [PSH, ACK] Seq=15202 Ack=14679 Win=42340 Len=1460 [TCP PDU reassembled in 358]"
352,8.605053,10.213.236.199,10.12.202.113,TCP,54,50300  >  443 [ACK] Seq=14679 Ack=16662 Win=65535 Len=0
353,8.605298,10.12.202.113,10.213.236.199,TCP,1514,443  >  50300 [ACK] Seq=16662 Ack=14679 Win=42340 Len=1460 [TCP PDU reassembled in 358]
354,8.6053,10.12.202.113,10.213.236.199,TCP,1514,"443  >  50300 [PSH, ACK] Seq=18122 Ack=14679 Win=42340 Len=1460 [TCP PDU reassembled in 358]"
355,8.605523,10.213.236.199,10.12.202.113,TCP,54,50300  >  443 [ACK] Seq=14679 Ack=19582 Win=65535 Len=0
356,8.607582,10.12.202.113,10.213.236.199,TCP,1514,"443  >  50300 [PSH, ACK] Seq=19582 Ack=14679 Win=42340 Len=1460 [TCP PDU reassembled in 358]"
357,8.607584,10.12.202.113,10.213.236.199,TCP,1514,443  >  50300 [ACK] Seq=21042 Ack=14679 Win=42340 Len=1460 [TCP PDU reassembled in 358]
358,8.607585,10.12.202.113,10.213.236.199,TLSv1.2,1514,Application Data
359,8.607753,10.213.236.199,10.12.202.113,TCP,54,50300  >  443 [ACK] Seq=14679 Ack=23962 Win=65535 Len=0
360,8.608935,10.12.202.113,10.213.236.199,TCP,1514,443  >  50300 [ACK] Seq=23962 Ack=14679 Win=42340 Len=1460 [TCP PDU reassembled in 379]
361,8.608937,10.12.202.113,10.213.236.199,TCP,1514,443  >  50300 [ACK] Seq=25422 Ack=14679 Win=42340 Len=1460 [TCP PDU reassembled in 379]
362,8.609045,10.213.236.199,10.12.202.113,TCP,54,50300  >  443 [ACK] Seq=14679 Ack=26882 Win=65535 Len=0
363,8.6103,10.12.202.113,10.213.236.199,TCP,1514,443  >  50300 [ACK] Seq=26882 Ack=14679 Win=42340 Len=1460 [TCP PDU reassembled in 379]
364,8.610302,10.12.202.113,10.213.236.199,TCP,1514,443  >  50300 [ACK] Seq=28342 Ack=14679 Win=42340 Len=1460 [TCP PDU reassembled in 379]
365,8.610303,10.12.202.113,10.213.236.199,TCP,1514,443  >  50300 [ACK] Seq=29802 Ack=14679 Win=42340 Len=1460 [TCP PDU reassembled in 379]
366,8.610389,10.213.236.199,10.12.202.113,TCP,54,50300  >  443 [ACK] Seq=14679 Ack=31262 Win=65535 Len=0
367,8.611942,10.12.202.113,10.213.236.199,TCP,1514,443  >  50300 [ACK] Seq=31262 Ack=14679 Win=42340 Len=1460 [TCP PDU reassembled in 379]
368,8.611944,10.12.202.113,10.213.236.199,TCP,1514,443  >  50300 [ACK] Seq=32722 Ack=14679 Win=42340 Len=1460 [TCP PDU reassembled in 379]
369,8.612045,10.213.236.199,10.12.202.113,TCP,54,50300  >  443 [ACK] Seq=14679 Ack=34182 Win=65535 Len=0
370,8.613125,10.12.202.113,10.213.236.199,TCP,1514,443  >  50300 [ACK] Seq=34182 Ack=14679 Win=42340 Len=1460 [TCP PDU reassembled in 379]
371,8.613127,10.12.202.113,10.213.236.199,TCP,1514,443  >  50300 [ACK] Seq=35642 Ack=14679 Win=42340 Len=1460 [TCP PDU reassembled in 379]
372,8.613128,10.12.202.113,10.213.236.199,TCP,1514,443  >  50300 [ACK] Seq=37102 Ack=14679 Win=42340 Len=1460 [TCP PDU reassembled in 379]
373,8.613234,10.213.236.199,10.12.202.113,TCP,54,50300  >  443 [ACK] Seq=14679 Ack=38562 Win=65535 Len=0
379,8.614582,10.12.202.113,10.213.236.199,TLSv1.2,1514,Application Data
380,8.614584,10.12.202.113,10.213.236.199,TCP,1514,443  >  50300 [ACK] Seq=40022 Ack=14679 Win=42340 Len=1460 [TCP PDU reassembled in 396]
382,8.614755,10.213.236.199,10.12.202.113,TCP,54,50300  >  443 [ACK] Seq=14679 Ack=41482 Win=65535 Len=0
383,8.615917,10.12.202.113,10.213.236.199,TCP,1514,443  >  50300 [ACK] Seq=41482 Ack=14679 Win=42340 Len=1460 [TCP PDU reassembled in 396]
384,8.615919,10.12.202.113,10.213.236.199,TCP,1514,443  >  50300 [ACK] Seq=42942 Ack=14679 Win=42340 Len=1460 [TCP PDU reassembled in 396]
385,8.615921,10.12.202.113,10.213.236.199,TCP,1514,443  >  50300 [ACK] Seq=44402 Ack=14679 Win=42340 Len=1460 [TCP PDU reassembled in 396]
386,8.616023,10.213.236.199,10.12.202.113,TCP,54,50300  >  443 [ACK] Seq=14679 Ack=45862 Win=65535 Len=0
387,8.617246,10.12.202.113,10.213.236.199,TCP,1514,443  >  50300 [ACK] Seq=45862 Ack=14679 Win=42340 Len=1460 [TCP PDU reassembled in 396]
388,8.617247,10.12.202.113,10.213.236.199,TCP,1514,443  >  50300 [ACK] Seq=47322 Ack=14679 Win=42340 Len=1460 [TCP PDU reassembled in 396]
389,8.617356,10.213.236.199,10.12.202.113,TCP,54,50300  >  443 [ACK] Seq=14679 Ack=48782 Win=65535 Len=0
390,8.618494,10.12.202.113,10.213.236.199,TCP,1514,"443  >  50300 [PSH, ACK] Seq=48782 Ack=14679 Win=42340 Len=1460 [TCP PDU reassembled in 396]"
391,8.618575,10.213.236.199,10.12.202.113,TCP,54,50300  >  443 [ACK] Seq=14679 Ack=50242 Win=65535 Len=0
392,8.670343,10.12.202.113,10.213.236.199,TCP,1514,443  >  50300 [ACK] Seq=50242 Ack=14679 Win=42340 Len=1460 [TCP PDU reassembled in 396]
393,8.670346,10.12.202.113,10.213.236.199,TCP,1514,443  >  50300 [ACK] Seq=51702 Ack=14679 Win=42340 Len=1460 [TCP PDU reassembled in 396]
394,8.670347,10.12.202.113,10.213.236.199,TCP,1514,443  >  50300 [ACK] Seq=53162 Ack=14679 Win=42340 Len=1460 [TCP PDU reassembled in 396]
395,8.670527,10.213.236.199,10.12.202.113,TCP,54,50300  >  443 [ACK] Seq=14679 Ack=54622 Win=65535 Len=0
396,8.670548,10.12.202.113,10.213.236.199,TLSv1.2,1514,Application Data
397,8.670549,10.12.202.113,10.213.236.199,TCP,1514,443  >  50300 [ACK] Seq=56082 Ack=14679 Win=42340 Len=1460 [TCP PDU reassembled in 414]
398,8.670743,10.213.236.199,10.12.202.113,TCP,54,50300  >  443 [ACK] Seq=14679 Ack=57542 Win=65535 Len=0
400,8.673161,10.12.202.113,10.213.236.199,TCP,1514,443  >  50300 [ACK] Seq=60462 Ack=14679 Win=42340 Len=1460 [TCP PDU reassembled in 414]
401,8.673162,10.12.202.113,10.213.236.199,TCP,1514,443  >  50300 [ACK] Seq=61922 Ack=14679 Win=42340 Len=1460 [TCP PDU reassembled in 414]
403,8.674284,10.12.202.113,10.213.236.199,TCP,1514,443  >  50300 [ACK] Seq=63382 Ack=14679 Win=42340 Len=1460 [TCP PDU reassembled in 414]
405,8.674587,10.12.202.113,10.213.236.199,TCP,1514,443  >  50300 [ACK] Seq=64842 Ack=14679 Win=42340 Len=1460 [TCP PDU reassembled in 414]
407,8.675937,10.12.202.113,10.213.236.199,TCP,1514,443  >  50300 [ACK] Seq=66302 Ack=14679 Win=42340 Len=1460 [TCP PDU reassembled in 414]
409,8.676733,10.12.202.113,10.213.236.199,TCP,1514,443  >  50300 [ACK] Seq=67762 Ack=14679 Win=42340 Len=1460 [TCP PDU reassembled in 414]
412,8.677533,10.213.236.199,10.12.202.113,TCP,54,50300  >  443 [ACK] Seq=14679 Ack=69222 Win=65535 Len=0
413,8.680103,10.12.202.113,10.213.236.199,TCP,1514,443  >  50300 [ACK] Seq=69222 Ack=14679 Win=42340 Len=1460 [TCP PDU reassembled in 414]
414,8.680105,10.12.202.113,10.213.236.199,TLSv1.2,1514,Application Data
415,8.680106,10.12.202.113,10.213.236.199,TCP,1514,443  >  50300 [ACK] Seq=72142 Ack=14679 Win=42340 Len=1460 [TCP PDU reassembled in 430]
416,8.680107,10.12.202.113,10.213.236.199,TCP,1514,443  >  50300 [ACK] Seq=73602 Ack=14679 Win=42340 Len=1460 [TCP PDU reassembled in 430]
417,8.680251,10.213.236.199,10.12.202.113,TCP,54,50300  >  443 [ACK] Seq=14679 Ack=75062 Win=65535 Len=0
418,8.682794,10.12.202.113,10.213.236.199,TCP,1514,443  >  50300 [ACK] Seq=75062 Ack=14679 Win=42340 Len=1460 [TCP PDU reassembled in 430]
419,8.682795,10.12.202.113,10.213.236.199,TCP,1514,443  >  50300 [ACK] Seq=76522 Ack=14679 Win=42340 Len=1460 [TCP PDU reassembled in 430]
420,8.682797,10.12.202.113,10.213.236.199,TCP,1514,443  >  50300 [ACK] Seq=77982 Ack=14679 Win=42340 Len=1460 [TCP PDU reassembled in 430]
421,8.683044,10.213.236.199,10.12.202.113,TCP,54,50300  >  443 [ACK] Seq=14679 Ack=79442 Win=65535 Len=0
422,8.685628,10.12.202.113,10.213.236.199,TCP,1514,443  >  50300 [ACK] Seq=79442 Ack=14679 Win=42340 Len=1460 [TCP PDU reassembled in 430]
423,8.685629,10.12.202.113,10.213.236.199,TCP,1514,443  >  50300 [ACK] Seq=80902 Ack=14679 Win=42340 Len=1460 [TCP PDU reassembled in 430]
424,8.685631,10.12.202.113,10.213.236.199,TCP,1514,"443  >  50300 [PSH, ACK] Seq=82362 Ack=14679 Win=42340 Len=1460 [TCP PDU reassembled in 430]"
425,8.685711,10.213.236.199,10.12.202.113,TCP,54,50300  >  443 [ACK] Seq=14679 Ack=83822 Win=65535 Len=0
426,8.688325,10.12.202.113,10.213.236.199,TCP,1514,443  >  50300 [ACK] Seq=83822 Ack=14679 Win=42340 Len=1460 [TCP PDU reassembled in 430]
427,8.688327,10.12.202.113,10.213.236.199,TCP,1514,443  >  50300 [ACK] Seq=85282 Ack=14679 Win=42340 Len=1460 [TCP PDU reassembled in 430]
428,8.688328,10.12.202.113,10.213.236.199,TCP,1514,443  >  50300 [ACK] Seq=86742 Ack=14679 Win=42340 Len=1460 [TCP PDU reassembled in 430]
429,8.688453,10.213.236.199,10.12.202.113,TCP,54,50300  >  443 [ACK] Seq=14679 Ack=88202 Win=65535 Len=0
430,8.689052,10.12.202.113,10.213.236.199,TLSv1.2,1514,Application Data
431,8.69028,10.213.236.199,10.12.202.113,TCP,54,50300  >  443 [ACK] Seq=14679 Ack=89662 Win=65535 Len=0
432,8.690736,10.12.202.113,10.213.236.199,TCP,1514,443  >  50300 [ACK] Seq=89662 Ack=14679 Win=42340 Len=1460 [TCP PDU reassembled in 453]
433,8.690738,10.12.202.113,10.213.236.199,TCP,1514,443  >  50300 [ACK] Seq=91122 Ack=14679 Win=42340 Len=1460 [TCP PDU reassembled in 453]
434,8.69074,10.12.202.113,10.213.236.199,TCP,1514,443  >  50300 [ACK] Seq=92582 Ack=14679 Win=42340 Len=1460 [TCP PDU reassembled in 453]
435,8.69126,10.12.202.113,10.213.236.199,TCP,1514,443  >  50300 [ACK] Seq=94042 Ack=14679 Win=42340 Len=1460 [TCP PDU reassembled in 453]
436,8.691328,10.213.236.199,10.12.202.113,TCP,54,50300  >  443 [ACK] Seq=14679 Ack=94042 Win=65535 Len=0
437,8.691448,10.213.236.199,10.12.202.113,TCP,54,50300  >  443 [ACK] Seq=14679 Ack=95502 Win=65535 Len=0
438,8.692564,10.12.202.113,10.213.236.199,TCP,1514,443  >  50300 [ACK] Seq=95502 Ack=14679 Win=42340 Len=1460 [TCP PDU reassembled in 453]
439,8.692734,10.213.236.199,10.12.202.113,TCP,54,50300  >  443 [ACK] Seq=14679 Ack=96962 Win=65535 Len=0
440,8.693443,10.12.202.113,10.213.236.199,TCP,1514,443  >  50300 [ACK] Seq=96962 Ack=14679 Win=42340 Len=1460 [TCP PDU reassembled in 453]
441,8.693589,10.213.236.199,10.12.202.113,TCP,54,50300  >  443 [ACK] Seq=14679 Ack=98422 Win=65535 Len=0
442,8.693791,10.12.202.113,10.213.236.199,TCP,1514,443  >  50300 [ACK] Seq=98422 Ack=14679 Win=42340 Len=1460 [TCP PDU reassembled in 453]
443,8.693793,10.12.202.113,10.213.236.199,TCP,1514,443  >  50300 [ACK] Seq=99882 Ack=14679 Win=42340 Len=1460 [TCP PDU reassembled in 453]
444,8.693896,10.213.236.199,10.12.202.113,TCP,54,50300  >  443 [ACK] Seq=14679 Ack=101342 Win=65535 Len=0
445,8.694049,10.12.202.113,10.213.236.199,TCP,1514,443  >  50300 [ACK] Seq=101342 Ack=14679 Win=42340 Len=1460 [TCP PDU reassembled in 453]
446,8.694257,10.213.236.199,10.12.202.113,TCP,54,50300  >  443 [ACK] Seq=14679 Ack=102802 Win=65535 Len=0
447,8.694613,10.12.202.113,10.213.236.199,TCP,1514,443  >  50300 [ACK] Seq=102802 Ack=14679 Win=42340 Len=1460 [TCP PDU reassembled in 453]
448,8.694703,10.213.236.199,10.12.202.113,TCP,54,50300  >  443 [ACK] Seq=14679 Ack=104262 Win=65535 Len=0
453,8.695819,10.12.202.113,10.213.236.199,TLSv1.2,1514,Application Data
454,8.695953,10.213.236.199,10.12.202.113,TCP,54,50300  >  443 [ACK] Seq=14679 Ack=105722 Win=65535 Len=0
457,8.697003,10.12.202.113,10.213.236.199,TCP,1514,443  >  50300 [ACK] Seq=105722 Ack=14679 Win=42340 Len=1460 [TCP PDU reassembled in 478]
458,8.697005,10.12.202.113,10.213.236.199,TCP,1514,"443  >  50300 [PSH, ACK] Seq=107182 Ack=14679 Win=42340 Len=1460 [TCP PDU reassembled in 478]"
459,8.697116,10.213.236.199,10.12.202.113,TCP,54,50300  >  443 [ACK] Seq=14679 Ack=108642 Win=65535 Len=0
460,8.741425,10.12.202.113,10.213.236.199,TCP,1514,443  >  50300 [ACK] Seq=108642 Ack=14679 Win=42340 Len=1460 [TCP PDU reassembled in 478]
461,8.741427,10.12.202.113,10.213.236.199,TCP,1514,443  >  50300 [ACK] Seq=110102 Ack=14679 Win=42340 Len=1460 [TCP PDU reassembled in 478]
462,8.741429,10.12.202.113,10.213.236.199,TCP,1514,443  >  50300 [ACK] Seq=111562 Ack=14679 Win=42340 Len=1460 [TCP PDU reassembled in 478]
463,8.741695,10.12.202.113,10.213.236.199,TCP,1514,443  >  50300 [ACK] Seq=113022 Ack=14679 Win=42340 Len=1460 [TCP PDU reassembled in 478]
464,8.741697,10.12.202.113,10.213.236.199,TCP,1514,443  >  50300 [ACK] Seq=114482 Ack=14679 Win=42340 Len=1460 [TCP PDU reassembled in 478]
465,8.74175,10.213.236.199,10.12.202.113,TCP,54,50300  >  443 [ACK] Seq=14679 Ack=113022 Win=65535 Len=0
466,8.741995,10.213.236.199,10.12.202.113,TCP,54,50300  >  443 [ACK] Seq=14679 Ack=115942 Win=65535 Len=0
468,8.744103,10.12.202.113,10.213.236.199,TCP,1514,443  >  50300 [ACK] Seq=118862 Ack=14679 Win=42340 Len=1460 [TCP PDU reassembled in 478]
469,8.744105,10.12.202.113,10.213.236.199,TCP,1514,443  >  50300 [ACK] Seq=120322 Ack=14679 Win=42340 Len=1460 [TCP PDU reassembled in 478]
471,8.745441,10.12.202.113,10.213.236.199,TCP,1514,443  >  50300 [ACK] Seq=121782 Ack=14679 Win=42340 Len=1460 [TCP PDU reassembled in 488]
472,8.745443,10.12.202.113,10.213.236.199,TCP,1514,443  >  50300 [ACK] Seq=123242 Ack=14679 Win=42340 Len=1460 [TCP PDU reassembled in 488]
474,8.747188,10.12.202.113,10.213.236.199,TCP,1514,443  >  50300 [ACK] Seq=124702 Ack=14679 Win=42340 Len=1460 [TCP PDU reassembled in 488]
476,8.748008,10.12.202.113,10.213.236.199,TCP,1514,443  >  50300 [ACK] Seq=126162 Ack=14679 Win=42340 Len=1460 [TCP PDU reassembled in 488]
479,8.749829,10.213.236.199,10.12.202.113,TCP,54,50300  >  443 [ACK] Seq=14679 Ack=127622 Win=65535 Len=0
480,8.752552,10.12.202.113,10.213.236.199,TCP,1514,443  >  50300 [ACK] Seq=127622 Ack=14679 Win=42340 Len=1460 [TCP PDU reassembled in 488]
481,8.752555,10.12.202.113,10.213.236.199,TCP,1514,443  >  50300 [ACK] Seq=129082 Ack=14679 Win=42340 Len=1460 [TCP PDU reassembled in 488]
482,8.752556,10.12.202.113,10.213.236.199,TCP,1514,443  >  50300 [ACK] Seq=130542 Ack=14679 Win=42340 Len=1460 [TCP PDU reassembled in 488]
483,8.752713,10.213.236.199,10.12.202.113,TCP,54,50300  >  443 [ACK] Seq=14679 Ack=132002 Win=65535 Len=0
484,8.755161,10.12.202.113,10.213.236.199,TCP,1514,443  >  50300 [ACK] Seq=132002 Ack=14679 Win=42340 Len=1460 [TCP PDU reassembled in 488]
485,8.755163,10.12.202.113,10.213.236.199,TCP,1514,443  >  50300 [ACK] Seq=133462 Ack=14679 Win=42340 Len=1460 [TCP PDU reassembled in 488]
486,8.755165,10.12.202.113,10.213.236.199,TCP,1514,443  >  50300 [ACK] Seq=134922 Ack=14679 Win=42340 Len=1460 [TCP PDU reassembled in 488]
487,8.755298,10.213.236.199,10.12.202.113,TCP,54,50300  >  443 [ACK] Seq=14679 Ack=136382 Win=65535 Len=0
488,8.757922,10.12.202.113,10.213.236.199,TLSv1.2,1514,Application Data
489,8.757925,10.12.202.113,10.213.236.199,TCP,1514,443  >  50300 [ACK] Seq=137842 Ack=14679 Win=42340 Len=1460 [TCP PDU reassembled in 504]
490,8.757926,10.12.202.113,10.213.236.199,TCP,1514,443  >  50300 [ACK] Seq=139302 Ack=14679 Win=42340 Len=1460 [TCP PDU reassembled in 504]
491,8.758088,10.213.236.199,10.12.202.113,TCP,54,50300  >  443 [ACK] Seq=14679 Ack=140762 Win=65535 Len=0
492,8.761232,10.12.202.113,10.213.236.199,TCP,1514,"443  >  50300 [PSH, ACK] Seq=140762 Ack=14679 Win=42340 Len=1460 [TCP PDU reassembled in 504]"
493,8.761234,10.12.202.113,10.213.236.199,TCP,1514,443  >  50300 [ACK] Seq=142222 Ack=14679 Win=42340 Len=1460 [TCP PDU reassembled in 504]
494,8.761236,10.12.202.113,10.213.236.199,TCP,1514,443  >  50300 [ACK] Seq=143682 Ack=14679 Win=42340 Len=1460 [TCP PDU reassembled in 504]
495,8.761237,10.12.202.113,10.213.236.199,TCP,1514,443  >  50300 [ACK] Seq=145142 Ack=14679 Win=42340 Len=1460 [TCP PDU reassembled in 504]
496,8.761368,10.213.236.199,10.12.202.113,TCP,54,50300  >  443 [ACK] Seq=14679 Ack=146602 Win=65535 Len=0
497,8.764216,10.12.202.113,10.213.236.199,TCP,1514,443  >  50300 [ACK] Seq=146602 Ack=14679 Win=42340 Len=1460 [TCP PDU reassembled in 504]
498,8.764218,10.12.202.113,10.213.236.199,TCP,1514,443  >  50300 [ACK] Seq=148062 Ack=14679 Win=42340 Len=1460 [TCP PDU reassembled in 504]
499,8.76422,10.12.202.113,10.213.236.199,TCP,1514,443  >  50300 [ACK] Seq=149522 Ack=14679 Win=42340 Len=1460 [TCP PDU reassembled in 504]
500,8.764349,10.213.236.199,10.12.202.113,TCP,54,50300  >  443 [ACK] Seq=14679 Ack=150982 Win=65535 Len=0
501,8.764719,10.12.202.113,10.213.236.199,TCP,1514,443  >  50300 [ACK] Seq=150982 Ack=14679 Win=42340 Len=1460 [TCP PDU reassembled in 504]
502,8.764721,10.12.202.113,10.213.236.199,TCP,1514,443  >  50300 [ACK] Seq=152442 Ack=14679 Win=42340 Len=1460 [TCP PDU reassembled in 504]
503,8.76483,10.213.236.199,10.12.202.113,TCP,54,50300  >  443 [ACK] Seq=14679 Ack=153902 Win=65535 Len=0
504,8.766431,10.12.202.113,10.213.236.199,TLSv1.2,1514,Application Data
505,8.766596,10.213.236.199,10.12.202.113,TCP,54,50300  >  443 [ACK] Seq=14679 Ack=155362 Win=65535 Len=0
506,8.766823,10.12.202.113,10.213.236.199,TCP,1514,443  >  50300 [ACK] Seq=155362 Ack=14679 Win=42340 Len=1460 [TCP PDU reassembled in 521]
507,8.766825,10.12.202.113,10.213.236.199,TCP,1514,443  >  50300 [ACK] Seq=156822 Ack=14679 Win=42340 Len=1460 [TCP PDU reassembled in 521]
508,8.767293,10.213.236.199,10.12.202.113,TCP,54,50300  >  443 [ACK] Seq=14679 Ack=158282 Win=65535 Len=0
509,8.768261,10.12.202.113,10.213.236.199,TCP,1514,443  >  50300 [ACK] Seq=158282 Ack=14679 Win=42340 Len=1460 [TCP PDU reassembled in 521]
510,8.768496,10.213.236.199,10.12.202.113,TCP,54,50300  >  443 [ACK] Seq=14679 Ack=159742 Win=65535 Len=0
511,8.768585,10.12.202.113,10.213.236.199,TCP,1514,443  >  50300 [ACK] Seq=159742 Ack=14679 Win=42340 Len=1460 [TCP PDU reassembled in 521]
512,8.768655,10.213.236.199,10.12.202.113,TCP,54,50300  >  443 [ACK] Seq=14679 Ack=161202 Win=65535 Len=0
513,8.769242,10.12.202.113,10.213.236.199,TCP,1514,443  >  50300 [ACK] Seq=161202 Ack=14679 Win=42340 Len=1460 [TCP PDU reassembled in 521]
514,8.769244,10.12.202.113,10.213.236.199,TCP,1514,443  >  50300 [ACK] Seq=162662 Ack=14679 Win=42340 Len=1460 [TCP PDU reassembled in 521]
515,8.769332,10.213.236.199,10.12.202.113,TCP,54,50300  >  443 [ACK] Seq=14679 Ack=164122 Win=65535 Len=0
516,8.770431,10.12.202.113,10.213.236.199,TCP,1514,443  >  50300 [ACK] Seq=164122 Ack=14679 Win=42340 Len=1460 [TCP PDU reassembled in 521]
517,8.770433,10.12.202.113,10.213.236.199,TCP,1514,443  >  50300 [ACK] Seq=165582 Ack=14679 Win=42340 Len=1460 [TCP PDU reassembled in 521]
518,8.770434,10.12.202.113,10.213.236.199,TCP,1514,443  >  50300 [ACK] Seq=167042 Ack=14679 Win=42340 Len=1460 [TCP PDU reassembled in 521]
519,8.770525,10.213.236.199,10.12.202.113,TCP,54,50300  >  443 [ACK] Seq=14679 Ack=168502 Win=65535 Len=0
520,8.772088,10.12.202.113,10.213.236.199,TCP,1514,443  >  50300 [ACK] Seq=168502 Ack=14679 Win=42340 Len=1460 [TCP PDU reassembled in 521]
521,8.77209,10.12.202.113,10.213.236.199,TLSv1.2,1514,Application Data
522,8.772091,10.12.202.113,10.213.236.199,TCP,1514,"443  >  50300 [PSH, ACK] Seq=171422 Ack=14679 Win=42340 Len=1460 [TCP PDU reassembled in 536]"
523,8.772223,10.213.236.199,10.12.202.113,TCP,54,50300  >  443 [ACK] Seq=14679 Ack=172882 Win=65535 Len=0
524,8.811569,10.12.202.113,10.213.236.199,TCP,1514,443  >  50300 [ACK] Seq=172882 Ack=14679 Win=42340 Len=1460 [TCP PDU reassembled in 536]
525,8.811572,10.12.202.113,10.213.236.199,TCP,1514,"443  >  50300 [PSH, ACK] Seq=174342 Ack=14679 Win=42340 Len=1460 [TCP PDU reassembled in 536]"
526,8.811573,10.12.202.113,10.213.236.199,TCP,1514,443  >  50300 [ACK] Seq=175802 Ack=14679 Win=42340 Len=1460 [TCP PDU reassembled in 536]
527,8.811714,10.213.236.199,10.12.202.113,TCP,54,50300  >  443 [ACK] Seq=14679 Ack=177262 Win=65535 Len=0
528,8.812166,10.12.202.113,10.213.236.199,TCP,1514,443  >  50300 [ACK] Seq=177262 Ack=14679 Win=42340 Len=1460 [TCP PDU reassembled in 536]
529,8.812168,10.12.202.113,10.213.236.199,TCP,1514,443  >  50300 [ACK] Seq=178722 Ack=14679 Win=42340 Len=1460 [TCP PDU reassembled in 536]
530,8.812169,10.12.202.113,10.213.236.199,TCP,1514,"443  >  50300 [PSH, ACK] Seq=180182 Ack=14679 Win=42340 Len=1460 [TCP PDU reassembled in 536]"
531,8.812284,10.213.236.199,10.12.202.113,TCP,54,50300  >  443 [ACK] Seq=14679 Ack=181642 Win=65535 Len=0
532,8.813566,10.12.202.113,10.213.236.199,TCP,1514,443  >  50300 [ACK] Seq=181642 Ack=14679 Win=42340 Len=1460 [TCP PDU reassembled in 536]
533,8.813971,10.12.202.113,10.213.236.199,TCP,1514,"443  >  50300 [PSH, ACK] Seq=183102 Ack=14679 Win=42340 Len=1460 [TCP PDU reassembled in 536]"
534,8.813973,10.12.202.113,10.213.236.199,TCP,1514,443  >  50300 [ACK] Seq=184562 Ack=14679 Win=42340 Len=1460 [TCP PDU reassembled in 536]
535,8.814072,10.213.236.199,10.12.202.113,TCP,54,50300  >  443 [ACK] Seq=14679 Ack=186022 Win=65535 Len=0
536,8.815338,10.12.202.113,10.213.236.199,TLSv1.2,1514,Application Data
537,8.81534,10.12.202.113,10.213.236.199,TCP,1514,443  >  50300 [ACK] Seq=187482 Ack=14679 Win=42340 Len=1460 [TCP PDU reassembled in 557]
538,8.815341,10.12.202.113,10.213.236.199,TCP,1514,"443  >  50300 [PSH, ACK] Seq=188942 Ack=14679 Win=42340 Len=1460 [TCP PDU reassembled in 557]"
539,8.815567,10.213.236.199,10.12.202.113,TCP,54,50300  >  443 [ACK] Seq=14679 Ack=190402 Win=65535 Len=0
540,8.816736,10.12.202.113,10.213.236.199,TCP,1514,443  >  50300 [ACK] Seq=190402 Ack=14679 Win=42340 Len=1460 [TCP PDU reassembled in 557]
541,8.816739,10.12.202.113,10.213.236.199,TCP,1514,"443  >  50300 [PSH, ACK] Seq=191862 Ack=14679 Win=42340 Len=1460 [TCP PDU reassembled in 557]"
542,8.81674,10.12.202.113,10.213.236.199,TCP,1514,443  >  50300 [ACK] Seq=193322 Ack=14679 Win=42340 Len=1460 [TCP PDU reassembled in 557]
544,8.816838,10.213.236.199,10.12.202.113,TCP,54,50300  >  443 [ACK] Seq=14679 Ack=194782 Win=65535 Len=0
549,8.818076,10.12.202.113,10.213.236.199,TCP,1514,"443  >  50300 [PSH, ACK] Seq=194782 Ack=14679 Win=42340 Len=1460 [TCP PDU reassembled in 557]"
550,8.818168,10.213.236.199,10.12.202.113,TCP,54,50300  >  443 [ACK] Seq=14679 Ack=196242 Win=65535 Len=0
552,8.818381,10.12.202.113,10.213.236.199,TCP,1514,"443  >  50300 [PSH, ACK] Seq=196242 Ack=14679 Win=42340 Len=1460 [TCP PDU reassembled in 557]"
553,8.818382,10.12.202.113,10.213.236.199,TCP,1514,443  >  50300 [ACK] Seq=197702 Ack=14679 Win=42340 Len=1460 [TCP PDU reassembled in 557]
554,8.81847,10.213.236.199,10.12.202.113,TCP,54,50300  >  443 [ACK] Seq=14679 Ack=199162 Win=65535 Len=0
555,8.820427,10.12.202.113,10.213.236.199,TCP,1514,443  >  50300 [ACK] Seq=199162 Ack=14679 Win=42340 Len=1460 [TCP PDU reassembled in 557]
556,8.82073,10.12.202.113,10.213.236.199,TCP,1514,"443  >  50300 [PSH, ACK] Seq=200622 Ack=14679 Win=42340 Len=1460 [TCP PDU reassembled in 557]"
557,8.820732,10.12.202.113,10.213.236.199,TLSv1.2,1514,Application Data
558,8.820831,10.213.236.199,10.12.202.113,TCP,54,50300  >  443 [ACK] Seq=14679 Ack=203542 Win=65535 Len=0
559,8.821166,10.12.202.113,10.213.236.199,TCP,1514,"443  >  50300 [PSH, ACK] Seq=203542 Ack=14679 Win=42340 Len=1460 [TCP PDU reassembled in 574]"
560,8.821167,10.12.202.113,10.213.236.199,TCP,1514,443  >  50300 [ACK] Seq=205002 Ack=14679 Win=42340 Len=1460 [TCP PDU reassembled in 574]
561,8.821245,10.213.236.199,10.12.202.113,TCP,54,50300  >  443 [ACK] Seq=14679 Ack=206462 Win=65535 Len=0
562,8.82147,10.12.202.113,10.213.236.199,TCP,1514,"443  >  50300 [PSH, ACK] Seq=206462 Ack=14679 Win=42340 Len=1460 [TCP PDU reassembled in 574]"
563,8.821532,10.213.236.199,10.12.202.113,TCP,54,50300  >  443 [ACK] Seq=14679 Ack=207922 Win=65535 Len=0
564,8.823081,10.12.202.113,10.213.236.199,TCP,1514,443  >  50300 [ACK] Seq=207922 Ack=14679 Win=42340 Len=1460 [TCP PDU reassembled in 574]
565,8.823549,10.12.202.113,10.213.236.199,TCP,1514,443  >  50300 [ACK] Seq=209382 Ack=14679 Win=42340 Len=1460 [TCP PDU reassembled in 574]
566,8.823551,10.12.202.113,10.213.236.199,TCP,1514,443  >  50300 [ACK] Seq=210842 Ack=14679 Win=42340 Len=1460 [TCP PDU reassembled in 574]
567,8.823659,10.213.236.199,10.12.202.113,TCP,54,50300  >  443 [ACK] Seq=14679 Ack=212302 Win=65535 Len=0
568,8.824841,10.12.202.113,10.213.236.199,TCP,1514,443  >  50300 [ACK] Seq=212302 Ack=14679 Win=42340 Len=1460 [TCP PDU reassembled in 574]
569,8.825156,10.12.202.113,10.213.236.199,TCP,1514,443  >  50300 [ACK] Seq=213762 Ack=14679 Win=42340 Len=1460 [TCP PDU reassembled in 574]
570,8.825158,10.12.202.113,10.213.236.199,TCP,1514,443  >  50300 [ACK] Seq=215222 Ack=14679 Win=42340 Len=1460 [TCP PDU reassembled in 574]
571,8.825253,10.213.236.199,10.12.202.113,TCP,54,50300  >  443 [ACK] Seq=14679 Ack=216682 Win=65535 Len=0
572,8.825457,10.12.202.113,10.213.236.199,TCP,1514,443  >  50300 [ACK] Seq=216682 Ack=14679 Win=42340 Len=1460 [TCP PDU reassembled in 574]
573,8.825774,10.12.202.113,10.213.236.199,TCP,1514,"443  >  50300 [PSH, ACK] Seq=218142 Ack=14679 Win=42340 Len=1460 [TCP PDU reassembled in 574]"
574,8.825776,10.12.202.113,10.213.236.199,TLSv1.2,1514,Application Data
575,8.825944,10.213.236.199,10.12.202.113,TCP,54,50300  >  443 [ACK] Seq=14679 Ack=221062 Win=65535 Len=0
576,8.827755,10.12.202.113,10.213.236.199,TCP,1514,443  >  50300 [ACK] Seq=221062 Ack=14679 Win=42340 Len=1460 [TCP PDU reassembled in 590]
577,8.827757,10.12.202.113,10.213.236.199,TCP,1514,443  >  50300 [ACK] Seq=222522 Ack=14679 Win=42340 Len=1460 [TCP PDU reassembled in 590]
578,8.827758,10.12.202.113,10.213.236.199,TCP,1514,"443  >  50300 [PSH, ACK] Seq=223982 Ack=14679 Win=42340 Len=1460 [TCP PDU reassembled in 590]"
579,8.827858,10.213.236.199,10.12.202.113,TCP,54,50300  >  443 [ACK] Seq=14679 Ack=225442 Win=65535 Len=0
580,8.829156,10.12.202.113,10.213.236.199,TCP,1514,"443  >  50300 [PSH, ACK] Seq=225442 Ack=14679 Win=42340 Len=1460 [TCP PDU reassembled in 590]"
581,8.829158,10.12.202.113,10.213.236.199,TCP,1514,443  >  50300 [ACK] Seq=226902 Ack=14679 Win=42340 Len=1460 [TCP PDU reassembled in 590]
582,8.829159,10.12.202.113,10.213.236.199,TCP,1514,443  >  50300 [ACK] Seq=228362 Ack=14679 Win=42340 Len=1460 [TCP PDU reassembled in 590]
583,8.829252,10.213.236.199,10.12.202.113,TCP,54,50300  >  443 [ACK] Seq=14679 Ack=229822 Win=65535 Len=0
584,8.830526,10.12.202.113,10.213.236.199,TCP,1514,"443  >  50300 [PSH, ACK] Seq=229822 Ack=14679 Win=42340 Len=1460 [TCP PDU reassembled in 590]"
585,8.830527,10.12.202.113,10.213.236.199,TCP,1514,"443  >  50300 [PSH, ACK] Seq=231282 Ack=14679 Win=42340 Len=1460 [TCP PDU reassembled in 590]"
586,8.830529,10.12.202.113,10.213.236.199,TCP,1514,"443  >  50300 [PSH, ACK] Seq=232742 Ack=14679 Win=42340 Len=1460 [TCP PDU reassembled in 590]"
587,8.830612,10.213.236.199,10.12.202.113,TCP,54,50300  >  443 [ACK] Seq=14679 Ack=234202 Win=65535 Len=0
588,8.832118,10.12.202.113,10.213.236.199,TCP,1514,"443  >  50300 [PSH, ACK] Seq=234202 Ack=14679 Win=42340 Len=1460 [TCP PDU reassembled in 590]"
589,8.832228,10.213.236.199,10.12.202.113,TCP,54,50300  >  443 [ACK] Seq=14679 Ack=235662 Win=65535 Len=0
590,8.832764,10.12.202.113,10.213.236.199,TLSv1.2,1514,Application Data
591,8.832877,10.213.236.199,10.12.202.113,TCP,54,50300  >  443 [ACK] Seq=14679 Ack=237122 Win=65535 Len=0
592,8.882618,10.12.202.113,10.213.236.199,TCP,1514,"443  >  50300 [PSH, ACK] Seq=237122 Ack=14679 Win=42340 Len=1460 [TCP PDU reassembled in 605]"
593,8.88262,10.12.202.113,10.213.236.199,TCP,1514,443  >  50300 [ACK] Seq=238582 Ack=14679 Win=42340 Len=1460 [TCP PDU reassembled in 605]
594,8.882622,10.12.202.113,10.213.236.199,TCP,1514,443  >  50300 [ACK] Seq=240042 Ack=14679 Win=42340 Len=1460 [TCP PDU reassembled in 605]
595,8.882744,10.213.236.199,10.12.202.113,TCP,54,50300  >  443 [ACK] Seq=14679 Ack=241502 Win=65535 Len=0
596,8.882865,10.12.202.113,10.213.236.199,TCP,1514,"443  >  50300 [PSH, ACK] Seq=241502 Ack=14679 Win=42340 Len=1460 [TCP PDU reassembled in 605]"
597,8.882866,10.12.202.113,10.213.236.199,TCP,1514,443  >  50300 [ACK] Seq=242962 Ack=14679 Win=42340 Len=1460 [TCP PDU reassembled in 605]
598,8.882945,10.213.236.199,10.12.202.113,TCP,54,50300  >  443 [ACK] Seq=14679 Ack=244422 Win=65535 Len=0
599,8.883009,10.12.202.113,10.213.236.199,TCP,1514,443  >  50300 [ACK] Seq=244422 Ack=14679 Win=42340 Len=1460 [TCP PDU reassembled in 605]
600,8.885163,10.12.202.113,10.213.236.199,TCP,1514,443  >  50300 [ACK] Seq=245882 Ack=14679 Win=42340 Len=1460 [TCP PDU reassembled in 605]
601,8.885164,10.12.202.113,10.213.236.199,TCP,1514,"443  >  50300 [PSH, ACK] Seq=247342 Ack=14679 Win=42340 Len=1460 [TCP PDU reassembled in 605]"
602,8.885166,10.12.202.113,10.213.236.199,TCP,1514,"443  >  50300 [PSH, ACK] Seq=248802 Ack=14679 Win=42340 Len=1460 [TCP PDU reassembled in 605]"
603,8.885255,10.213.236.199,10.12.202.113,TCP,54,50300  >  443 [ACK] Seq=14679 Ack=250262 Win=65535 Len=0
604,8.885465,10.12.202.113,10.213.236.199,TCP,1514,443  >  50300 [ACK] Seq=250262 Ack=14679 Win=42340 Len=1460 [TCP PDU reassembled in 605]
605,8.887474,10.12.202.113,10.213.236.199,TLSv1.2,1514,Application Data
606,8.887476,10.12.202.113,10.213.236.199,TCP,1514,"443  >  50300 [PSH, ACK] Seq=253182 Ack=14679 Win=42340 Len=1460 [TCP PDU reassembled in 621]"
607,8.8876,10.213.236.199,10.12.202.113,TCP,54,50300  >  443 [ACK] Seq=14679 Ack=254642 Win=65535 Len=0
608,8.888649,10.12.202.113,10.213.236.199,TCP,1514,443  >  50300 [ACK] Seq=254642 Ack=14679 Win=42340 Len=1460 [TCP PDU reassembled in 621]
609,8.888651,10.12.202.113,10.213.236.199,TCP,1514,"443  >  50300 [PSH, ACK] Seq=256102 Ack=14679 Win=42340 Len=1460 [TCP PDU reassembled in 621]"
610,8.888652,10.12.202.113,10.213.236.199,TCP,1514,"443  >  50300 [PSH, ACK] Seq=257562 Ack=14679 Win=42340 Len=1460 [TCP PDU reassembled in 621]"
611,8.888745,10.213.236.199,10.12.202.113,TCP,54,50300  >  443 [ACK] Seq=14679 Ack=259022 Win=65535 Len=0
612,8.888951,10.12.202.113,10.213.236.199,TCP,1514,"443  >  50300 [PSH, ACK] Seq=259022 Ack=14679 Win=42340 Len=1460 [TCP PDU reassembled in 621]"
613,8.88902,10.213.236.199,10.12.202.113,TCP,54,50300  >  443 [ACK] Seq=14679 Ack=260482 Win=65535 Len=0
614,8.890296,10.12.202.113,10.213.236.199,TCP,1514,"443  >  50300 [PSH, ACK] Seq=260482 Ack=14679 Win=42340 Len=1460 [TCP PDU reassembled in 621]"
615,8.89039,10.213.236.199,10.12.202.113,TCP,54,50300  >  443 [ACK] Seq=14679 Ack=261942 Win=65535 Len=0
616,8.890866,10.12.202.113,10.213.236.199,TCP,1514,"443  >  50300 [PSH, ACK] Seq=261942 Ack=14679 Win=42340 Len=1460 [TCP PDU reassembled in 621]"
617,8.890868,10.12.202.113,10.213.236.199,TCP,1514,443  >  50300 [ACK] Seq=263402 Ack=14679 Win=42340 Len=1460 [TCP PDU reassembled in 621]
618,8.89087,10.12.202.113,10.213.236.199,TCP,1514,"443  >  50300 [PSH, ACK] Seq=264862 Ack=14679 Win=42340 Len=1460 [TCP PDU reassembled in 621]"
619,8.891098,10.213.236.199,10.12.202.113,TCP,54,50300  >  443 [ACK] Seq=14679 Ack=266322 Win=65535 Len=0
620,8.891504,10.12.202.113,10.213.236.199,TCP,1514,"443  >  50300 [PSH, ACK] Seq=266322 Ack=14679 Win=42340 Len=1460 [TCP PDU reassembled in 621]"
621,8.891506,10.12.202.113,10.213.236.199,TLSv1.2,1514,Application Data
622,8.891637,10.213.236.199,10.12.202.113,TCP,54,50300  >  443 [ACK] Seq=14679 Ack=269242 Win=65535 Len=0
623,8.892905,10.12.202.113,10.213.236.199,TCP,1514,"443  >  50300 [PSH, ACK] Seq=269242 Ack=14679 Win=42340 Len=1460 [TCP PDU reassembled in 625]"
624,8.892984,10.213.236.199,10.12.202.113,TCP,54,50300  >  443 [ACK] Seq=14679 Ack=270702 Win=65535 Len=0
625,8.893612,10.12.202.113,10.213.236.199,TLSv1.2,637,Application Data
626,8.893786,10.213.236.199,10.12.202.113,TCP,54,50300  >  443 [ACK] Seq=14679 Ack=271285 Win=65535 Len=0
651,9.64404,10.12.202.113,10.213.236.199,TLSv1.2,85,Encrypted Alert
652,9.644041,10.12.202.113,10.213.236.199,TCP,54,"443  >  50294 [FIN, ACK] Seq=32 Ack=1 Win=21900 Len=0"
653,9.644776,10.213.236.199,10.12.202.113,TCP,54,50294  >  443 [ACK] Seq=1 Ack=32 Win=65535 Len=0
654,9.644778,10.213.236.199,10.12.202.113,TCP,54,50294  >  443 [ACK] Seq=1 Ack=33 Win=65535 Len=0
655,9.6454,10.213.236.199,10.12.202.113,TLSv1.2,85,Encrypted Alert
656,9.64572,10.213.236.199,10.12.202.113,TCP,54,"50294  >  443 [FIN, ACK] Seq=32 Ack=33 Win=65535 Len=0"
657,9.648026,10.12.202.113,10.213.236.199,TCP,54,443  >  50294 [ACK] Seq=33 Ack=32 Win=21900 Len=0
658,9.648314,10.12.202.113,10.213.236.199,TCP,54,443  >  50294 [ACK] Seq=33 Ack=33 Win=21900 Len=0
679,10.502705,10.213.236.199,10.14.70.201,IGMPv2,46,Membership Report group 224.0.0.251
810,13.700767,10.213.236.199,10.202.246.49,TCP,1514,49978  >  5223 [ACK] Seq=1 Ack=1 Win=2048 Len=1448 TSval=492045310 TSecr=2382006911 [TCP PDU reassembled in 815]
811,13.70077,10.213.236.199,10.202.246.49,TCP,1514,49978  >  5223 [ACK] Seq=1449 Ack=1 Win=2048 Len=1448 TSval=492045310 TSecr=2382006911 [TCP PDU reassembled in 815]
812,13.700772,10.213.236.199,10.202.246.49,TCP,1514,49978  >  5223 [ACK] Seq=2897 Ack=1 Win=2048 Len=1448 TSval=492045310 TSecr=2382006911 [TCP PDU reassembled in 815]
813,13.700773,10.213.236.199,10.202.246.49,TCP,1514,49978  >  5223 [ACK] Seq=4345 Ack=1 Win=2048 Len=1448 TSval=492045310 TSecr=2382006911 [TCP PDU reassembled in 815]
814,13.700774,10.213.236.199,10.202.246.49,TCP,1514,49978  >  5223 [ACK] Seq=5793 Ack=1 Win=2048 Len=1448 TSval=492045310 TSecr=2382006911 [TCP PDU reassembled in 815]
815,13.700775,10.213.236.199,10.202.246.49,TLSv1.2,346,Application Data
822,13.73057,10.202.246.49,10.213.236.199,TCP,66,5223  >  49978 [ACK] Seq=1 Ack=2897 Win=1491 Len=0 TSval=2382026454 TSecr=492045310
823,13.730572,10.202.246.49,10.213.236.199,TCP,78,5223  >  49978 [ACK] Seq=1 Ack=4345 Win=1480 Len=0 TSval=2382026454 TSecr=492045310 SLE=7241 SRE=7521
824,13.730573,10.202.246.49,10.213.236.199,TCP,78,5223  >  49978 [ACK] Seq=1 Ack=5793 Win=1469 Len=0 TSval=2382026454 TSecr=492045310 SLE=7241 SRE=7521
825,13.730573,10.202.246.49,10.213.236.199,TCP,66,5223  >  49978 [ACK] Seq=1 Ack=7521 Win=1456 Len=0 TSval=2382026454 TSecr=492045310
826,13.731193,10.202.246.49,10.213.236.199,TLSv1.2,92,Application Data
827,13.731195,10.202.246.49,10.213.236.199,TLSv1.2,128,Application Data
828,13.731423,10.213.236.199,10.202.246.49,TCP,66,49978  >  5223 [ACK] Seq=7521 Ack=89 Win=2046 Len=0 TSval=492045340 TSecr=2382026454
884,15.491608,10.26.231.137,10.213.236.199,TLSv1.2,117,"Application Data, Application Data"
885,15.49161,10.26.231.137,10.213.236.199,TCP,54,"443  >  50295 [FIN, ACK] Seq=64 Ack=1 Win=24820 Len=0"
886,15.492084,10.213.236.199,10.26.231.137,TCP,54,50295  >  443 [ACK] Seq=1 Ack=64 Win=65535 Len=0
